Title,Author,Rating,Reviews Count,URL,ISBN-10,Price,Binding
Home Cooking with Hema Subramanian,by Hema Subramanian,3.6,26.0,https://www.amazon.in/Home-Cooking-Hema-Subramanian/dp/8193539605,8193539605,,Paperback
TGT-PGT--GIC-KVS-RPS... Home-Science Solved papers & Practice Book,by yct,5.0,1.0,https://www.amazon.in/TGT-PGT-GIC-KVS-RPSC-DSSSB-NVS-JSSC-Home-Science-Solved-papers-Practice/dp/B078VLXFF4,B078VLXFF4,₹99,Paperback
Saving Parker (A Forever Home Novel Book 3),by Dan Walsh,5.0,1.0,https://www.amazon.in/Saving-Parker-Forever-Home-Novel-ebook/dp/B076G5DYVC,B076G5DYVC,₹365,Kindle Edition
The Complete Book Of Ayurvedic Home Remedies: A comprehensive guide to the ancient...,by Vasant Lad,4.5,77.0,https://www.amazon.in/Complete-Book-Ayurvedic-Home-Remedies/dp/0749927658,0749927658,₹703,Paperback
"The Life-Changing Magic of Tidying: A Simple, Effective Way to Banish Clutter...",by Marie Kondo - Unabridged,4.2,94.0,https://www.amazon.in/Life-Changing-Magic-Tidying-Effective-Clutter/dp/B079X1RQGV,B079X1RQGV,₹0,Audible Audiobook
"Social Media Marketing for Business 2019: Facebook, Instagram, YouTube, Twitter...",by Steven Sparrow,4.7,40.0,https://www.amazon.in/Social-Media-Marketing-Business-2019-ebook/dp/B07MFW73QF,B07MFW73QF,₹211,Kindle Edition
The Design of Everyday Things: Revised and Expanded Edition,by Don Norman - Unabridged,4.6,30.0,https://www.amazon.in/Design-Everyday-Things-Revised-Expanded/dp/B07L5SXBQP,B07L5SXBQP,₹0,Audible Audiobook
Dangerous Minds: Eight Riveting Profiles of Homegrown Terrorists,by S. Hussain Zaidi - Unabridged,4.4,44.0,https://www.amazon.in/Dangerous-Minds-Riveting-Homegrown-Terrorists/dp/B07M9CG1PY,B07M9CG1PY,₹0,Audible Audiobook
My First Library: Boxset of 10 Board Books for Kids,by Wonder House Books Editorial,4.6,107.0,https://www.amazon.in/My-First-Library-Boxset-Board/dp/9387779262,9387779262,₹499,Board book
"Solar Power Demystified: The Beginners Guide To Solar Power, Energy Independence...",by Lacho Pop MSE,3.5,64.0,https://www.amazon.in/Solar-Power-Demystified-Beginners-Independence-ebook/dp/B00UC9WWAK,B00UC9WWAK,₹0,Kindle Edition
Take Me Home: The Inspiring Stories of 20 Entrepreneurs from Small Town India...,by Rashmi Bansal - Unabridged,4.2,240.0,https://www.amazon.in/Take-Me-Home-Inspiring-Entrepreneurs/dp/B01N7T9OOI,B01N7T9OOI,₹0,Audible Audiobook
"Sehaz Artworks 'Baby Love' Wood Pasted Photo Album (22 cm x 16 cm x 4 cm, Brown)",by Sehaz Artworks,4.1,817.0,https://www.amazon.in/Sehaz-Artworks-Pasted-Photo-Album/dp/B01N9HW8YH,B01N9HW8YH,₹549,
"The Minimalist Home: A Room-by-Room Guide to a Decluttered, Refocused Life",by Joshua Becker - Unabridged,,,https://www.amazon.in/Minimalist-Home-Room-Room-Decluttered/dp/B07KWD78WQ,B07KWD78WQ,₹0,Audible Audiobook
My First Book of Patterns Pencil Control: Patterns Practice book for kids (Pattern...,by Wonder House Books Editorial,4.5,89.0,https://www.amazon.in/First-Book-Patterns-Pencil-Control/dp/9387779319,9387779319,₹99,Paperback
Anne -Kee Book Safe Style Money Cash Locker Jewellery Home Hidden Safe Box Dictionary...,by anne -kee,4.0,40.0,https://www.amazon.in/Locker-Jewellery-Hidden-Dictionary-Random/dp/B01E034CLU,B01E034CLU,₹690,
Facing Home (Over the Edge Book 1),by Danielle Stewart,4.7,97.0,https://www.amazon.in/Facing-Home-Over-Edge-Book-ebook/dp/B00LU7K1PQ,B00LU7K1PQ,₹0,Kindle Edition
Spark Joy,by Marie Kondo - Unabridged,4.6,23.0,https://www.amazon.in/Spark-Joy/dp/B071SF648H,B071SF648H,₹0,Audible Audiobook
Home Fire,by Kamila Shamsie - Unabridged,4.1,18.0,https://www.amazon.in/Home-Fire/dp/B078J98BWM,B078J98BWM,₹0,Audible Audiobook
"100 Contractor House Plans Construction Blueprints - Spec Homes, Cabins, Condos...",by John Davidson,3.4,19.0,https://www.amazon.in/Contractor-House-Plans-Construction-Blueprints-ebook/dp/B00BSZIGWA,B00BSZIGWA,₹0,Kindle Edition
"The Joy of Less: A Minimalist Guide to Declutter, Organize, and Simplify",by Francine Jay - Unabridged,4.1,8.0,https://www.amazon.in/Joy-Less-Minimalist-Declutter-Organize/dp/B079CP4PNG,B079CP4PNG,₹0,Audible Audiobook
Miss Peregrine's Home for Peculiar Children (Miss Peregrine's Peculiar Children),by Ransom Riggs - Illustrated,4.2,43.0,https://www.amazon.in/Miss-Peregrines-Home-Peculiar-Children/dp/1594746036,1594746036,₹299,Paperback
"Online Quality Store Holy Book Stand + Aasan Combo (Brown,Size = 2X2 Foot,Multi...",by Online Quality Store,4.3,15.0,https://www.amazon.in/Online-Quality-Store-Colour-inches/dp/B01FM9CVLY,B01FM9CVLY,₹419,
Brain Rules (Updated and Expanded): 12 Principles for Surviving and Thriving...,by John Medina - Unabridged,4.1,20.0,https://www.amazon.in/Brain-Rules-Updated-Expanded-Principles/dp/B079BDPT7T,B079BDPT7T,₹0,Audible Audiobook
The Way Back Home,by Oliver Jeffers,4.6,32.0,https://www.amazon.in/Way-Back-Home-Oliver-Jeffers/dp/0007182325,0007182325,₹280,Paperback
Bodyweight Training Guide: 40 Effective Bodyweight Strength Training (Home Workout...,by Patrick Sylvester,4.7,6.0,https://www.amazon.in/Bodyweight-Training-Guide-Effective-Calisthenics-ebook/dp/B01MSBR1KX,B01MSBR1KX,₹68,Kindle Edition
Home Coming: Reclaiming and Championing Your Inner Child,by John Bradshaw - Abridged,5.0,1.0,https://www.amazon.in/Home-Coming-Reclaiming-Championing-Inner/dp/B079TMBLKL,B079TMBLKL,₹0,Audible Audiobook
Forzza Vincent Corner Wall Shelf (Wenge),by Forzza,3.8,983.0,https://www.amazon.in/Forzza-Vincent-Corner-Shelf-Wenge/dp/B0198ECYNE,B0198ECYNE,₹919,
At Home: A Short History of Private Life,by Bill Bryson - Unabridged,4.5,8.0,https://www.amazon.in/At-Home-Short-History-Private/dp/B07B5Z9YY5,B07B5Z9YY5,₹0,Audible Audiobook
A Taste of Well-Being: Sadhguru's Insights for Your Gastronomics,by Isha Foundation,4.3,180.0,https://www.amazon.in/Taste-Well-Being-Sadhgurus-Insights-Gastronomics/dp/9351363783,9351363783,₹172,Paperback
The Day the Crayons Came Home,by Drew Daywalt,4.8,22.0,https://www.amazon.in/Day-Crayons-Came-Home/dp/0008124442,0008124442,₹196,Paperback
lovelyhome Plastic Clip on Adjusted Rechargeable 3 Lighting Mode 9 LED Reading...,by lovelyhome,4.1,54.0,https://www.amazon.in/lovelyhome-Plastic-Adjusted-Rechargeable-Lighting/dp/B07GBV3YG5,B07GBV3YG5,₹799,
The Little Book of Lykke: Secrets of the World's Happiest People,by Meik Wiking - Unabridged,4.8,8.0,https://www.amazon.in/Little-Book-Lykke-Secrets-Happiest/dp/B0754JD31T,B0754JD31T,₹0,Audible Audiobook
Soap Making: A Quick Guide: A Summary Of The Most Important Aspects Of Making...,by Michelle Gaboya,3.8,19.0,https://www.amazon.in/Soap-Making-Summary-Important-Aspects-ebook/dp/B00CDW3CR6,B00CDW3CR6,₹0,Kindle Edition
Styleys Book Safe Dictionary Book Style Money Cash Locker Jewelry Home Safe Box...,by Styleys,4.1,10.0,https://www.amazon.in/Styleys-Dictionary-Style-Locker-Jewelry/dp/B072M9PR33,B072M9PR33,₹675,
APPUCOCO Book Shelf Wall Mounted Heavy Duty Metal Invisible Book Shelves 2 Piece...,by APPUCOCO,4.5,60.0,https://www.amazon.in/APPUCOCO-Mounted-Invisible-Shelves-Included/dp/B07GS89K2H,B07GS89K2H,₹449,
The Little Book of Lykke: Secrets of the World's Happiest People,by Meik Wiking - Unabridged,4.8,8.0,https://www.amazon.in/Little-Book-Lykke-Secrets-Happiest/dp/B0754JD31T,B0754JD31T,₹0,Audible Audiobook
Docoss -(Large Size Xl) Hidden Secret Book Safe Locker Vault Box With 2 Keys...,by DOCOSS,4.0,15.0,https://www.amazon.in/Docoss-Hidden-Secret-Locker-Jewelry/dp/B07CM6T6MX,B07CM6T6MX,₹795,
Close to Home (Tracy Crosswhite Book 5),by Robert Dugoni,4.2,3.0,https://www.amazon.in/Close-Home-Tracy-Crosswhite-Book-ebook/dp/B01MU7ZZJV,B01MU7ZZJV,₹114.79,Kindle Edition
Michael Jordan: The Life,by Roland Lazenby - Unabridged,5.0,2.0,https://www.amazon.in/Michael-Jordan-The-Life/dp/B079CCXQTZ,B079CCXQTZ,₹0,Audible Audiobook
"Clean My Space: The Secret to Cleaning Better, Faster, and Loving Your Home Every...",by Melissa Maker - Unabridged,5.0,3.0,https://www.amazon.in/Clean-My-Space-Secret-Cleaning/dp/B06X6GY25D,B06X6GY25D,₹0,Audible Audiobook
The Long Drive Home,by Rishad Saam Mehta,,,https://www.amazon.in/Long-Drive-Home-Rishad-Mehta/dp/9387894215,9387894215,₹318,Paperback
Furniture Craft Iron Table Top Magazine Book Case Holder for Home | Book Storage,by Furniture Craft,,,https://www.amazon.in/Furniture-Craft-Magazine-Holder-Storage/dp/B07J5G3DYH,B07J5G3DYH,₹599,
Driving Home for Christmas: steamy billionaire romance (Billionaire Holiday Romance...,by Lexy Timms,5.0,1.0,https://www.amazon.in/Driving-Home-Christmas-billionaire-Billionaire-ebook/dp/B078GPYQ13,B078GPYQ13,₹0,Kindle Edition
Harvest for Hope: A Guide to Mindful Eating,by Jane Goodall - Abridged,5.0,2.0,https://www.amazon.in/Harvest-Hope-Guide-Mindful-Eating/dp/B07CBJMRMK,B07CBJMRMK,₹0,Audible Audiobook
Ugc Net Home Science,by Shuchi Rastogi,2.7,3.0,https://www.amazon.in/Ugc-Home-Science-Shuchi-Rastogi/dp/9312146416,9312146416,₹390,Paperback
Home Buy Portable Pu Leather Earrings Storage Collection Book Jewelry Display...,by HOME BUY,4.6,7.0,https://www.amazon.in/Portable-Leather-Earrings-Storage-Collection/dp/B07GKRJQQY,B07GKRJQQY,₹499,
A Monk's Guide to a Clean House and Mind,by Shoukei Matsumoto - Unabridged,3.1,5.0,https://www.amazon.in/Monks-Guide-Clean-House-Mind/dp/B0788V82ZG,B0788V82ZG,₹0,Audible Audiobook
TOP NIOS Home Science Guide Class 10 (T-216),by TOP Publications,3.0,2.0,https://www.amazon.in/NIOS-Science-Guide-Class-T-216/dp/B0753JFKC5,B0753JFKC5,₹249,Paperback
UP-TGT (Home Science) Exam Guide,by RPH Editorial Board,4.1,7.0,https://www.amazon.in/UP-TGT-Home-Science-Exam-Guide/dp/935012453X,935012453X,₹153,Paperback
DSSSB Teachers PGT: Home Science,by RPH Editorial Board,4.4,2.0,https://www.amazon.in/DSSSB-Teachers-PGT-Home-Science/dp/9350120194,9350120194,₹105,Paperback
Stress Management: How To Cope With Stress In Different Areas Of Your Life (stress...,by Ariel Stefan,4.2,44.0,https://www.amazon.in/Stress-Management-Different-stress-management-ebook/dp/B00M6B1HX0,B00M6B1HX0,₹0,Kindle Edition
Sidetracked Home Executives(TM): From Pigpen to Paradise,by Pam Young - Unabridged,,,https://www.amazon.in/Sidetracked-Home-Executives-TM-Paradise/dp/B079X4S3JM,B079X4S3JM,₹0,Audible Audiobook
Rapidex Home Tailoring Course,by KUSUM SHARMA,3.6,39.0,https://www.amazon.in/Rapidex-Tailoring-Course-KUSUM-SHARMA/dp/8122315054,8122315054,₹140,Paperback
216-Home Science -Hindi Medium-All-is-Well Guide Plus+Sample Paper+with Practicals,by EXPERT AND PERFECT TEAM OF NIOS TEACHERS AND PUBLISHERS,5.0,1.0,https://www.amazon.in/216-Home-Science-Hindi-Medium-All-Practicals/dp/9385534149,9385534149,₹220,Paperback
Furniture Cafe Zigzag Corner Wall Mount Shelf Unit/Racks and Shelves/Wall Shelf...,by Furniture Cafe,4.4,36.0,https://www.amazon.in/Furniture-Cafe-Zigzag-Shelves-Decoration/dp/B07FD6KDK9,B07FD6KDK9,₹990,
A Long Way Home,by Mitali Meelan,4.3,33.0,https://www.amazon.in/Long-Way-Home-Mitali-Meelan/dp/9353023823,9353023823,₹255,Paperback
"The Healthy Hound Cookbook: Over 125 Easy Recipes for Healthy, Homemade Dog Food...",by Paris Permenter,4.3,70.0,https://www.amazon.in/Healthy-Hound-Cookbook-Food-Including-Grain-Free/dp/1440572828,1440572828,₹750,Paperback
"Melissa & Doug Water Wow Coloring Book Vehicles,Multicolor",by Melissa & Doug,4.4,236.0,https://www.amazon.in/Melissa-Doug-Coloring-Vehicles-Multicolor/dp/B009B7F6CA,B009B7F6CA,₹399,
The Automatic Millionaire Homeowner,by David Bach - Unabridged,,,https://www.amazon.in/The-Automatic-Millionaire-Homeowner/dp/B07JBP3Q9X,B07JBP3Q9X,₹0,Audible Audiobook
HOME,by Manju Kapur,4.0,2.0,https://www.amazon.in/HOME-Manju-Kapur/dp/8184000332,8184000332,₹120,Paperback
"Carry Me Home (Paradise, Idaho Book 1)",by Rosalind James,4.5,410.0,https://www.amazon.in/Carry-Home-Paradise-Idaho-Book-ebook/dp/B00SZ35DGU,B00SZ35DGU,₹19,Kindle Edition
The Secret’s in the Spice Mix: Fifty Unique Homemade Spice Mixes with Recipes,by Pankaj Bhadouria,4.2,34.0,https://www.amazon.in/Secrets-Spice-Mix-Homemade-Recipes/dp/0143428497,0143428497,₹347,Paperback
Outgeek Book Stand Simple Tabletop Adjustable Book Holder Reading Stand for Home,by Outgeek,,,https://www.amazon.in/Outgeek-Simple-Tabletop-Adjustable-Reading/dp/B07M7MY2DD,B07M7MY2DD,₹775,
Peppa Pig: Little Library,by Ladybird,4.0,684.0,https://www.amazon.in/Peppa-Pig-Little-Library-Ladybird/dp/1409303187,1409303187,₹154,Board book
Kadence Notation Stand,by Kadence,4.1,232.0,https://www.amazon.in/Kadence-KAD-NSTD-Notation-Stand/dp/B00YDZIBNQ,B00YDZIBNQ,₹541,
Voot Kids,by Viacom18 Media Pvt. Ltd.,4.2,135.0,https://www.amazon.in/Viacom18-Media-Pvt-Ltd-Voot/dp/B01MU080ZD,B01MU080ZD,₹0,
Taken Home,by Ruth Cardello - Unabridged,4.0,3.0,https://www.amazon.in/Taken-Home/dp/B07B8G19H7,B07B8G19H7,₹0,Audible Audiobook
"Artesia Iron Table Top Magazine Book Case Holder for Home | Book Storage, Black",by Artesia,3.4,9.0,https://www.amazon.in/Artesia-Table-Magazine-Holder-Storage/dp/B0789DJ6RQ,B0789DJ6RQ,₹499,
"Arham Mktg Double Sided Adhesive High Bonding, High Performance Tissue Tape (...",by Arham Mktg,,,https://www.amazon.in/Arham-Mktg-Adhesive-Bonding-Performance/dp/B07MNN2ZKY,B07MNN2ZKY,,
Sparx Men's Flip-Flops and House Slippers,by Sparx,3.9,2208.0,https://www.amazon.in/Sparx-Brown-White-Flip-Flops-Slippers/dp/B00P9766ZC,B00P9766ZC,₹296 - ₹549,
"Dropshipping E-commerce Business Model 2019: $10,000/month Ultimate Guide - Make...",by Steven Sparrow,4.9,40.0,https://www.amazon.in/Dropshipping-commerce-Business-Model-2019-ebook/dp/B07M6LT2KZ,B07M6LT2KZ,₹208,Kindle Edition
Beloved,by Toni Morrison - Unabridged,3.9,15.0,https://www.amazon.in/Beloved/dp/B079TMLPMV,B079TMLPMV,₹0,Audible Audiobook
"Santosha Decor Zigzag Corner Wall Mount Shelf Unit/Racks and Shelves,(Walnut...",by Santosha Decor,4.0,167.0,https://www.amazon.in/Santosha-Decor-Zigzag-Corner-Shelves/dp/B0769XKGWY,B0769XKGWY,₹998,
The Internet of Mysterious Things,by splittix,,,https://www.amazon.in/The-Internet-of-Mysterious-Things/dp/B01MSCLAUQ,B01MSCLAUQ,₹0,
"Reverse Innovation: Create Far from Home, Win Everywhere",by Vijay Govindarajan - Unabridged,3.5,4.0,https://www.amazon.in/Reverse-Innovation-Create-Home-Everywhere/dp/B07DM7R11S,B07DM7R11S,₹0,Audible Audiobook
Morning Manthras,by Sadhana Sargam,3.3,3.0,https://www.amazon.in/Morning-Manthras-Sadhana-Sargam/dp/B004YTTMQ6,B004YTTMQ6,₹290,Audio CD
Hindu Terror: Insider account of Ministry of Home Affairs 2006-2010,by RVS Mani,4.3,62.0,https://www.amazon.in/Hindu-Terror-Insider-Ministry-2006-2010/dp/9386473275,9386473275,₹365,Paperback
"Scotch-Brite Scrub Pad, Large (Pack of 6)",by Scotch-Brite,4.1,148.0,https://www.amazon.in/Scotch-Brite-Scrub-Pad-Large-Pack/dp/B019FC16EC,B019FC16EC,₹169,
Tagru Digital Black Dial Men's Watch -,by Tagru,3.6,68.0,https://www.amazon.in/Tagru-Digital-Black-Dial-Watch/dp/B016DVVTC2,B016DVVTC2,₹317,
Jockey Men's Cotton Undershirt (Pack of 2) (Modern Classic),by Jockey,4.2,223.0,https://www.amazon.in/Jockey-Mens-Cotton-Shirt-8820_White_Medium/dp/B01L4F66ES,B01L4F66ES,₹217 - ₹500,
"Glow: Indian Foods, Recipes and Rituals for Beauty, Inside and Out",by Vasudha Rai,4.5,28.0,https://www.amazon.in/Glow-Indian-Recipes-Rituals-Beauty/dp/0143441590,0143441590,₹171,Paperback
Cosmus 50 Ltrs Black Rain & Dust Black Pack Cover,by COSMUS,4.1,761.0,https://www.amazon.in/Cosmus-Ltrs-Black-Rain-Cover/dp/B01E06ZK8G,B01E06ZK8G,₹249,
"Old Tree Rose, Jasmine and Lavender Essential Oil Combo, 15ml",by Old Tree,3.7,81.0,https://www.amazon.in/Old-Tree-Jasmine-Lavender-Essential/dp/B01HBGR95O,B01HBGR95O,₹519,
216-HOME SCIENCE-ENGLISH MEDIUM-ALL-IS-WELL GUIDE PLUS+SAMPLE PAPER+WITH PRACTICALS,by EXPERT AND PERFECT TEAM OF NIOS TEACHERS AND PUBLISHERS,4.2,6.0,https://www.amazon.in/216-HOME-SCIENCE-ENGLISH-MEDIUM-ALL-SAMPLE-PRACTICALS/dp/9385534157,9385534157,₹239,Paperback
Meron Agar-Agar Food Grade Strips Bopp Packs (25 Grams),by Meron,4.1,13.0,https://www.amazon.in/Meron-Agar-Agar-Grade-Strips-Packs/dp/B00VRA7DHU,B00VRA7DHU,₹200,
597 Business Ideas You can Start from Home - doing what you LOVE! (Beginner Internet...,by Gundi Gabrielle,3.4,12.0,https://www.amazon.in/597-Business-Ideas-Start-Home-ebook/dp/B071DCXL6C,B071DCXL6C,₹0,Kindle Edition
"@home by Nilkamal Checkers 4 Tier Book Shelf (Melamine Finish, Walnut)",by @home by Nilkamal,4.0,1.0,https://www.amazon.in/home-Nilkamal-Checkers-Melamine-Finish/dp/B07DYRJY89,B07DYRJY89,,
Simxen Multifunction Plastic Storage Hanger 4 Section Divider File Paper Magazine...,by Simxen,3.0,7.0,https://www.amazon.in/Simxen-Multifunction-Plastic-Magazine-Bookshelf/dp/B07GBYV6SY,B07GBYV6SY,₹398,
The Power of Positive Confrontation: The Skills You Need to Handle Conflicts...,by Barbara Pachter - Unabridged,,,https://www.amazon.in/Power-Positive-Confrontation-Conflicts-Completely/dp/B079MHQVMH,B079MHQVMH,₹0,Audible Audiobook
Avisa Global Mini Book Style Money Cash Locker Jewelry Home Safe Box Large (24...,by Avisa Global,3.6,4.0,https://www.amazon.in/Avisa-Global-Style-Locker-Jewelry/dp/B07JNST1XT,B07JNST1XT,₹769,
Uberlyfe Double Flap Foldable Storage Box for Toy Storage Home Closet Color -...,by uberlyfe,4.3,5.0,https://www.amazon.in/Uberlyfe-Double-Foldable-Storage-Closet/dp/B07FDC8T99,B07FDC8T99,₹699,
"Pindia Wood Book Stand Cover Case (12.5 inch x 12.5 inch, Brown)",by Pindia,3.6,75.0,https://www.amazon.in/Pindia-Wood-Stand-Cover-Brown/dp/B00GMELNI6,B00GMELNI6,₹182,
"How to Give Up Plastic: A Guide to Changing the World, One Plastic Bottle at...",by Will McCallum - Unabridged,,,https://www.amazon.in/How-Give-Up-Plastic-Changing/dp/B07D6SMZSD,B07D6SMZSD,₹0,Audible Audiobook
Home Science: Textbook for CBSE Class 10,by Urvi Raval,2.7,3.0,https://www.amazon.in/Home-Science-Textbook-CBSE-Class/dp/9386769735,9386769735,₹190,Paperback
Photo Book of Old New York City (1900-1910): (More than 100 slides of Vintage...,by Merrily Home,4.5,21.0,https://www.amazon.in/Photo-Book-York-City-1900-1910-ebook/dp/B00N7VTMX0,B00N7VTMX0,₹224.20,Kindle Edition
Trueman's UGC NET Home Science,by Anju Khosla,3.8,6.0,https://www.amazon.in/Truemans-UGC-NET-Home-Science/dp/818930142X,818930142X,₹720,Paperback
HomeTown Crony Medium Book Shelf (Wenge),by HomeTown,4.2,52.0,https://www.amazon.in/HomeTown-Crony-Medium-Shelf-Wenge/dp/B01LNLV26A,B01LNLV26A,,
Teaching Montessori in the Home: Pre-School Years: The Pre-School Years,by Elizabeth G. Hainstock,4.4,9.0,https://www.amazon.in/Teaching-Montessori-Home-Pre-School-Years/dp/0452279097,0452279097,₹487,Paperback
"Skywalk Dictionary Book Hidden Vault (8inch, Colors May Vary)",by Skywalk,4.0,6.0,https://www.amazon.in/Skywalk-Dictionary-Hidden-Vault-Colors/dp/B01500YJ60,B01500YJ60,₹699,
"Wipro Tejas Base B22 9-Watt LED Bulb (Pack of 4, Cool Day Light)",by Wipro,4.0,247.0,https://www.amazon.in/Wipro-Tejas-Base-9-Watt-Light/dp/B01M9DIKJC,B01M9DIKJC,₹349,
Bake with Shivesh,by Shivesh Bhatia,4.6,14.0,https://www.amazon.in/Bake-Shivesh-Bhatia/dp/9353023114,9353023114,₹559,Paperback
"Skywalk Dictionary Book Hidden Vault (8inch, Colors May Vary)",by Skywalk,4.0,6.0,https://www.amazon.in/Skywalk-Dictionary-Hidden-Vault-Colors/dp/B01500YJ60,B01500YJ60,₹699,
DOCOSS -Large Size XL Hidden Secret Book Safe Vault Box with 2 Keys Jewelry Money...,by DOCOSS,4.1,6.0,https://www.amazon.in/DOCOSS-Jewelry-Jewellery-Dictionary-Assorted/dp/B07HVYSRM5,B07HVYSRM5,₹795,
Bhagvad gita as it is english new edition,by His Divine Grace A.C. Bhaktivedanta Swami Prabhupada,4.8,403.0,https://www.amazon.in/Bhagvad-gita-as-english-new/dp/9384564192,9384564192,₹148,Hardcover
Home Workout: Home Workout For Beginners: The Home Workout Plan On How To Get...,by Elle Petersen,4.2,5.0,https://www.amazon.in/Home-Workout-Beginners-Exercise-beginners-ebook/dp/B0113EC6US,B0113EC6US,₹0,Kindle Edition
My First Book of Things at Home: First Board Book (My First Books),by Wonder House Books Editorial,4.0,2.0,https://www.amazon.in/My-First-Book-Things-Home/dp/9386538512,9386538512,₹49,Board book
"Wallfurn Marvel Wall Shelf/Book Shelf for Living Room, Bedroom, Home Decor, Set...",by Wallfurn,,,https://www.amazon.in/Wallfurn-Marvel-Living-Bedroom-Shelves/dp/B07MJ36C4C,B07MJ36C4C,₹899,
Skyfun Durable Plastic Fridge Storage Perforated Nesting Handle Basket Organiser...,by Skyfun,5.0,2.0,https://www.amazon.in/Skyfun-Durable-Plastic-Perforated-Organiser/dp/B07FPNRYYS,B07FPNRYYS,₹888,
"My First 1000 Words: Early Learning Picture Book to learn Alphabet, Numbers,...",by Wonder House Books Editorial,4.5,6.0,https://www.amazon.in/First-1000-Words-Transport-Professions/dp/9388144112,9388144112,₹179,Paperback
Antarman ki Alchemy (Alchemy of Space- Hindi),by MahaVastu,3.6,3.0,https://www.amazon.in/Antarman-Alchemy-Space-Hindi/dp/938157006X,938157006X,,
TOP NIOS Home Science Guide Class 12 (T-321),by TOP Publications,5.0,2.0,https://www.amazon.in/NIOS-Science-Guide-Class-T-321/dp/B0753HZZQK,B0753HZZQK,₹175,Paperback
The Home and the World,by Rabindranath Tagore,4.4,13.0,https://www.amazon.in/Home-World-Rabindranath-Tagore-ebook/dp/B0084ANSES,B0084ANSES,₹0,Kindle Edition
Improbable Planet: How Earth Became Humanity's Home,by Hugh Ross - Unabridged,,,https://www.amazon.in/Improbable-Planet-Earth-Became-Humanitys/dp/B071LGCQCH,B071LGCQCH,₹0,Audible Audiobook
"Patelraj Metal Book Stand (Bsp Black,4 Shelves)",by Patelraj,4.0,3.0,https://www.amazon.in/Patelraj-Metal-Stand-Black-Shelves/dp/B07G4JZWPD,B07G4JZWPD,₹570,
A Dog's Way Home: The Heartwarming Story of the Special Bond Between Man and...,by W. Bruce Cameron,5.0,4.0,https://www.amazon.in/Dogs-Way-Home-Heartwarming-Special/dp/1509855947,1509855947,₹399,Paperback
Peacock Senior Architect,by Peacock,3.7,225.0,https://www.amazon.in/Peacock-2133-Senior-Architect/dp/B009A7ZCB6,B009A7ZCB6,₹809,
40 Years' Chapterwise Topicwise Solved Papers (2018-1979) IIT JEE Physics,by DC. Pandey,4.1,93.0,https://www.amazon.in/Chapterwise-Topicwise-Solved-2018-1979-Physics/dp/9313163292,9313163292,₹211,Paperback
KRIWIN Sahaya 46 Varieties Of Quality Organic/Hybrid Fruits and Vegetables Seed...,by Kriwin,3.4,148.0,https://www.amazon.in/Varieties-Quality-Organic-Vegetables-Instruction/dp/B0731VSM28,B0731VSM28,₹299,
"HomeTown Lara 830027726001 Book Case (Textured Finish, Wenge)",by HomeTown,3.2,4.0,https://www.amazon.in/HomeTown-830027726001-Textured-Finish-Wenge/dp/B078T5YWXN,B078T5YWXN,,
"Stealing Home: Sweet Magnolias Series, Book 1",by Sherryl Woods - Unabridged,,,https://www.amazon.in/Stealing-Home-Sweet-Magnolias-Book/dp/B079VQLYRM,B079VQLYRM,₹0,Audible Audiobook
"Liam's Perfect Woman (Mills & Boon Cherish) (Home to Harbor Town, Book 1)",by Beth Kery,4.0,1.0,https://www.amazon.in/Liams-Perfect-Woman-Cherish-Harbor-ebook/dp/B00C1DT7S0,B00C1DT7S0,₹0,Kindle Edition
The Complete Novels of Sherlock Holmes,by Arthur Conan Doyle,4.3,839.0,https://www.amazon.in/Complete-Novels-Sherlock-Holmes/dp/8175994312,8175994312,₹146,Paperback
"Flexible USB LED Light Lamp For Home (5V, 1.2W) (Multicolour)",by Generic,3.5,1166.0,https://www.amazon.in/Flexible-Light-Lamp-Home-Multicolour/dp/B01LTI98AO,B01LTI98AO,₹114,
Contemporary Partition Design,by IAG,5.0,4.0,https://www.amazon.in/Contemporary-Partition-Design-IAG/dp/9386448025,9386448025,₹368,Paperback
DivineXt Multifunction Plastic Storage Hanger 4 Section Divider File Paper Magazine...,by DivineXt,2.5,38.0,https://www.amazon.in/DivineXt-Multifunction-Plastic-Magazine-Bookshelf/dp/B01IP9RE4W,B01IP9RE4W,₹416,
Fevicol Design Ideas - Dream Homes,by Pidilite Industries Limited,5.0,3.0,https://www.amazon.in/Fevicol-Design-Ideas-Dream-Homes/dp/B074FS5C9M,B074FS5C9M,₹425,Hardcover
Home Cube® 1 Pc 3D Car Auto Organizer Storage Bag Back Seat Box Organizer Holder...,by HOME CUBE,,,https://www.amazon.in/Organizer-Storage-Backseat-Pockets-Accessories/dp/B0788V9KK8,B0788V9KK8,₹999,
Organic Home Gardening Made Easy,by Sujit Chakrabarty,5.0,1.0,https://www.amazon.in/Organic-Home-Gardening-Made-Easy/dp/1643240854,1643240854,₹395,Paperback
It’s a Wonderful Life: The Christmas bestseller is back with an unforgettable...,by Julia Williams - Import,3.6,3.0,https://www.amazon.in/Its-Wonderful-Life-bestseller-unforgettable/dp/1847563600,1847563600,₹150.70,Paperback
"Pregnancy Notes: Before, During & After",by Rujuta Diwekar,3.9,236.0,https://www.amazon.in/Pregnancy-Notes-Before-During-After/dp/9386224895,9386224895,₹129,Paperback
Charity Begins at Home: The Year of Short Stories – April,by Jeffrey Archer,4.2,11.0,https://www.amazon.in/Charity-Begins-Home-Short-Stories-ebook/dp/B07B3KZ1Z6,B07B3KZ1Z6,₹0,Kindle Edition
Jurassic World: Fallen Kingdom,StarringChris Pratt,3.6,12.0,https://www.amazon.in/Jurassic-World-Kingdom-Chris-Pratt/dp/B07FMNDZNW,B07FMNDZNW,₹549,DVD
"The Shooting Star: A Girl, Her Backpack and the World",by Shivya Nath,4.7,139.0,https://www.amazon.in/Shooting-Star-Girl-Backpack-World/dp/0143443194,0143443194,₹180,Paperback
MOHAK Multifunction Plastic Storage Hanger 4 Section Divider File Paper Magazine...,by MOHAK,3.7,5.0,https://www.amazon.in/MOHAK-Multifunction-Plastic-Magazine-Bookshelf/dp/B07DKB9Y8R,B07DKB9Y8R,₹899,
Story Books set of 10 in English with 101 Moral Stories from Inikao,by Inikao,4.1,97.0,https://www.amazon.in/Story-Books-English-Stories-Inikao/dp/B073PG7S69,B073PG7S69,₹270,Paperback
MOHAK Multifunction Plastic Storage Hanger 4 Section Divider File Paper Magazine...,by MOHAK,3.7,5.0,https://www.amazon.in/MOHAK-Multifunction-Plastic-Magazine-Bookshelf/dp/B07DKB9Y8R,B07DKB9Y8R,₹899,
Home Science - 12: Educational Book,by Sharda Gupta,,,https://www.amazon.in/Home-Science-12-Educational-Book/dp/9351999785,9351999785,₹328,Perfect Paperback
Charity Begins at Home: The Year of Short Stories – April,by Jeffrey Archer,4.2,11.0,https://www.amazon.in/Charity-Begins-Home-Short-Stories-ebook/dp/B07B3KZ1Z6,B07B3KZ1Z6,₹0,Kindle Edition
"Flexible USB LED Light Lamp For Home (5V, 1.2W) (Multicolour)",by Generic,3.5,1166.0,https://www.amazon.in/Flexible-Light-Lamp-Home-Multicolour/dp/B01LTI98AO,B01LTI98AO,₹114,
