Title,Author,Rating,Reviews Count,URL,ISBN-10,Price,Binding
Little Kids First Big Book of Why (First Big Book) (National Geographic Little...,by Amy Shields,4.4,106.0,https://www.amazon.in/Little-First-National-Geographic-Books/dp/1426307934,1426307934,₹462,Hardcover
Mahatma Gandhi Autobiography: The Story Of My Experiments With Truth,by Mahatma Gandhi,4.4,247.0,https://www.amazon.in/Mahatma-Gandhi-Autobiography-Story-Experiments/dp/8172343116,8172343116,₹99,Paperback
Home Gardeners’ Guide Indian Garden Flowers,by Amarjeet Singh Batth,3.4,7.0,https://www.amazon.in/Gardeners-Guide-Indian-Garden-Flowers/dp/8175994029,8175994029,₹399,Paperback
101 Great Science Experiments (Dk),by DK,4.5,68.0,https://www.amazon.in/101-Great-Science-Experiments-Dk/dp/0241185130,0241185130,₹280,Paperback
Home Loan Counselling,by Indian Institute of Banking and Finance,4.1,12.0,https://www.amazon.in/Counselling-Indian-Institute-Banking-Finance/dp/9350711168,9350711168,₹380,Paperback
A Place Called Home (The McInnes Triplets Book 1),by Margaret Watson,4.3,92.0,https://www.amazon.in/Place-Called-Home-McInnes-Triplets-ebook/dp/B0763GXG74,B0763GXG74,₹254,Kindle Edition
Objective Home Science,by RPH Editorial Board,4.6,3.0,https://www.amazon.in/Objective-Home-Science-Editorial-Board/dp/9350128314,9350128314,₹120,Paperback
Assassin's Creed: Rogue (PC) (PC),by UBI Soft,4.0,117.0,https://www.amazon.in/UBI-Soft-Assassins-Creed-Rogue/dp/B00R11A1XM,B00R11A1XM,,
VORCOOL Creative Desk Calendars Schedule Planner Cat Cute Lovely Cartoon Desktop...,by VORCOOL,,,https://www.amazon.in/VORCOOL-Creative-Calendars-Schedule-Calendar/dp/B07GZT4WNT,B07GZT4WNT,₹834.39,
GENERICPortable Nail Art Table Lamp LED Light Manicure Tool Foldable Read Book...,by Generic,,,https://www.amazon.in/GENERICPortable-Table-Manicure-Foldable-Lighting/dp/B07N2S8W8X,B07N2S8W8X,,
Rusty Comes Home,by Ruskin Bond,5.0,4.0,https://www.amazon.in/Rusty-Comes-Home-Ruskin-Bond/dp/0143333402,0143333402,₹183,Paperback
ekta home appliances Multi-Use Descaler Powder for Washing Machine - Pack of 5,by ekta home appliances,3.9,94.0,https://www.amazon.in/ekta-home-appliances-Multi-Use-Descaler/dp/B06XDZ53PN,B06XDZ53PN,₹245,
Home,by Carson Ellis,5.0,1.0,https://www.amazon.in/Home-Carson-Ellis/dp/1406365793,1406365793,,Paperback
GEAR Black and Blue Kids Backpack (3-5 years old),by Gear,2.8,260.0,https://www.amazon.in/GEAR-Black-Blue-Backpack-years/dp/B019HA8AYG,B019HA8AYG,₹198,
"Frantic Plush Heart Eyes and Flying Kiss Soft Smiley Cushion (Yellow, 35 cm)...",by Frantic,4.6,180.0,https://www.amazon.in/Frantic-Heart-Flying-Smiley-Cushion/dp/B078LJ3ZDV,B078LJ3ZDV,₹329,
Long Way Home (A Mangrove Island Novel Book 1),by Neve Cottrell,4.6,8.0,https://www.amazon.in/Long-Home-Mangrove-Island-Novel-ebook/dp/B00OOZ2O7E,B00OOZ2O7E,₹0,Kindle Edition
MRM - Mumbai Rail Map Plain Notebook,,,,https://www.amazon.in/MRM-Mumbai-Rail-Plain-Notebook/dp/B012AT91FI,B012AT91FI,,Paperback
Craquez pour les biscuits apéro ! (Craquez...) (French Edition),by Brigitte Namour,,,https://www.amazon.in/Craquez-pour-biscuits-ap%C3%A9ro-French-ebook/dp/B005I6HYFA,B005I6HYFA,₹223.64,Kindle Edition
My Small Board-Books: Dreamland (A Set Of Ten Books),by Dreamland Publications - Box set,4.3,178.0,https://www.amazon.in/My-Small-Board-Books-Dreamland-Books/dp/8184511604,8184511604,₹490,Board book
SR Global TPU Multicolour Rubber Silicone Led Trendy Digital Unisex Band - for...,by SR Global,,,https://www.amazon.in/SR-Global-Multicolour-Silicone-Digital/dp/B07K7SCQCH,B07K7SCQCH,₹149,
Jewel Fuel 24k Gold Plated Hanuman Chalisa Religious Book Gift Set,by JEWEL FUEL,5.0,1.0,https://www.amazon.in/Jewel-Plated-Hanuman-Chalisa-Religious/dp/B075VCCWTN,B075VCCWTN,₹599,
Diary of a Wimpy Kid: The Getaway (book 12),by Jeff Kinney,4.7,496.0,https://www.amazon.in/Diary-Wimpy-Kid-Getaway-book/dp/0241344271,0241344271,₹185,Paperback
"Home Sweet Home"":: Teach Your Kids About the Importance of Home! (Bedtimes Story...""",by Sigal Adler,3.3,3.0,https://www.amazon.in/Home-Sweet-Importance-Bedtimes-Childrens-ebook/dp/B076J5YHFN,B076J5YHFN,₹72,Kindle Edition
Karukrutiz Dhokra Metal Handcrafted Figurine Lady Standing and Reading Book for...,by Karukrutiz,,,https://www.amazon.in/Karukrutiz-Handcrafted-Figurine-Standing-Reading/dp/B07DFPQBVV,B07DFPQBVV,₹650,
The Well-Trained Mind: A Guide to Classical Education at Home (Third Edition),by Susan Wise Bauer - Unabridged,,,https://www.amazon.in/Well-Trained-Mind-Guide-Classical-Education/dp/B07DM6SW8N,B07DM6SW8N,₹0,Audible Audiobook
"Social Media Marketing when you have NO CLUE!: Youtube, Instagram, Pinterest,...",by Gundi Gabrielle,3.0,1.0,https://www.amazon.in/Social-Media-Marketing-when-have-ebook/dp/B06XJ9MZVQ,B06XJ9MZVQ,₹49,Kindle Edition
The Well-Trained Mind: A Guide to Classical Education at Home (Third Edition),by Susan Wise Bauer - Unabridged,,,https://www.amazon.in/Well-Trained-Mind-Guide-Classical-Education/dp/B07DM6SW8N,B07DM6SW8N,₹0,Audible Audiobook
"Dr. CHARCOAL Non-Electric Air Purifier, Deodorizer and Dehumidifier for Living...",by Dr. CHARCOAL,3.6,368.0,https://www.amazon.in/Dr-CHARCOAL-Non-Electric-Deodorizer-Dehumidifier/dp/B074LRQBJW,B074LRQBJW,₹809,
Captiver Hardwood Aai Wall Mounted Shelf Wenge Rack Decorative Display (Standard),by Captiver,4.3,6.0,https://www.amazon.in/Captiver-Hardwood-Mounted-Decorative-Standard/dp/B07JDPRNYR,B07JDPRNYR,₹749,
Core Python Programming,by R. Nageswara Rao,4.6,65.0,https://www.amazon.in/Core-Python-Programming-Nageswara-Rao/dp/938605230X,938605230X,₹615,Paperback
Bluewud Phelix Wall Decor Book Shelf/Wall Display Rack (3 Shelves) - Ideal for...,by BLUEWUD,3.9,78.0,https://www.amazon.in/Bluewud-Phelix-Decor-Display-Shelves/dp/B019HBPT76,B019HBPT76,₹849,
The Very Hungry Caterpillar,by Eric Carle,4.5,675.0,https://www.amazon.in/Very-Hungry-Caterpillar-Eric-Carle/dp/0140569324,0140569324,₹225,Paperback
A to Z Ice Cream Making Ice Cream at Home for Total Beginners,by Lisa Bond,3.5,14.0,https://www.amazon.in/Cream-Making-Home-Total-Beginners-ebook/dp/B074VC9F5Z,B074VC9F5Z,₹0,Kindle Edition
Skyfun 4 Section Multifunction Plastic Section Divider Document FC Size File...,by Skyfun,1.0,2.0,https://www.amazon.in/Skyfun-Multifunction-Document-Magazine-Bookshelf/dp/B07CQK2JCJ,B07CQK2JCJ,₹419,
The Power of Positive Confrontation: The Skills You Need to Handle Conflicts...,by Barbara Pachter - Unabridged,,,https://www.amazon.in/Power-Positive-Confrontation-Skills-Conflicts/dp/B07CJTFKLR,B07CJTFKLR,₹0,Audible Audiobook
Sparks of Phoenix,by Najwa Zebian,,,https://www.amazon.in/Sparks-Phoenix-Najwa-Zebian/dp/1449496202,1449496202,₹524,Paperback
Library of Souls: The Third Novel of Miss Peregrine's Peculiar Children,by Ransom Riggs,3.7,11.0,https://www.amazon.in/Library-Souls-Peregrines-Peculiar-Children/dp/1594749310,1594749310,₹418,Paperback
Home (Vintage Minis),by Salman Rushdie,5.0,3.0,https://www.amazon.in/Home-Vintage-Minis-Salman-Rushdie/dp/1784872687,1784872687,₹157,Mass Market Paperback
The Brilliant World of Tom Gates (Tom Gates series Book 1),by Liz Pichon,4.6,97.0,https://www.amazon.in/Brilliant-World-Tom-Gates-Book-ebook/dp/B00DY5XIT8,B00DY5XIT8,₹238.45,Kindle Edition
India’s Most Fearless: True Stories of Modern Military Heroes,by Shiv Aroor,4.7,274.0,https://www.amazon.in/Indias-Most-Fearless-Stories-Military/dp/0143440446,0143440446,₹148,Paperback
Contemporary Kitchens,by IAG,4.0,4.0,https://www.amazon.in/Contemporary-Kitchens-IAG/dp/8193284674,8193284674,₹368,Paperback
"Philips 929001923213 Base B22 18-Watt LED Bulb (Pack of 2, Cool Day Light)",by Philips,4.3,199.0,https://www.amazon.in/Philips-929001923213-Base-18-Watt-Light/dp/B07FKT2SZH,B07FKT2SZH,₹669,
Stonesoup CHUTKI Composting starter Kit(16L)/Starter Kit ideal for 1 week kitchen...,by Stonesoup,4.2,21.0,https://www.amazon.in/Stonesoup-Composting-starter-Starter-composting/dp/B01IBOY70A,B01IBOY70A,₹750,
International Mathematics Olympiad Work Book (IMO) - Class 3 for 2018-19,by Mahabir Singh,4.4,109.0,https://www.amazon.in/International-Mathematics-Olympiad-Work-Book/dp/9387351718,9387351718,₹64,Paperback
Home Alone: The Official Colouring Book,by Twentieth Century Fox,,,https://www.amazon.in/Home-Alone-Official-Colouring-Book/dp/0008212287,0008212287,₹507.19,Paperback
Fat Cat Sat on the Mat (I Can Read Level 1),by Nurit Karlin,4.5,12.0,https://www.amazon.in/Fat-Cat-Sat-Read-Level/dp/0064442462,0064442462,₹137,Paperback
Tom Gates: Genius Ideas (mostly) (Tom Gates series Book 4),by Liz Pichon,4.4,55.0,https://www.amazon.in/Tom-Gates-Genius-Ideas-mostly-ebook/dp/B00HA7KA9C,B00HA7KA9C,₹244.15,Kindle Edition
"A Long Dream of Home: The persecution, exile and exodus of Kashmiri Pandits",by Siddhartha Gigoo and Varad Sharma,4.1,8.0,https://www.amazon.in/Long-Dream-Home-persecution-Kashmiri/dp/9385436201,9385436201,₹277,Paperback
Ivaan Cleaning Magic Colorful Duster - for Easy Cleaning Your Home/Office/Shop...,by Ivaan,4.0,2.0,https://www.amazon.in/Ivaan-Cleaning-Magic-Colorful-Duster/dp/B07KDB38DS,B07KDB38DS,₹195,
Edu Kids (Set of 6 VCDs - Learn & Play/Math for Kids/My First Book of Word/English...,,2.7,12.0,https://www.amazon.in/Edu-Kids-Set-VCDs-Speaking/dp/B00CM7GNVY,B00CM7GNVY,₹285,Video CD
12 Rules for Life: An Antidote to Chaos,by Jordan B. Peterson,4.4,97.0,https://www.amazon.in/12-Rules-Life-Antidote-Chaos/dp/0241351642,0241351642,₹433,Paperback
Multiple Choice Questions in Home Science for Competitive Examinations,by P. Nazni,,,https://www.amazon.in/Multiple-Questions-Science-Competitive-Examinations/dp/9351242781,9351242781,₹195,Paperback
Indian Decor Invisible Shelves - (Black),by INDIAN DECOR,4.2,47.0,https://www.amazon.in/Indian-Decor-Invisible-Shelves-Black/dp/B071VXTR8T,B071VXTR8T,₹580,
Tiya: A Parrot's Journey Home,by Samarpan,4.2,24.0,https://www.amazon.in/Tiya-Parrots-Journey-Home-Samarpan/dp/8172238320,8172238320,₹220,Paperback
I am a home to butterflies,by J. Alchem,3.9,103.0,https://www.amazon.in/am-home-butterflies-J-Alchem-ebook/dp/B07LF2F7JQ,B07LF2F7JQ,₹49,Kindle Edition
The Alchemist,by Paulo Coelho - Import,4.6,3839.0,https://www.amazon.in/Alchemist-Paulo-Coelho/dp/0008144222,0008144222,₹399.90,Board book
"INDIAN DECOR Metal Invisible Shelves(White, 150x150x125mm)",by INDIAN DECOR,4.2,109.0,https://www.amazon.in/INDIAN-DECOR-Invisible-Shelves-150x150x125mm/dp/B01N2490I8,B01N2490I8,₹590,
The Alchemist,by Paulo Coelho - Import,4.6,3839.0,https://www.amazon.in/Alchemist-Paulo-Coelho/dp/0008144222,0008144222,₹399.90,Board book
L'Appart: The Delights and Disasters of Making My Paris Home,by David Lebovitz - Unabridged,,,https://www.amazon.in/LAppart-Delights-Disasters-Making-Paris/dp/B076VRC8SB,B076VRC8SB,₹0,Audible Audiobook
A Promise Of Home (A Lake Howling Novel Book 1),by Wendy Vella,5.0,1.0,https://www.amazon.in/Promise-Home-Lake-Howling-Novel-ebook/dp/B00U4FDG6Q,B00U4FDG6Q,₹0,Kindle Edition
World Map,by Dreamland Publications,4.5,856.0,https://www.amazon.in/World-Map-Dreamland-Publications/dp/8184511213,8184511213,₹91,Poster
"MosQuick Multipurpose Bedside Hanging Storage Basket, Dorm bed, Office Desk,...",by MosQuick,3.9,10.0,https://www.amazon.in/MosQuick-Multipurpose-Bedside-Dormitory-Organizer/dp/B078Y5Y6CF,B078Y5Y6CF,₹450,
Fundamentals of Drawing: A Complete Professional Course for Artists,by Barrington Barber,4.5,16.0,https://www.amazon.in/Fundamentals-Drawing-Complete-Professional-Artists/dp/1841933171,1841933171,₹538,Paperback
Voicebot and Chatbot Design: Flexible conversational interfaces with Amazon Alexa...,by Rachel Batish - Import,4.0,1.0,https://www.amazon.in/Voicebot-Chatbot-Design-conversational-interfaces/dp/1789139627,1789139627,₹719,Paperback
"Home Sizzler 2 Piece Eyelet Polyester Window Curtain - 5ft, Brown",by Home Sizzler,4.1,983.0,https://www.amazon.in/Home-Sizzler-Eyelet-Polyester-Curtain/dp/B071HGZQRL,B071HGZQRL,₹399,
Hindi Writing Practice Books Set of 5,by InIkao,4.3,36.0,https://www.amazon.in/Hindi-Writing-Practice-Books-Set/dp/B01ENQ9BW4,B01ENQ9BW4,₹195,Paperback
Kraasa Slide SL5145 Slippers,by Kraasa,3.0,20.0,https://www.amazon.in/Kraasa-Mens-Black-Synthetic-Slippers/dp/B0786N5ZJB,B0786N5ZJB,₹359,
Vivinkaa Floral Orange Canvas Sling Bag for Women,by Vivinkaa,3.3,25.0,https://www.amazon.in/Vivinkaa-Floral-Orange-Canvas-Sling/dp/B0176GWQF2,B0176GWQF2,₹349,
Paleo Diet (Health),by Neander Selvan,4.5,146.0,https://www.amazon.in/Paleo-Diet-Health-Neander-Selvan/dp/9384149683,9384149683,₹150,Paperback
"5 Milestone Breitling Watches, from 1915 to Today: Guidebook for luxury watches",by YOUPublish,3.3,1317.0,https://www.amazon.in/Milestone-Breitling-Watches-1915-Today-ebook/dp/B00W870EFO,B00W870EFO,₹0,Kindle Edition
Latest House Designs,by Aditya Kamal,4.0,3.0,https://www.amazon.in/Latest-House-Designs-Aditya-Kamal/dp/B01N9W67GZ,B01N9W67GZ,₹175,Paperback
Home Science for Pravakta ( PGT ) Chayan Pariksha Guide,by arihant,,,https://www.amazon.in/Science-Pravakta-Chayan-Pariksha-Guide/dp/B07M82DZKP,B07M82DZKP,₹250,Paperback
193 ugc net set home science paper II & III arihant,by arihant,,,https://www.amazon.in/193-home-science-paper-arihant/dp/B072HXLVN2,B072HXLVN2,₹500,Paperback
CLASSIC SHOPPE Wooden Hand Carved Holy Book Stand 10 INCH ( Religious Item ),by CLASSIC SHOPPE,3.8,3.0,https://www.amazon.in/CLASSIC-SHOPPE-Wooden-Carved-Religious/dp/B078TKN5M4,B078TKN5M4,₹138,
ISC TextBook of HOME SCIENCE for class XI and XII,by premlata mullick,,,https://www.amazon.in/ISC-TextBook-HOME-SCIENCE-class/dp/932726374X,932726374X,₹295,Paperback
By Goank Book Safe Dictionary Book Style Money Cash Locker Jewelery Home Safe...,,,,https://www.amazon.in/Goank-Book-Dictionary-Locker-Jewelery/dp/B071SHJZ9R,B071SHJZ9R,,
Madhura's recipe Masala (Pack of 3) Goda Masala - Byadgi Mirchi Powder - Kanda...,by Madhura's recipe,4.4,72.0,https://www.amazon.in/Madhuras-recipe-Masala-Pack-Goda/dp/B07HL4NS85,B07HL4NS85,₹300,
"Brain Boosting Activity Book - Age 4+: Match the Pair, Find the Difference, Maze...",by Dreamland Publications,4.1,103.0,https://www.amazon.in/Brain-Boosting-Activity-Book-Dot/dp/9350895641,9350895641,₹84,Paperback
How To Make Money Blogging: How I Replaced My Day-Job and How You Can Start A...,by Bob Lotich,4.0,36.0,https://www.amazon.in/How-Make-Money-Blogging-Replaced-ebook/dp/B0091ISTUU,B0091ISTUU,₹0,Kindle Edition
One-Stop-Shop Safe Dictionary Book Style Money Cash Locker Jewelry Home Safe...,by One-Stop-Shop,5.0,1.0,https://www.amazon.in/One-Stop-Shop-Dictionary-Style-Locker-Jewelry/dp/B07G98FKYZ,B07G98FKYZ,₹689,
MOHAK Multifunction Plastic Storage Hanger 3 Section Divider File Paper Magazine...,by MOHAK,3.0,1.0,https://www.amazon.in/MOHAK-Multifunction-Plastic-Magazine-Bookshelf/dp/B07D7XW26X,B07D7XW26X,₹329,
"WE CAN, WE WILL, WE MUST - A story of love & inspiration to win life when it...",by Saranya Umakanthan,4.4,96.0,https://www.amazon.in/WE-CAN-WILL-MUST-inspiration/dp/819366972X,819366972X,₹100,Paperback
Home Science (Incl. Practicals): Textbook for CBSE Class 11,by Neeti Vaid Gera,3.0,2.0,https://www.amazon.in/Home-Science-Incl-Practicals-Textbook/dp/9386769972,9386769972,₹318,Paperback
Songbirds (Peterson field guides for young naturalists),by Jonathan P. Latimer - Import,4.5,3.0,https://www.amazon.in/Songbirds-Peterson-field-guides-naturalists/dp/0395979463,0395979463,₹974.04,Paperback
The Boy in the Striped Pyjamas (Vintage Childrens Classics),by John Boyne,4.6,134.0,https://www.amazon.in/Striped-Pyjamas-Vintage-Childrens-Classics/dp/0099572869,0099572869,₹173,Paperback
The Journey Home,by Radhanath Swami - Import,4.8,203.0,https://www.amazon.in/Journey-Home-Radhanath-Swami/dp/8184954174,8184954174,,Paperback
Saimani 4 Layer Space Saving Storage Organizer Rack Shelf with Wheels for Kitchen...,by Saimani,3.9,95.0,https://www.amazon.in/Saimani-Storage-Organizer-Rack-Bathroom/dp/B07HMTGBRX,B07HMTGBRX,₹949,
Vegetables (Lovely Board Book),by Dreamland Publications,4.1,40.0,https://www.amazon.in/Vegetables-Lovely-Board-Dreamland-Publications/dp/1730165346,1730165346,₹44.50,Board book
"Your Mind Is Your Home: How to End Anxiety, Stop Overthinking and Have More Control...",by Kamran Bedi - Import,,,https://www.amazon.in/Your-Mind-Home-Overthinking-Thoughts/dp/1912779390,1912779390,,Paperback
GOLD LEAF 10 Sheets Kids Painting Set Scratch Paper Colorful Magic Scratch Art...,by GOLD LEAF,,,https://www.amazon.in/GOLD-LEAF-Painting-Scratch-Colorful/dp/B07KDCX864,B07KDCX864,₹489,
Marketing Management 15e (with free INDIAN CASES book),by Philip Kotler,4.4,76.0,https://www.amazon.in/Marketing-Management-free-INDIAN-CASES/dp/933258740X,933258740X,₹599,Paperback
SR Global Digital Men's & Boy's Wrist Watch Model 211549,by SR Global,,,https://www.amazon.in/SR-Global-Digital-Wrist-211549/dp/B07K9RDF7R,B07K9RDF7R,₹149,
"Long Road Home: Homecoming Series, Book 1 (Crystal Spring Romances)",by Mary Jane Morgan,4.5,65.0,https://www.amazon.in/Long-Crystal-Springs-Homecoming-Romances-ebook/dp/B00Z1Y2D0A,B00Z1Y2D0A,₹68,Kindle Edition
Anywhere But Home: Adventures in Endurance,by Anu Vaidyanathan,4.5,77.0,https://www.amazon.in/Anywhere-But-Home-Adventures-Endurance/dp/9351775240,9351775240,₹280,Paperback
Electomania® Car Motorcycle Mp3 Mp4 Hi-Fi Stereo Audio Mini Amplifier 12V 2A...,by Electomania,3.6,48.0,https://www.amazon.in/Electomania-Motorcycle-Stereo-Amplifier-Silver/dp/B073J4WFY5,B073J4WFY5,₹855,
Skywalk 9.5 inch Tall Dictionary Book Safe Hidden Vault with Keys for Home (Colour...,by Skywalk,3.7,4.0,https://www.amazon.in/Dictionary-Jewellery-Ornament-Valuable-Diamonds/dp/B00XIHMNYS,B00XIHMNYS,₹899,
Crime and Punishment,by Fyodor Dostoyevsky,4.1,158.0,https://www.amazon.in/Crime-Punishment-Fyodor-Dostoyevsky/dp/9386538059,9386538059,₹179,Paperback
Writing Workbook Ages 3-5: Collins Easy Learning (Collins Easy Learning Preschool),by Collins,4.3,51.0,https://www.amazon.in/Writing-Workbook-Ages-3-5-Preschool/dp/0008151628,0008151628,₹81,Paperback
The Hobbit - An Unexpected Journey,StarringIan McKellen,4.1,61.0,https://www.amazon.in/Hobbit-Unexpected-Journey-Ian-McKellen/dp/B00CG2XV42,B00CG2XV42,₹143,DVD
Easy Homemade Soap Recipes - (FREE BONUS BOOK INCLUDED): Soap Making For Beginners...,by John Brown,5.0,4.0,https://www.amazon.in/Easy-Homemade-Soap-Recipes-Beginners-ebook/dp/B01K5FICKE,B01K5FICKE,₹57.82,Kindle Edition
Never Split the Difference: Negotiating as if Your Life Depended on It,by Chris Voss,4.7,56.0,https://www.amazon.in/Never-Split-Difference-Negotiating-Depended/dp/1847941494,1847941494,₹364,Paperback
