Title,Author,Rating,Reviews Count,URL,ISBN-10,Price,Binding
"The Lightning Thief: Percy Jackson, Book 1",by Rick Riordan - Unabridged,4.7,272.0,https://www.amazon.in/Lightning-Thief-Percy-Jackson-Book/dp/B079WTHV16,B079WTHV16,₹0,Audible Audiobook
Wonder,by R J Palacio - Unabridged,4.7,209.0,https://www.amazon.in/Wonder/dp/B079WZNCKX,B079WZNCKX,₹0,Audible Audiobook
"Hard Luck: Diary of a Wimpy Kid, Book 8",by Jeff Kinney - Unabridged,4.7,963.0,https://www.amazon.in/Hard-Luck-Diary-Wimpy-Book/dp/B079WVLJWZ,B079WVLJWZ,₹0,Audible Audiobook
It’s Not Right…but It’s Okay,by Anuj Tiwari,4.3,285.0,https://www.amazon.in/Its-Not-Right-but-Okay-ebook/dp/B019H0DU8C,B019H0DU8C,₹100.70,Kindle Edition
A Girl to Remember,by Ajay K Pandey,4.7,211.0,https://www.amazon.in/Girl-Remember-Ajay-K-Pandey/dp/9387022390,9387022390,₹90,Paperback
The Boy in the Striped Pyjamas,by John Boyne - Unabridged,4.6,134.0,https://www.amazon.in/Boy-Striped-Pyjamas/dp/B079WW58HK,B079WW58HK,₹0,Audible Audiobook
The Boy in the Striped Pyjamas,by John Boyne - Unabridged,4.6,134.0,https://www.amazon.in/Boy-Striped-Pyjamas/dp/B079WW58HK,B079WW58HK,₹0,Audible Audiobook
The Power of Your Subconscious Mind,by Joseph Murphy,4.5,4987.0,https://www.amazon.in/Power-Your-Subconscious-Mind/dp/9352664167,9352664167,₹319,Hardcover
Mythos,by Stephen Fry - Unabridged,4.3,6.0,https://www.amazon.in/Mythos/dp/B075MPXN3D,B075MPXN3D,₹0,Audible Audiobook
Looking for Alaska,by John Green - Unabridged,4.3,512.0,https://www.amazon.in/Looking-for-Alaska/dp/B079TM5RPN,B079TM5RPN,₹0,Audible Audiobook
"Rodrick Rules: Diary of a Wimpy Kid, Book 2",by Jeff Kinney - Unabridged,4.6,293.0,https://www.amazon.in/Rodrick-Rules-Diary-Wimpy-Book/dp/B07B3ZWQCZ,B07B3ZWQCZ,₹0,Audible Audiobook
English for UGC-Net/Jrf/Slet (Paper II and III) and Other Competitive Examinations,by R. S. Malik,4.3,23.0,https://www.amazon.in/English-UGC-Net-Paper-Competitive-Examinations/dp/8126918373,8126918373,₹899,Hardcover
TARGET POINT: NTA NET/SET EXAM ENGLISH LITERATURE PART-1,by Umesh Dalakoti,5.0,1.0,https://www.amazon.in/TARGET-POINT-ENGLISH-LITERATURE-PART-1-ebook/dp/B07JX66X64,B07JX66X64,₹284,Kindle Edition
Ansite Zakham(Punjabi Nove),by Nanak Singh,4.0,1.0,https://www.amazon.in/Ansite-Zakham-Punjabi-Nanak-Singh/dp/8171680372,8171680372,₹150,Paperback
Reading Comprehension: Grade 4 (Skill Builders),by Ashley Anderson,5.0,2.0,https://www.amazon.in/Reading-Comprehension-Grade-Skill-Builders/dp/1936023326,1936023326,₹768,Paperback
Eithihyamala,by Kottarathil Sankunni,4.8,36.0,https://www.amazon.in/Eithihyamala-Kottarathil-Sankunni/dp/8126422904,8126422904,₹349,Hardcover
The Communist Manifesto (Vintage Classics),by Karl Marx,3.4,93.0,https://www.amazon.in/Communist-Manifesto-Vintage-Classics/dp/0099540746,0099540746,,Paperback
Book Worm Radio,by scout.fm,,,https://www.amazon.in/scout-fm-Book-Worm-Radio/dp/B07837F89R,B07837F89R,₹0,
Akbar Birbal Kathalu (Telugu),by Yuvamithra,4.0,1.0,https://www.amazon.in/Akbar-Birbal-Kathalu-Telugu-Yuvamithra/dp/B076HR2K2Z,B076HR2K2Z,₹50,Paperback
Rupa Book Of Literature Quiz,by Sujata Ray,5.0,1.0,https://www.amazon.in/Rupa-Book-Literature-Quiz-Sujata-ebook/dp/B018TVAERK,B018TVAERK,₹72.82,Kindle Edition
Circe,by Madeline Miller - Unabridged,4.3,46.0,https://www.amazon.in/Circe/dp/B07C83T2QR,B07C83T2QR,₹0,Audible Audiobook
The Secret of the Druids,by Christopher C. Doyle - Unabridged,4.1,272.0,https://www.amazon.in/The-Secret-of-the-Druids/dp/B01MU4TQ0Z,B01MU4TQ0Z,₹0,Audible Audiobook
Everyone Has a Story 2,by Savi Sharma,4.8,544.0,https://www.amazon.in/Everyone-Has-Story-Savi-Sharma/dp/9387894126,9387894126,₹100,Paperback
Murder on the Orient Express (Poirot),by Agatha Christie,4.5,584.0,https://www.amazon.in/Murder-Orient-Express-Poirot-Christie-ebook/dp/B0046H95PO,B0046H95PO,₹49,Kindle Edition
MEG-14 Contemporary Indian Literature In English Translation,by GPH Panel of Experts,3.0,2.0,https://www.amazon.in/MEG-14-Contemporary-Literature-English-Translation/dp/9381690693,9381690693,₹220,Paperback
Gulliver's Travels (Ladybird Classics),by Ladybird - Abridged,4.1,111.0,https://www.amazon.in/Gullivers-Travels-Ladybird-Classics/dp/1409311279,1409311279,₹179,Hardcover
The Fifth Mountain,by Paulo Coelho,4.4,36.0,https://www.amazon.in/Fifth-Mountain-Paulo-Coelho/dp/8172235143,8172235143,₹224,Paperback
The Godfather,by Mario Puzo - Unabridged,4.6,188.0,https://www.amazon.in/The-Godfather/dp/B07CNGGPY5,B07CNGGPY5,₹0,Audible Audiobook
Animal Farm,by George Orwell,4.6,1001.0,https://www.amazon.in/Animal-Farm-George-Orwell/dp/0143416316,0143416316,₹106,Paperback
The Sialkot Saga,by Ashwin Sanghi - Unabridged,4.0,794.0,https://www.amazon.in/The-Sialkot-Saga/dp/B01N4JPIOK,B01N4JPIOK,₹0,Audible Audiobook
Skyfun Plastic File Holder Office Desk Table Top Book Shelf Organizer Literature...,by Skyfun,2.8,4.0,https://www.amazon.in/Skyfun-Organizer-Literature-Magazine-Container-4/dp/B07D1HTWNB,B07D1HTWNB,₹425,
The Blue Umbrella,by Ruskin Bond - Unabridged,4.4,348.0,https://www.amazon.in/The-Blue-Umbrella/dp/B01NBQ0LLE,B01NBQ0LLE,₹0,Audible Audiobook
The Oath of The Vayuputras (Shiva Trilogy Book 3),by Amish Tripathi,4.4,1606.0,https://www.amazon.in/Oath-Vayuputras-Shiva-Trilogy-Book-ebook/dp/B00AV5EZZA,B00AV5EZZA,₹209,Kindle Edition
OBJECTIVE TYPE QUESTION ON ENGLISH LITERATURE FOR COMPETITIVE EXAMS,,2.9,3.0,https://www.amazon.in/OBJECTIVE-QUESTION-ENGLISH-LITERATURE-COMPETITIVE/dp/8187764139,8187764139,₹463,Paperback
"Dog Days: Diary of a Wimpy Kid, Book 4",by Jeff Kinney - Unabridged,4.6,243.0,https://www.amazon.in/Dog-Days-Diary-Wimpy-Book/dp/B07DDMC9V7,B07DDMC9V7,₹0,Audible Audiobook
The Graveyard Book,by Neil Gaiman - Unabridged,4.6,92.0,https://www.amazon.in/The-Graveyard-Book/dp/B07B6QNVN3,B07B6QNVN3,₹0,Audible Audiobook
"The Sea of Monsters: Percy Jackson, Book 2",by Rick Riordan - Unabridged,4.7,131.0,https://www.amazon.in/Sea-Monsters-Percy-Jackson-Book/dp/B079VRHL9H,B079VRHL9H,₹0,Audible Audiobook
Son of Bhrigu (The Pataala Prophecy Book 1),by Christopher C. Doyle,4.2,219.0,https://www.amazon.in/Son-Bhrigu-Pataala-Prophecy-Book-ebook/dp/B076WWS74K,B076WWS74K,₹59,Kindle Edition
Oswaal ISC Question Bank Class 12 English Papers 2 Literature Chapterwise and...,by Oswaal Editorial Board,4.1,7.0,https://www.amazon.in/Question-English-Literature-Chapterwise-Topicwise/dp/9387504999,9387504999,₹169,Paperback
The Jungle Book (Pocket Classics),by Rudyard Kipling,4.6,3.0,https://www.amazon.in/Jungle-Book-Pocket-Classics/dp/9387779351,9387779351,₹69,Paperback
"Cabin Fever: Diary of a Wimpy Kid, Book 6",by Jeff Kinney - Unabridged,4.6,235.0,https://www.amazon.in/Cabin-Fever-Diary-Wimpy-Book/dp/B07DDMX1MH,B07DDMX1MH,₹0,Audible Audiobook
Charlie and the Chocolate Factory,by Roald Dahl - Unabridged,4.6,252.0,https://www.amazon.in/Charlie-and-the-Chocolate-Factory/dp/B079WX4JN8,B079WX4JN8,₹0,Audible Audiobook
Milkman,by Anna Burns - Unabridged,4.4,17.0,https://www.amazon.in/Milkman/dp/B07DM8HFVJ,B07DM8HFVJ,₹0,Audible Audiobook
Ninety-Seven Poems,by Terribly Tiny Tales,4.4,49.0,https://www.amazon.in/Ninety-Seven-Poems-Terribly-Tiny-Tales/dp/0143441175,0143441175,₹133,Paperback
The 3 Mistakes of My Life,by Chetan Bhagat,4.3,614.0,https://www.amazon.in/3-Mistakes-My-Life-ebook/dp/B013VO02MC,B013VO02MC,₹29,Kindle Edition
Vaidik Sanatan Hindutva,by Manoj Singh,4.8,27.0,https://www.amazon.in/Vaidik-Sanatan-Hindutva-Manoj-Singh/dp/9352666887,9352666887,₹238,Paperback
Zibuyu Air Flow Line Stainless Steel Control Valve Aquarium Pump Splitter(3-way),by Zibuyu,,,https://www.amazon.in/Zibuyu-Stainless-Control-Aquarium-Splitter/dp/B07CNQ1SR2,B07CNQ1SR2,₹289,
More Happy Than Not,by Adam Silvera - Unabridged,,,https://www.amazon.in/More-Happy-Than-Not/dp/B01NAVBSLR,B01NAVBSLR,₹0,Audible Audiobook
The Boy of the Mosque,by Ahmad Ardalan - Import,4.5,4.0,https://www.amazon.in/Boy-Mosque-Ahmad-Ardalan/dp/1984982680,1984982680,₹715,Paperback
The Martian,by Andy Weir - Unabridged,4.7,270.0,https://www.amazon.in/The-Martian/dp/B079TLVVG7,B079TLVVG7,₹0,Audible Audiobook
The Old Man and the Sea,by Ernest Hemingway,4.3,1173.0,https://www.amazon.in/Old-Man-Sea-Ernest-Hemingway/dp/0099908409,0099908409,₹75,Paperback
Yayati (Hindi),by Vishnu S. Khandekar,4.1,55.0,https://www.amazon.in/Yayati-Hindi-Vishnu-S-Khandekar/dp/8170285593,8170285593,₹178,Paperback
A Drift from Redwood Camp,by Bret Harte - Import,,,https://www.amazon.in/Drift-Redwood-Camp-Bret-Harte/dp/151509345X,151509345X,₹756,Paperback
Saving Forever Boxset Books #1-3: Billionaire bad boy Romance (Saving Forever...,by Lexy Timms,4.5,35.0,https://www.amazon.in/Saving-Forever-Boxset-Books-1-3-ebook/dp/B06XBDPWSL,B06XBDPWSL,₹0,Kindle Edition
Of Counsel: The Challenges of the Modi-Jaitley Economy,by Arvind Subramanian,4.5,15.0,https://www.amazon.in/Counsel-Challenges-Modi-Jaitley-Economy/dp/0670092096,0670092096,₹357,Hardcover
MEG-6 American Literature,by Kapila Gogia Chugh,3.3,4.0,https://www.amazon.in/MEG-6-American-Literature-Kapila-Gogia/dp/9381690650,9381690650,₹218,Paperback
The Ministry of Utmost Happiness,by Arundhati Roy - Unabridged,3.9,504.0,https://www.amazon.in/The-Ministry-of-Utmost-Happiness/dp/B072LFJKZZ,B072LFJKZZ,₹0,Audible Audiobook
Women of Trakhis: A New Translation,by Sophocles,,,https://www.amazon.in/Women-Trakhis-New-Translation/dp/B0078XFMNC,B0078XFMNC,,
"The Long Haul: Diary of a Wimpy Kid, Book 9",by Jeff Kinney - Unabridged,4.7,963.0,https://www.amazon.in/Long-Haul-Diary-Wimpy-Book/dp/B079XLDBB5,B079XLDBB5,₹0,Audible Audiobook
Death on the Nile (Poirot) (Hercule Poirot Series Book 17),by Agatha Christie,4.4,67.0,https://www.amazon.in/Death-Nile-Poirot-Hercule-Book-ebook/dp/B0046RE5HW,B0046RE5HW,₹49,Kindle Edition
The Fountainhead,by Ayn Rand - Unabridged,4.2,233.0,https://www.amazon.in/The-Fountainhead/dp/B01MZBWH7R,B01MZBWH7R,₹0,Audible Audiobook
Things Girls Love: A step-by-step drawing and story book (Watch Me Draw),by Jenna Winterberg,4.6,145.0,https://www.amazon.in/Things-Girls-Love-step-step/dp/1560109505,1560109505,,Paperback
Awara Masiha,by Vishnu Prabhakar,4.7,12.0,https://www.amazon.in/Awara-Masiha-Vishnu-Prabhakar/dp/8170280044,8170280044,₹275,Hardcover
Picking up the Pieces (Cloverleaf Book 1),by Jessica Prince,4.0,1.0,https://www.amazon.in/Picking-Pieces-Cloverleaf-Jessica-Prince-ebook/dp/B00DQXNWYY,B00DQXNWYY,₹0,Kindle Edition
Matilda,by Roald Dahl - Unabridged,4.7,210.0,https://www.amazon.in/Matilda/dp/B079X54B49,B079X54B49,₹0,Audible Audiobook
Pralay: The Great Deluge,by Vineet Bajpai - Unabridged,4.3,367.0,https://www.amazon.in/Pralay-The-Great-Deluge/dp/B07K7Z54N1,B07K7Z54N1,₹0,Audible Audiobook
How to Read a Book (A Touchstone Book),by Charles Van Doren,4.3,73.0,https://www.amazon.in/How-Read-Book-Touchstone-ebook/dp/B004PYDAPE,B004PYDAPE,₹359,Kindle Edition
"A Chughtai Quartet: Obsession, The Wild One, Wild Pigeons, The Heart Breaks Free",by Ismat Chughtai,4.5,5.0,https://www.amazon.in/Chughtai-Quartet-Obsession-Pigeons-Breaks/dp/8188965871,8188965871,₹389,Paperback
Chanakya's Chant: Book 2 in the Bharat Series of Historical and Mythological...,by Ashwin Sanghi,4.1,585.0,https://www.amazon.in/Chanakyas-Chant-Historical-Mythological-Thrillers/dp/9381626812,9381626812,₹108,Paperback
Jane Eyre,by Charlotte Brontë - Unabridged,4.3,183.0,https://www.amazon.in/Jane-Eyre/dp/B07F7SWN2S,B07F7SWN2S,₹0,Audible Audiobook
TARGET POINT: NTA NET/SET ENGLISH LITERATURE PART-3,by Umesh Dalakoti,4.0,1.0,https://www.amazon.in/TARGET-POINT-ENGLISH-LITERATURE-PART-3-ebook/dp/B07JQFQR25,B07JQFQR25,₹342,Kindle Edition
Quiet: The Power of Introverts in a World That Can't Stop Talking,by Susan Cain - Unabridged,4.4,226.0,https://www.amazon.in/Quiet-Power-Introverts-World-Talking/dp/B079XMXVT2,B079XMXVT2,₹0,Audible Audiobook
"ARCHON's Amrit Dhara - Sat Ajwain (Ajwain Extract), Camphor, Sat Pudina (Mint...",by Generic,4.0,1.0,https://www.amazon.in/ARCHONs-Amrit-Dhara-tonsillitis-toothache/dp/B07H4PR8QD,B07H4PR8QD,₹469,
Kashi: Secret of the Black Temple,by Vineet Bajpai - Unabridged,4.6,206.0,https://www.amazon.in/Kashi-Secret-Black-Temple/dp/B07L5XV1FC,B07L5XV1FC,₹0,Audible Audiobook
PRINT VISA Car Gadi 4 Wheels Four Rich Designer Printed Hard Back Case for Oppo A5,by PRINT VISA,,,https://www.amazon.in/PRINT-VISA-Wheels-Designer-Printed/dp/B07MXJ2JP6,B07MXJ2JP6,₹319,
PRINT VISA Car Gadi 4 Wheels Four Rich Designer Printed Hard Back Case for Oppo A5,by PRINT VISA,,,https://www.amazon.in/PRINT-VISA-Wheels-Designer-Printed/dp/B07MXJ2JP6,B07MXJ2JP6,₹319,
Train to Pakistan,by Khushwant Singh,4.2,550.0,https://www.amazon.in/Train-Pakistan-Khushwant-Singh/dp/0143065882,0143065882,₹125,Paperback
பொண்டாட்டி /PONDATTI (Tamil Edition),by அராத்து  ARAATHU,3.5,2.0,https://www.amazon.in/%E0%AE%AA%E0%AF%8A%E0%AE%A3%E0%AF%8D%E0%AE%9F%E0%AE%BE%E0%AE%9F%E0%AF%8D%E0%AE%9F%E0%AE%BF-PONDATTI-Tamil-%E0%AE%85%E0%AE%B0%E0%AE%BE%E0%AE%A4%E0%AF%8D%E0%AE%A4%E0%AF%81-ARAATHU-ebook/dp/B07MMBJWXW,B07MMBJWXW,₹211,Kindle Edition
Harappa: Curse of the Blood River,by Vineet Bajpai - Unabridged,4.1,680.0,https://www.amazon.in/Harappa-Curse-Blood-River/dp/B07JYPMFGV,B07JYPMFGV,₹0,Audible Audiobook
Global Craft Universal Sports Running Waist Pocket Belt Case for All Mobiles...,by Global Craft,,,https://www.amazon.in/Global-Craft-Universal-Running-Mobiles/dp/B07L7NCVVB,B07L7NCVVB,₹149,
"The Ugly Truth: Diary of a Wimpy Kid, Book 5",by Jeff Kinney - Unabridged,4.6,214.0,https://www.amazon.in/Ugly-Truth-Diary-Wimpy-Book/dp/B07DDNPJW2,B07DDNPJW2,₹0,Audible Audiobook
Global Craft 54-76mm Car Steering Wheel Mobile Holder (Multi-Color) Model 103233,by Global Craft,,,https://www.amazon.in/Global-Craft-54-76mm-Steering-Multi-Color/dp/B07JKCVXN2,B07JKCVXN2,₹139,
Paji Nazmein,by Gulzar,4.9,11.0,https://www.amazon.in/Paji-Nazmein-Gulzar/dp/8183618707,8183618707,₹119,Paperback
Trueman's UGC NET English Literature,by B.P. Panigrahi,3.7,49.0,https://www.amazon.in/Truemans-UGC-NET-English-Literature-ebook/dp/B07CXQ1NQ5,B07CXQ1NQ5,₹286.40,Kindle Edition
Oswaal CBSE Sample Question Paper Class 10 English Language and Literature (For...,by Oswaal Editorial Board,4.5,11.0,https://www.amazon.in/Oswaal-Question-English-Language-Literature/dp/9388036654,9388036654,₹127.20,Paperback
365 Panchatantra Stories,by Adil Mukesh - Unabridged,4.1,180.0,https://www.amazon.in/365-Panchatantra-Stories/dp/B07BS3KGBB,B07BS3KGBB,₹0,Audible Audiobook
Golden English Language and Literature: (With Sample Papers) A book with a Differene...,by R.K. Gupta,4.5,2.0,https://www.amazon.in/Golden-English-Language-Literature-Differene/dp/9387788067,9387788067,₹378,Paperback
Three Men in a Boat (To Say Nothing of the Dog),by Jerome K. Jerome - Unabridged,4.3,200.0,https://www.amazon.in/Three-Men-Boat-Say-Nothing/dp/B079VXKW3B,B079VXKW3B,₹0,Audible Audiobook
"The Lucky Monkey "" (Children's books-The Lucky Monkey Book 1)""",by Efrat Haddi,3.5,7.0,https://www.amazon.in/Lucky-Monkey-Childrens-books-Book-ebook/dp/B00PEUC7N4,B00PEUC7N4,₹79,Kindle Edition
Tell Me your Dreams,by Sidney Sheldon,4.4,160.0,https://www.amazon.in/Tell-your-Dreams-Sidney-Sheldon/dp/8172234902,8172234902,₹185,Paperback
Flodguden (Egypten-serien 1),by Wilbur Smith - Unabridged,,,https://www.amazon.in/Flodguden-Egypten-serien-1/dp/B07G36B2ZM,B07G36B2ZM,₹0,Audible Audiobook
Sapiens (Special Collector’s Editions in Full Colour),by Yuval Noah Harari,4.6,1634.0,https://www.amazon.in/Sapiens-Special-Collectors-Editions-Colour/dp/1846558247,1846558247,₹360,Paperback
"The Burning Maze: The Trials of Apollo, Book 3",by Rick Riordan - Unabridged,4.7,76.0,https://www.amazon.in/Burning-Maze-Trials-Apollo-Book/dp/B07CG7PSHJ,B07CG7PSHJ,₹0,Audible Audiobook
Modernism: A Guide to European Literature 1890-1930 (Penguin Literary Criticism),by Malcolm Bradbury,5.0,2.0,https://www.amazon.in/Modernism-European-Literature-1890-1930-Criticism/dp/0140138323,0140138323,₹915,Paperback
The Hospital: The FREE Short Story: The First Mountain Man Story,by Keith C. Blackmore - Unabridged,,,https://www.amazon.in/Hospital-Short-Story-First-Mountain/dp/B07DM4ZSFH,B07DM4ZSFH,₹0,Audible Audiobook
Ram - Scion of Ikshvaku (Book 1 - Ram Chandra Series): 2015 Edition with Updated...,by Amish Tripathi,4.1,4645.0,https://www.amazon.in/Ram-Scion-Ikshvaku-Chandra-Updated/dp/9385152149,9385152149,₹214,Paperback
HANDBOOK OF ENGLISH LITERATURE(TGT/PGT) ETC.,by DR. SUDHIR K. ARORA,4.1,6.0,https://www.amazon.in/HANDBOOK-ENGLISH-LITERATURE-TGT-ETC/dp/8179775763,8179775763,₹375,Paperback
Who's book line is it anyway?,by Craig Heathcote,,,https://www.amazon.in/Craig-Heathcote-Whos-book-anyway/dp/B07L5F6HK2,B07L5F6HK2,₹0,
The Forest of Enchantments,by Chitra Banerjee Divakaruni,4.6,8.0,https://www.amazon.in/Forest-Enchantments-Chitra-Banerjee-Divakaruni/dp/9353025982,9353025982,₹373,Hardcover
My Little General Knowledge Quiz Book Vol 1: 100 Multiple-Choice Questions,by Bernard Morris,3.6,12.0,https://www.amazon.in/Little-General-Knowledge-Quiz-Book-ebook/dp/B073R5Z7VJ,B073R5Z7VJ,₹0,Kindle Edition
Poonachi: Or the Story of a Black Goat,by Perumal Murugan,4.5,117.0,https://www.amazon.in/Poonachi-Story-Black-Perumal-Murugan/dp/9386850494,9386850494,₹244,Hardcover
Objective Type Questions On Literature In English For Ugc'S Net,by Bhim S. Dahiya,3.8,10.0,https://www.amazon.in/Objective-Type-Questions-Literature-English/dp/8186044035,8186044035,₹165,Paperback
UP/MP TGT - PGT OBJECTIVE ENGLISH LITERATURE & CHAPTERWISE GRAMMER,by karuna suri,,,https://www.amazon.in/UP-TGT-OBJECTIVE-LITERATURE-CHAPTERWISE/dp/B07MRCRBCK,B07MRCRBCK,₹180,Paperback
English Literature for UGC-NET Paper-3,by CBH EXPERTS,3.5,5.0,https://www.amazon.in/English-Literature-UGC-NET-Paper-3-EXPERTS/dp/9385867032,9385867032,₹243,Paperback
Everything You Need to Ace American History in One Big Fat Notebook: The Complete...,by Workman Publishing,4.8,229.0,https://www.amazon.in/Everything-Need-American-History-Notebook/dp/0761160833,0761160833,₹822,
Kanyasulkam,by Gurrujada Appa Rao,,,https://www.amazon.in/Kanyasulkam-Gurrujada-Appa-Rao/dp/B01AT1IHBI,B01AT1IHBI,₹100,Paperback
Little Red Book of Phrasal Verbs,by Terry O'Brien,3.3,10.0,https://www.amazon.in/Little-Red-Book-Phrasal-Verbs-ebook/dp/B01ETFVIY8,B01ETFVIY8,₹27,Kindle Edition
"National Geographic Kids Why?: Over 1,111 Answers to Everything",by Crispin Boyer,4.6,44.0,https://www.amazon.in/National-Geographic-Kids-Why-Everything/dp/1426320973,1426320973,₹425,Library Binding
Rumi's Secret: The Life of the Sufi Poet of Love,by Brad Gooch - Deckle Edge,5.0,2.0,https://www.amazon.in/Rumis-Secret-Life-Sufi-Poet/dp/0061999148,0061999148,₹504,Hardcover
The Shakespeare Book (Big Ideas),by 0,3.7,5.0,https://www.amazon.in/Shakespeare-Book-Big-Ideas/dp/0241182611,0241182611,₹784,Hardcover
Premchand Ki Sarvashrestha Kahaniyaan,by Prem Chand,5.0,1.0,https://www.amazon.in/Premchand-Sarvashrestha-Kahaniyaan-Prem-Chand/dp/9350838141,9350838141,₹119,Paperback
One Night @ the Call Center,by Chetan Bhagat,4.0,593.0,https://www.amazon.in/Night-Call-Center-Chetan-Bhagat-ebook/dp/B013VO02NQ,B013VO02NQ,₹49,Kindle Edition
Relationships (Jogajog): Translated By Supriya Chaudhuri (The Oxford Tagore Translations),by Rabindranath Tagore,5.0,1.0,https://www.amazon.in/Relationships-Jogajog-Translated-Chaudhuri-Translations/dp/0195686780,0195686780,₹428,Paperback
The Night Train at Deoli and Other Stories,by Ruskin Bond,4.5,134.0,https://www.amazon.in/Night-Train-Deoli-Other-Stories/dp/014011615X,014011615X,₹188,Paperback
Relationships (Jogajog): Translated By Supriya Chaudhuri (The Oxford Tagore Translations),by Rabindranath Tagore,5.0,1.0,https://www.amazon.in/Relationships-Jogajog-Translated-Chaudhuri-Translations/dp/0195686780,0195686780,₹428,Paperback
Nachyo Bahut Gopal,by Nagar,4.9,11.0,https://www.amazon.in/Nachyo-Bahut-Gopal-Nagar/dp/8170280052,8170280052,₹245,Hardcover
And Then There Were None (Agatha Christie Collection),by Agatha Christie,4.6,1341.0,https://www.amazon.in/Then-There-Agatha-Christie-Collection-ebook/dp/B0046H95RM,B0046H95RM,₹49,Kindle Edition
Sri Sri Maryada Ramanna Kathalu (Telugu),by Yuvamithra,,,https://www.amazon.in/Sri-Maryada-Ramanna-Kathalu-Telugu/dp/B076HR75H5,B076HR75H5,₹50,Paperback
Classical Literary Criticism (Penguin Classics),by Various,4.1,9.0,https://www.amazon.in/Classical-Literary-Criticism-Penguin-Classics/dp/0140446516,0140446516,₹280,Paperback
VICTORIAN LITERATURE,by PRADIPTO BORGHAIN,5.0,1.0,https://www.amazon.in/VICTORIAN-LITERATURE-PRADIPTO-BORGHAIN/dp/9386296977,9386296977,₹225,Paperback
ICSE Merchant of Venice Questions and Answers For Class 10,by Madhuri Shukla,5.0,1.0,https://www.amazon.in/Merchant-Venice-Questions-Answers-Class/dp/B07J6BP7ZC,B07J6BP7ZC,₹499,Paperback
"Moonlight (By My Light, Book One) (Romantic Werewolf / Shifter)",by Mac Flynn,4.5,2.0,https://www.amazon.in/Moonlight-Light-Romantic-Werewolf-Shifter-ebook/dp/B016YZEZJG,B016YZEZJG,₹0,Kindle Edition
Sins Of Gods,by Dr Chandranshu Chaudhary,4.8,8.0,https://www.amazon.in/Sins-Gods-Dr-Chandranshu-Chaudhary/dp/B07MX778ZP,B07MX778ZP,₹149,Paperback
Oswaal ICSE Sample Question Papers Class 10 English Papers 2 Literature (For...,by Oswaal Editorial Board,5.0,6.0,https://www.amazon.in/Oswaal-Sample-Question-English-Literature/dp/9388462122,9388462122,₹134,Paperback
The Boy on the Wooden Box: How the Impossible Became Possible . . . on Schindler's...,by Leon Leyson,5.0,5.0,https://www.amazon.in/Boy-Wooden-Box-Impossible-Schindlers/dp/1442497823,1442497823,₹661,Paperback
The Girl on the Train,by Paula Hawkins - Unabridged,3.8,922.0,https://www.amazon.in/The-Girl-on-the-Train/dp/B06WW5F5P3,B06WW5F5P3,₹0,Audible Audiobook
Helping People See (Smithsonian Readers: Building Literacy with Steam),by Monika Davies - Import,,,https://www.amazon.in/Helping-People-See-Smithsonian-Readers/dp/1493866869,1493866869,₹842,Perfect Paperback
Oswaal CBSE Sample Question Paper For Class 10 (Set of 5 Books) English Language...,by Oswaal Editorial Board,5.0,3.0,https://www.amazon.in/Question-English-Language-Literature-Science/dp/9388301609,9388301609,₹599,Paperback
Gitanjali,,3.8,63.0,https://www.amazon.in/Gitanjali/dp/9385077961,9385077961,₹93,Paperback
Abhigyan Shakuntal (Sanskrit Classics),by Kalidas,4.4,21.0,https://www.amazon.in/Abhigyan-Shakuntal-Sanskrit-Classics-Kalidas/dp/8170287731,8170287731,₹119,Paperback
CBSE Champion Chapterwise - Topicwise English Language & Literature - Class 10,by MTG Editorial Board,,,https://www.amazon.in/CBSE-Champion-Chapterwise-Topicwise-Literature/dp/9387949907,9387949907,₹240,Paperback
Eleven Minutes,by Paulo Coelho,4.2,232.0,https://www.amazon.in/Eleven-Minutes-Paulo-Coelho/dp/8172235631,8172235631,₹177,Paperback
The Complete Novels of Sherlock Holmes,by Arthur Conan Doyle,4.3,837.0,https://www.amazon.in/Complete-Novels-Sherlock-Holmes/dp/8175994312,8175994312,₹146,Paperback
POWER PLUS TRAVELLING SD/SIM CARD SAFE CASE,by Aarav,,,https://www.amazon.in/POWER-PLUS-TRAVELLING-CARD-SAFE/dp/B071FWLJ63,B071FWLJ63,,
The Bird with Golden Wings: Stories of Wit and Magic,by Sudha Murty,4.6,106.0,https://www.amazon.in/Bird-Golden-Wings-Stories-Magic/dp/0143334255,0143334255,₹140,Paperback
