Title,Author,Rating,Reviews Count,URL,ISBN-10,Price,Binding
History of English Literature,by Edward Albert,4.4,64.0,https://www.amazon.in/History-English-Literature-Edward-Albert/dp/0199479313,0199479313,₹203,Paperback
English Literature: Modern,by G. H. (George Herbert) Mair,4.2,7.0,https://www.amazon.in/English-Literature-George-Herbert-Mair-ebook/dp/B004TQKJOS,B004TQKJOS,₹0,Kindle Edition
Wuthering Heights,by Emily Brontë,4.1,244.0,https://www.amazon.in/Wuthering-Heights-Emily-Bront%C3%AB/dp/8172344899,8172344899,₹80,Paperback
Ugc Net English Literature,by Arihant Experts,4.0,43.0,https://www.amazon.in/Ugc-English-Literature-Arihant-Experts/dp/9312146319,9312146319,₹409,Paperback
Hamlet,by William Shakespeare,4.2,105.0,https://www.amazon.in/Hamlet-William-Shakespeare/dp/8175992921,8175992921,₹99,Paperback
Gitanjali,by Tagore R,4.4,259.0,https://www.amazon.in/Gitanjali-Tagore-R/dp/9381523185,9381523185,₹68,Paperback
Malgudi Adventures,by Narayan R.K.,4.3,153.0,https://www.amazon.in/Malgudi-Adventures-Narayan-R-K/dp/0143335901,0143335901,₹144,Paperback
History of American Literature,by Reuben Post Halleck,4.0,8.0,https://www.amazon.in/History-American-Literature-Reuben-Halleck-ebook/dp/B004TS8F2E,B004TS8F2E,₹0,Kindle Edition
Treasure Island,by Robert Louis Stevenson,4.2,116.0,https://www.amazon.in/Treasure-Island-Robert-Louis-Stevenson/dp/8172344767,8172344767,₹99,Paperback
Metamorphosis,by Franz Kafka,4.2,197.0,https://www.amazon.in/Metamorphosis-Franz-Kafka/dp/8172345135,8172345135,₹69,Paperback
The Literature Book: Big Ideas Simply Explained,by DK,4.4,6.0,https://www.amazon.in/Literature-Book-Ideas-Simply-Explained/dp/0241015464,0241015464,₹749.25,Hardcover
English Literature,by William J. Long,4.3,19.0,https://www.amazon.in/English-Literature-William-J-Long/dp/9380005288,9380005288,₹271,Paperback
The Prophet,by Kahlil Gibran,4.5,242.0,https://www.amazon.in/Prophet-Kahlil-Gibran/dp/817234354X,817234354X,₹69,Paperback
Egyptian Mythology: A Concise Guide to the Ancient Gods and Beliefs of Egyptian...,by Hourly History,4.7,12.0,https://www.amazon.in/Egyptian-Mythology-Concise-Ancient-Beliefs-ebook/dp/B01D8E7W1E,B01D8E7W1E,₹0,Kindle Edition
A Critical History Of English Literature - Volume I & Ii (combo Pack),by David Daiches,4.1,55.0,https://www.amazon.in/Critical-History-English-Literature-combo/dp/8189930648,8189930648,₹520,Paperback
An Objective History of English Literature Through Multiple-Choice Questions...,by B.B.Jain,4.0,73.0,https://www.amazon.in/Objective-History-Literature-Multiple-Choice-Questions/dp/8174822054,8174822054,₹145,Paperback
An Outline History of English Literature,by W.H. Hudson,4.1,30.0,https://www.amazon.in/Outline-History-English-Literature/dp/9380005156,9380005156,₹112,Paperback
One Indian Girl,by Chetan Bhagat,3.6,4934.0,https://www.amazon.in/One-Indian-Girl-Chetan-Bhagat/dp/8129142147,8129142147,₹97,Paperback
"The Complete Works of William Shakespeare: All 37 plays, 160 sonnets and 5 poetry...",by William Shakespeare,5.0,7.0,https://www.amazon.in/Complete-Works-William-Shakespeare-Classics-ebook/dp/B01FRM2ILE,B01FRM2ILE,₹99,Kindle Edition
The Victorian Age in Literature,by G. K. (Gilbert Keith) Chesterton,4.3,11.0,https://www.amazon.in/Victorian-Literature-Gilbert-Keith-Chesterton-ebook/dp/B004TQ1FCS,B004TQ1FCS,₹0,Kindle Edition
Diary of a Young Girl,by Anne Frank - Unabridged,4.5,754.0,https://www.amazon.in/Diary-of-a-Young-Girl/dp/B079X223RD,B079X223RD,₹0,Audible Audiobook
A History of Elizabethan Literature,by George Saintsbury,5.0,1.0,https://www.amazon.in/History-Elizabethan-Literature-George-Saintsbury-ebook/dp/B004TQF1RI,B004TQF1RI,₹0,Kindle Edition
A History of Nineteenth Century Literature (1780-1895),by George Saintsbury,5.0,2.0,https://www.amazon.in/History-Nineteenth-Century-Literature-1780-1895-ebook/dp/B004TP1K6U,B004TP1K6U,₹0,Kindle Edition
The Girl in Room 105,by Chetan Bhagat - Unabridged,4.1,1493.0,https://www.amazon.in/The-Girl-in-Room-105/dp/B07KB5HMKN,B07KB5HMKN,₹0,Audible Audiobook
Essays in Literature and History,by James Anthony Froude,5.0,2.0,https://www.amazon.in/Essays-Literature-History-Anthony-Froude-ebook/dp/B0058KTZ1C,B0058KTZ1C,₹0,Kindle Edition
Nineteen Eighty-Four,by George Orwell - Unabridged,4.4,739.0,https://www.amazon.in/Nineteen-Eighty-Four/dp/B07B5Y2XCN,B07B5Y2XCN,₹0,Audible Audiobook
The Concise Oxford Companion to English Literature (Oxford Quick Reference),by Dinah Birch,4.4,26.0,https://www.amazon.in/Concise-Companion-English-Literature-Reference/dp/0199608210,0199608210,₹565,Paperback
The Essays of Arthur Schopenhauer; The Art of Literature,by Arthur Schopenhauer,4.4,18.0,https://www.amazon.in/Essays-Arthur-Schopenhauer-Art-Literature-ebook/dp/B004UKF4SY,B004UKF4SY,₹0,Kindle Edition
English Literature and Society in the Eighteenth Century,by Sir Leslie Stephen,5.0,1.0,https://www.amazon.in/English-Literature-Society-Eighteenth-Century-ebook/dp/B0082X8NXI,B0082X8NXI,₹0,Kindle Edition
The Monk Who Sold His Ferrari: A Spiritual Fable About Fulfilling Your Dreams...,by Robin Sharma - Unabridged,4.6,2913.0,https://www.amazon.in/Monk-Who-Sold-His-Ferrari/dp/B072K5XLHC,B072K5XLHC,₹0,Audible Audiobook
Mysticism in English Literature,by Caroline F. E. Spurgeon,4.0,1.0,https://www.amazon.in/Mysticism-English-Literature-Caroline-Spurgeon-ebook/dp/B0082SEWT2,B0082SEWT2,₹0,Kindle Edition
"The Meltdown: Diary of a Wimpy Kid, Book 13",by Jeff Kinney - Unabridged,4.7,290.0,https://www.amazon.in/Meltdown-Diary-Wimpy-Kid-Book/dp/B07BRD5Z64,B07BRD5Z64,₹0,Audible Audiobook
English: Composition and Literature,by W. F. (William Franklin) Webster,4.7,4.0,https://www.amazon.in/English-Composition-William-Franklin-Webster-ebook/dp/B004UJKT1C,B004UJKT1C,₹0,Kindle Edition
CBSE All  In one English Language and Literature Class 10  (based on books First...,by Gajendra Singh,3.8,23.0,https://www.amazon.in/English-Language-Literature-Footprints-Without/dp/9312149555,9312149555,₹229,Paperback
A Short Biographical Dictionary of English Literature,by John W. (John William) Cousin,5.0,2.0,https://www.amazon.in/Short-Biographical-Dictionary-English-Literature-ebook/dp/B004TQGT6U,B004TQGT6U,₹0,Kindle Edition
"The Secret: Seasons of Grace, Book 1",by Beverly Lewis - Abridged,4.5,1606.0,https://www.amazon.in/Secret-Seasons-Grace-Book/dp/B07B4PPSN5,B07B4PPSN5,₹0,Audible Audiobook
"Modern English Literature, 1890-1960 (Literary Contexts)",by Sipra Mukherjee,3.7,4.0,https://www.amazon.in/English-Literature-1890-1960-Literary-Contexts/dp/8125062734,8125062734,₹256,Tankobon Softcover
"A Brief History of the English Language and Literature, Vol. 2",by J. M. D. (John Miller Dow) Meiklejohn,5.0,4.0,https://www.amazon.in/Brief-History-English-Language-Literature-ebook/dp/B004TQUXEE,B004TQUXEE,₹0,Kindle Edition
"Harry Potter and the Goblet of Fire, Book 4",by J.K. Rowling - Unabridged,4.7,321.0,https://www.amazon.in/Harry-Potter-Goblet-Fire-Book/dp/B079TLCMQT,B079TLCMQT,₹0,Audible Audiobook
UGC/NET/JRF/SET English Literature (Paper-II And III),by Choudhary H L,4.0,6.0,https://www.amazon.in/UGC-NET-English-Literature-Paper-II/dp/9350132044,9350132044,₹399,Paperback
"Harry Potter and the Goblet of Fire, Book 4",by J.K. Rowling - Unabridged,4.7,321.0,https://www.amazon.in/Harry-Potter-Goblet-Fire-Book/dp/B079TLCMQT,B079TLCMQT,₹0,Audible Audiobook
Immortals of Meluha (The Shiva Trilogy Book 1),by Amish Tripathi,4.6,2632.0,https://www.amazon.in/Immortals-Meluha-Shiva-Trilogy-Book-ebook/dp/B008593O8S,B008593O8S,₹109,Kindle Edition
"Harry Potter and the Philosopher's Stone, Book 1",by J.K. Rowling - Unabridged,4.7,1092.0,https://www.amazon.in/Harry-Potter-Philosophers-Stone-Book/dp/B072W9Y8T7,B072W9Y8T7,₹0,Audible Audiobook
One Hundred Years of Solitude (International Writers S.),by Gabriel Garcia Marquez,4.2,264.0,https://www.amazon.in/Hundred-Years-Solitude-International-Writers/dp/0140157514,0140157514,₹207,Paperback
Studies in Early Victorian Literature,by Frederic Harrison,5.0,1.0,https://www.amazon.in/Studies-Victorian-Literature-Frederic-Harrison-ebook/dp/B0082SD09K,B0082SD09K,₹0,Kindle Edition
English Course Communicative: Literature Reader - Class 10,,3.8,4.0,https://www.amazon.in/English-Course-Communicative-Literature-Reader/dp/B07DGX7XQ2,B07DGX7XQ2,₹137,Paperback
Pride & Prejudice,by Jane Austen,4.3,352.0,https://www.amazon.in/Pride-Prejudice-Jane-Austen/dp/8172344503,8172344503,₹79,Paperback
Sita: Warrior of Mithila,by Amish - Unabridged,4.3,1813.0,https://www.amazon.in/Sita-Warrior-of-Mithila/dp/B0756QPYZ1,B0756QPYZ1,₹0,Audible Audiobook
Hindi -Optional Printed Photocopied Drishti IAS [Vikash Divyakirti] [IAS][PCS],by Vikash Divyakirti,4.5,2.0,https://www.amazon.in/Optional-Printed-Photocopied-Drishti-Divyakirti/dp/B07FZ7VSCL,B07FZ7VSCL,₹988,Paperback
English Literature for Boys and Girls,by H. E. (Henrietta Elizabeth) Marshall,3.2,3.0,https://www.amazon.in/English-Literature-Henrietta-Elizabeth-Marshall-ebook/dp/B0082RDKS2,B0082RDKS2,₹0,Kindle Edition
"Life Is What You Make It: A story of love, hope and how determination can overcome...",by Preeti Shenoy - Unabridged,4.0,2859.0,https://www.amazon.in/Life-What-You-Make-determination/dp/B01N12DF31,B01N12DF31,₹0,Audible Audiobook
Animal Farm,by George Orwell - Unabridged,4.6,1001.0,https://www.amazon.in/Animal-Farm/dp/B07B66RD7M,B07B66RD7M,₹0,Audible Audiobook
Oswaal ICSE Question Bank Class 10 English Papers 2 Literature Chapterwise and...,by Oswaal Editorial Board,4.2,9.0,https://www.amazon.in/Question-English-Literature-Chapterwise-Topicwise/dp/938750462X,938750462X,₹207,Paperback
Sidharth,by Hermann Hesse,4.3,69.0,https://www.amazon.in/Sidharth-Hermann-Hesse/dp/9350642344,9350642344,₹104,Paperback
English Literature: Its History and Its Significance For the Life of the Englishspeaking...,by William J. Long - Import,4.5,16.0,https://www.amazon.in/English-Literature-History-Significance-Englishspeaking/dp/812913540X,812913540X,₹146,Paperback
The Expense of Spirit: Love and Sexuality in English Renaissance Drama,by Mary Beth Rose,,,https://www.amazon.in/Expense-Spirit-Sexuality-English-Renaissance-ebook/dp/B07BB215WN,B07BB215WN,₹0,Kindle Edition
"Postcolonial Literature: An Introduction, 1e",by Nayar,4.5,15.0,https://www.amazon.in/Postcolonial-Literature-Introduction-1e-Nayar/dp/8131713733,8131713733,₹271,Paperback
The Routledge History of Literature in English,by Ronald Carter,4.8,68.0,https://www.amazon.in/Routledge-History-Literature-English/dp/0415791022,0415791022,₹730,Paperback
The Alchemist,by Paulo Coelho,4.6,3825.0,https://www.amazon.in/Alchemist-Paulo-Coelho/dp/8172234988,8172234988,₹182,Paperback
Norwegian Wood,by Haruki Murakami - Unabridged,4.3,176.0,https://www.amazon.in/Norwegian-Wood/dp/B079VCPWB1,B079VCPWB1,₹0,Audible Audiobook
"World Literature Book of Years: For NET, SET and Other Competitive Exams",by Kalyani Vallath,3.1,2.0,https://www.amazon.in/World-Literature-Book-Years-Competitive-ebook/dp/B074394F36,B074394F36,₹116.82,Kindle Edition
Oswaal ISC Sample Question Papers Class 12 English Papers 2 Literature (For 2019...,by Oswaal Editorial Board,5.0,4.0,https://www.amazon.in/Oswaal-Sample-Question-English-Literature/dp/9388462270,9388462270,₹142,Paperback
English Literature in Context,by Paul Poplawski,4.6,3.0,https://www.amazon.in/English-Literature-Context-Paul-Poplawski/dp/1108716431,1108716431,₹720,Paperback
Earl Nightingale Reads Think and Grow Rich,by Napoleon Hill - Unabridged,4.6,3603.0,https://www.amazon.in/Earl-Nightingale-Reads-Think-Grow/dp/B079CLX9J3,B079CLX9J3,₹0,Audible Audiobook
"Harry Potter and the Chamber of Secrets, Book 2",by J.K. Rowling - Unabridged,4.7,559.0,https://www.amazon.in/Harry-Potter-Chamber-Secrets-Book/dp/B079TLW9BL,B079TLW9BL,₹0,Audible Audiobook
The Jewel of Dantenos: The FREE Lee Starfinder Adventure: from the World of the...,by Brian D. Anderson - Unabridged,,,https://www.amazon.in/Jewel-Dantenos-Starfinder-Adventure-Chronicles/dp/B07DM4TBXN,B07DM4TBXN,₹0,Audible Audiobook
365 Tales of Indian Mythology,by Om Books International - Unabridged,4.1,75.0,https://www.amazon.in/365-Tales-of-Indian-Mythology/dp/B07F16PM7N,B07F16PM7N,₹0,Audible Audiobook
Everyone Has a Story,by Savi Sharma - Unabridged,4.1,3363.0,https://www.amazon.in/Everyone-Has-a-Story/dp/B07234KGR7,B07234KGR7,₹0,Audible Audiobook
Kiran’s Kawish UPSC Urdu Literature Optional - 2327,by Kiran Prakashan,4.5,2.0,https://www.amazon.in/Kirans-Kawish-UPSC-Literature-Optional/dp/B07HC85469,B07HC85469,₹124,Paperback
Studies in Literature and History,by Sir Alfred Comyn Lyall,,,https://www.amazon.in/Studies-Literature-History-Alfred-Comyn-ebook/dp/B0082VJCNU,B0082VJCNU,₹0,Kindle Edition
"Double Down: Diary of a Wimpy Kid, Book 11",by Jeff Kinney - Unabridged,4.6,634.0,https://www.amazon.in/Double-Down-Diary-Wimpy-Book/dp/B079XLDGDV,B079XLDGDV,₹0,Audible Audiobook
"The Getaway: Diary of a Wimpy Kid, Book 12",by Jeff Kinney - Unabridged,4.7,496.0,https://www.amazon.in/Getaway-Diary-Wimpy-Kid-Book/dp/B076HWB9F6,B076HWB9F6,₹0,Audible Audiobook
Sense & Sensibility,by Jane Austen,4.2,94.0,https://www.amazon.in/Sense-Sensibility-Jane-Austen/dp/8172344511,8172344511,₹88,Paperback
500 Classic Works of Literature,by Nodtronics Pvt. Ltd.,,,https://www.amazon.in/500-Classic-Works-of-Literature/dp/B01M18CCAD,B01M18CCAD,₹499,
Half Girlfriend,by Chetan Bhagat - Unabridged,4.2,6562.0,https://www.amazon.in/Half-Girlfriend/dp/B07KB7ZN4S,B07KB7ZN4S,₹0,Audible Audiobook
"English Literature Fact Book: For NET, SET and Other Competitive Exams",by Kalyani  Vallath,4.0,7.0,https://www.amazon.in/English-Literature-Fact-Book-Competitive-ebook/dp/B074P4Z7H2,B074P4Z7H2,₹199,Kindle Edition
All  in One English Communicative CBSE Class 10  (based on textbook Literature...,by Gajendra Singh,4.5,157.0,https://www.amazon.in/English-Communicative-textbook-Literature-Reader/dp/9312149547,9312149547,₹235,Paperback
UGC NET/JRF/SET English Literature: Paper - II & III,by Aarti Anil,2.9,5.0,https://www.amazon.in/UGC-NET-JRF-English-Literature/dp/935013327X,935013327X,₹313,Paperback
The Great Gatsby,by F. Scott Fitzgerald - Unabridged,4.1,338.0,https://www.amazon.in/The-Great-Gatsby/dp/B01N360S08,B01N360S08,₹0,Audible Audiobook
"Old School: Diary of a Wimpy Kid, Book 10",by Jeff Kinney - Unabridged,4.7,783.0,https://www.amazon.in/Old-School-Diary-Wimpy-Book/dp/B079WT2734,B079WT2734,₹0,Audible Audiobook
"Harry Potter and the Half-Blood Prince, Book 6",by J.K. Rowling - Unabridged,4.6,243.0,https://www.amazon.in/Harry-Potter-Half-Blood-Prince-Book/dp/B079NQ5V39,B079NQ5V39,₹0,Audible Audiobook
Modern Indian Literature: Poems and Short Stories,by Delhi University,4.4,3.0,https://www.amazon.in/Modern-Indian-Literature-Poems-Stories/dp/0195651189,0195651189,,Paperback
The Complete Short Stories of Sherlock Holmes,by Sir Arthur Conan Doyle,3.6,15.0,https://www.amazon.in/Complete-Short-Stories-Sherlock-Holmes-ebook/dp/B008X3TDB8,B008X3TDB8,₹162.45,Kindle Edition
CBSE All  In One English Language and Literature CBSE Class 9 (based on Books...,by Gajendra Singh,4.3,56.0,https://www.amazon.in/English-Language-Literature-Beehive-Moments/dp/9312149431,9312149431,₹234,Paperback
Crime and Punishment (Recorded Books Edition),by Fyodor Dostoevsky - Unabridged,4.1,158.0,https://www.amazon.in/Crime-Punishment-Recorded-Books/dp/B07B2ZKJPZ,B07B2ZKJPZ,₹0,Audible Audiobook
Books Quiz,by VOXOGENIC TECHNOLOGIES PVT. LTD.,5.0,1.0,https://www.amazon.in/VOXOGENIC-TECHNOLOGIES-PVT-LTD-Books/dp/B07GJ8GRCJ,B07GJ8GRCJ,₹0,
MEG6-American Literature (IGNOU help book for MEG-6 in English Medium),,3.6,5.0,https://www.amazon.in/MEG6-American-Literature-IGNOU-English-Medium/dp/B00KL9LV5S,B00KL9LV5S,₹244.50,Paperback
The Pregnancy Handbook For Indian Moms: A Doctor's Answers To All Your Questions,by Dr. Vinita Salvi,4.0,58.0,https://www.amazon.in/Pregnancy-Handbook-Indian-Moms-Questions/dp/0143419390,0143419390,₹279,Paperback
Little Kids First Big Book of Animals (First Big Book) (National Geographic Little...,by Catherine D. Hughes,4.6,95.0,https://www.amazon.in/Little-First-Animals-National-Geographic/dp/1426307047,1426307047,₹296,Hardcover
Five Little Pigs (Poirot) (Hercule Poirot Series Book 24),by Agatha Christie,4.5,100.0,https://www.amazon.in/Five-Little-Pigs-Poirot-Hercule-ebook/dp/B0046RE5BS,B0046RE5BS,₹49,Kindle Edition
"Karl Marx. Personality, Philosopher, Economist, Sociologist, Historian, Journalist...",by Sams Shopping,,,https://www.amazon.in/Personality-Philosopher-Sociologist-Journalist-Literature/dp/B07LD9N5DC,B07LD9N5DC,₹180,
David Copperfield [Trout Lake Media],by Charles Dickens - Unabridged,4.4,77.0,https://www.amazon.in/David-Copperfield-Trout-Lake-Media/dp/B079TGK5SJ,B079TGK5SJ,₹0,Audible Audiobook
Puppy Training for Kids,by Colleen Pelar,5.0,1.0,https://www.amazon.in/Puppy-Training-Kids-Colleen-Pelar/dp/1438000995,1438000995,₹458,Paperback
MEG8-New Literature in English (IGNOU help book for MEG-8 in English Medium),,4.0,1.0,https://www.amazon.in/MEG8-New-Literature-English-IGNOU-Medium/dp/B00KL9LZ3Q,B00KL9LZ3Q,₹280,Paperback
The Jungle Book,by Rudyard Kipling,4.0,210.0,https://www.amazon.in/Jungle-Book-Rudyard-Kipling/dp/8172344228,8172344228,,Paperback
A Handbook of Literature in English for Competitive Examinations,by S. C. Mundhra,2.7,8.0,https://www.amazon.in/Handbook-Literature-English-Competitive-Examinations/dp/8179774317,8179774317,₹717.99,Paperback
An Outline History of English Literature,by William Henry Hudson,4.1,34.0,https://www.amazon.in/Outline-History-English-Literature/dp/8129135396,8129135396,₹113,Paperback
Easy Handbook: For NET English Literature,by Kalyani Vallath,3.7,5.0,https://www.amazon.in/Easy-Handbook-NET-English-Literature-ebook/dp/B073P3BMF2,B073P3BMF2,₹116.82,Kindle Edition
Oswaal CBSE Sample Question Paper For Class 10 (Set of 5 Books) English Language...,by Oswaal Editorial Board,5.0,3.0,https://www.amazon.in/Question-English-Language-Literature-Science/dp/9388301579,9388301579,₹609,Paperback
Oswaal CBSE Chapterwise and Topicwise Question Bank with Complete Solutions For...,by Oswaal Books,2.0,1.0,https://www.amazon.in/Oswaal-Chapterwise-Topicwise-Solutions-Literature/dp/B072BSLNVK,B072BSLNVK,,
"Harry Potter and the Order of the Phoenix, Book 5",by J.K. Rowling - Unabridged,4.5,302.0,https://www.amazon.in/Harry-Potter-Order-Phoenix-Book/dp/B079NCR3J9,B079NCR3J9,₹0,Audible Audiobook
Best Poems of the Bronte Sisters (Dover Thrift S.),by Emily Bronte - Unabridged,3.9,16.0,https://www.amazon.in/Poems-Bronte-Sisters-Dover-Thrift/dp/048629529X,048629529X,₹167,Paperback
BEGE101-From Language to Literature (IGNOU help book for BEGE-101 in English...,,3.2,6.0,https://www.amazon.in/BEGE101-Language-Literature-BEGE-101-English/dp/B00JHVWW68,B00JHVWW68,₹149,Paperback
"The Titan's Curse: Percy Jackson, Book 3",by Rick Riordan - Unabridged,4.7,293.0,https://www.amazon.in/Titans-Curse-Percy-Jackson-Book/dp/B079WWG7D7,B079WWG7D7,₹0,Audible Audiobook
The Kindness of Strangers (Lonely Planet Travel Literature),by Tim Cahill,4.1,24.0,https://www.amazon.in/Kindness-Strangers-Lonely-Planet-Literature-ebook/dp/B00WYIX6UC,B00WYIX6UC,₹560.96,Kindle Edition
Trueman's UGC NET Hindi Sahitya (Hindi Literature),by Board of Authors,3.7,8.0,https://www.amazon.in/Truemans-UGC-Hindi-Sahitya-Literature/dp/8189301179,8189301179,₹327,Paperback
Half Torn Hearts,by Novoneel Chakraborty,,,https://www.amazon.in/Half-Torn-Hearts-Novoneel-Chakraborty/dp/0143442694,0143442694,₹149,Paperback
2 States: The Story of My Marriage,by Chetan Bhagat,4.4,640.0,https://www.amazon.in/2-States-Story-My-Marriage/dp/8129135523,8129135523,₹96,Paperback
Aarav POWER PLUS ELECTRA LUNCH BOX PLASTIC- 3 CONTAINER,by Generic,,,https://www.amazon.in/Aarav-POWER-ELECTRA-PLASTIC-CONTAINER/dp/B01F8MJ9U6,B01F8MJ9U6,,
A Background to the study of English Literature: Revised Edition,by Brijadish Prasad,3.8,18.0,https://www.amazon.in/Background-study-English-Literature-Revised/dp/9351380424,9351380424,₹175,Paperback
Literacy India Indha Organic Jute Multi Utility Magazine/Books Holder,by Literacy India Indha,,,https://www.amazon.in/Literacy-India-Indha-Organic-Magazine/dp/B07BFW6V11,B07BFW6V11,₹499,
2 States: The Story of My Marriage,by Chetan Bhagat,4.4,640.0,https://www.amazon.in/2-States-Story-My-Marriage/dp/8129135523,8129135523,₹96,Paperback
Zibuyu Auto Temper Adjustment Aquarium Submersible Fish Tank Water Heater(200W),by Zibuyu,,,https://www.amazon.in/Zibuyu-Temper-Adjustment-Aquarium-Submersible/dp/B07CP3D7NG,B07CP3D7NG,₹579,
Pyjamas are Forgiving,by Twinkle Khanna,3.4,232.0,https://www.amazon.in/Pyjamas-are-Forgiving-Twinkle-Khanna/dp/9386228971,9386228971,₹170,Paperback
Hakim's Shivlingi Beej Powder (100 gms) + Putrajeevak seeds Powder (100 gms),by Generic,,,https://www.amazon.in/Hakims-Shivlingi-Powder-Putrajeevak-seeds/dp/B07H1KJPYB,B07H1KJPYB,₹449,
PRINT VISA Home Radio Love Music Designer Printed Hard Back Case for Oppo A5,by PRINT VISA,,,https://www.amazon.in/PRINT-VISA-Radio-Designer-Printed/dp/B07MXJT457,B07MXJT457,₹319,
Global Craft 6 LED Solar Power Camping Lantern Light Rechargable Collapsible...,by Global Craft,,,https://www.amazon.in/Global-Craft-Rechargable-Collapsible-Waterproof/dp/B07L7LQC81,B07L7LQC81,₹399,
Global Craft 54-76mm Car Steering Wheel Mobile Holder (Multi-Color) Model 122637,by Global Craft,,,https://www.amazon.in/Global-Craft-54-76mm-Steering-Multi-Color/dp/B07L7MHVDX,B07L7MHVDX,₹139,
VOLTAC 359054 Digital Unisex Watch,by VOLTAC,,,https://www.amazon.in/VOLTAC-Digital-Unisex-Watch-359054/dp/B07C54WK3K,B07C54WK3K,₹149,
"Harry Potter and the Deathly Hallows, Book 7",by J.K. Rowling - Unabridged,4.6,352.0,https://www.amazon.in/Harry-Potter-Deathly-Hallows-Book/dp/B079TM8Q6Q,B079TM8Q6Q,₹0,Audible Audiobook
The Murder on the Links (Poirot) (Hercule Poirot Series Book 2),by Agatha Christie,4.5,37.0,https://www.amazon.in/Murder-Links-Poirot-Hercule-Book-ebook/dp/B0046RE5AO,B0046RE5AO,₹49,Kindle Edition
Classical Literature (Pelican Books),by Richard Jenkins,5.0,1.0,https://www.amazon.in/Classical-Literature-Pelican-Richard-Jenkins/dp/0141977353,0141977353,₹259,Mass Market Paperback
"Harry Potter and the Prisoner of Azkaban, Book 3",by J.K. Rowling - Unabridged,4.4,472.0,https://www.amazon.in/Harry-Potter-Prisoner-Azkaban-Book/dp/B079TM9NNT,B079TM9NNT,₹0,Audible Audiobook
The Ministry of Utmost Happiness,by Arundhati Roy - Unabridged,3.9,504.0,https://www.amazon.in/The-Ministry-of-Utmost-Happiness/dp/B072LFJKZZ,B072LFJKZZ,₹0,Audible Audiobook
Kanshiram: Leader Of The Dalits,by Badri Narayan,4.3,15.0,https://www.amazon.in/Kanshiram-Leader-Dalits-Badri-Narayan/dp/0143446657,0143446657,₹329,Paperback
"Diary of a Wimpy Kid: Diary of a Wimpy Kid, Book 1",by Jeff Kinney - Unabridged,4.6,547.0,https://www.amazon.in/Diary-Wimpy-Kid-Book/dp/B079VPFPD3,B079VPFPD3,₹0,Audible Audiobook
"A Game of Thrones (A Song of Ice and Fire, Book 1)",by George R. R. Martin,4.5,440.0,https://www.amazon.in/Game-Thrones-Song-Fire-Book-ebook/dp/B004GJXQ20,B004GJXQ20,₹69,Kindle Edition
Lokpriya Shayar Aur Unki Shayari: Sahir Ludhianavi,by Prakash Pandit,4.4,41.0,https://www.amazon.in/Lokpriya-Shayar-Aur-Unki-Shayari/dp/9350641984,9350641984,₹100,Paperback
Macbeth,by William Shakespeare,4.3,89.0,https://www.amazon.in/Macbeth-William-Shakespeare/dp/8175994193,8175994193,₹99,Paperback
Ruskin Bond Ki Lokpriya Kahaniyan,by Ruskin Bond,3.6,9.0,https://www.amazon.in/Ruskin-Bond-Ki-Lokpriya-Kahaniyan/dp/9351865517,9351865517,₹150,Paperback
MEG7-Indian English Literature (IGNOU help book for MEG-7 in English Medium),,5.0,4.0,https://www.amazon.in/MEG7-Indian-English-Literature-IGNOU-Medium/dp/B00KL9LW98,B00KL9LW98,₹229,Paperback
Phoebe's Promise (Oregon Sky Series Book 1),by Kay P. Dawson,4.6,196.0,https://www.amazon.in/Phoebes-Promise-Oregon-Sky-Book-ebook/dp/B01DTBHY46,B01DTBHY46,₹76,Kindle Edition
The White Tiger,by Aravind Adiga - Unabridged,4.1,263.0,https://www.amazon.in/The-White-Tiger/dp/B07BPZMHYD,B07BPZMHYD,₹0,Audible Audiobook
Veronika Decides to Die,by Paulo Coelho,4.4,202.0,https://www.amazon.in/Veronika-Decides-Die-Paulo-Coelho/dp/8172235437,8172235437,₹186,Paperback
Great Expectations [Classic Tales Edition],by Charles Dickens - Unabridged,4.2,180.0,https://www.amazon.in/Great-Expectations-Classic-Tales-Edition/dp/B079BGDSXR,B079BGDSXR,₹0,Audible Audiobook
The Rise of Sivagami : Book 1 of Baahubali - Before the Beginning,by Anand Neelakantan,4.1,793.0,https://www.amazon.in/Rise-Sivagami-Baahubali-Before-Beginning-ebook/dp/B01N7UNAWZ,B01N7UNAWZ,₹29,Kindle Edition
"The Life-Changing Magic of Tidying: A Simple, Effective Way to Banish Clutter...",by Marie Kondo - Unabridged,4.2,94.0,https://www.amazon.in/Life-Changing-Magic-Tidying-Effective-Clutter/dp/B079X1RQGV,B079X1RQGV,₹0,Audible Audiobook
The Handmaid's Tale,by Margaret Atwood - Unabridged,4.3,96.0,https://www.amazon.in/The-Handmaids-Tale/dp/B079WWLTGG,B079WWLTGG,₹0,Audible Audiobook
Chaho Sab Kuchh Chaho,by Sadhguru,4.7,10.0,https://www.amazon.in/Chaho-Sab-Kuchh-Sadhguru/dp/9352665198,9352665198,₹143,Paperback
English Literature: A Very Short Introduction (Very Short Introductions),by Jonathan Bate,5.0,2.0,https://www.amazon.in/English-Literature-Short-Introduction-Introductions/dp/0199569266,0199569266,₹212,Paperback
The World's Best Books : A Key to the Treasures of Literature,by Frank Parsons,3.1,6.0,https://www.amazon.in/Worlds-Best-Books-Treasures-Literature-ebook/dp/B006FL98ME,B006FL98ME,₹0,Kindle Edition
The Great Gatsby,by F. Scott Fitzgerald,4.1,338.0,https://www.amazon.in/Great-Gatsby-F-Scott-Fitzgerald/dp/8172344562,8172344562,₹47,Paperback
Midnight's Children,by Salman Rushdie - Unabridged,3.9,150.0,https://www.amazon.in/Midnights-Children/dp/B07FSTN1S6,B07FSTN1S6,₹0,Audible Audiobook
