Title,Author,Rating,Reviews Count,URL,ISBN-10,Price,Binding
In Search of Shiva: A Study of Folk Religious Practices in Pakistan,by Haroon Khalid,3.6,6.0,https://www.amazon.in/Search-Shiva-Religious-Practices-Pakistan-ebook/dp/B01855FR72,B01855FR72,₹226.12,Kindle Edition
Lynch Files,by Ziya Us Salam,5.0,1.0,https://www.amazon.in/Lynch-Files-Ziya-Us-Salam/dp/9353282195,9353282195,₹428,Paperback
The Upanishads (Penguin Classics),by Valerie J. Roebuck,4.3,6.0,https://www.amazon.in/Upanishads-Penguin-Classics-Valerie-Roebuck/dp/0140447490,0140447490,₹399,Paperback
The Divine Comedy (Wordsworth Classics of World Literature),by Dante Alighieri,5.0,2.0,https://www.amazon.in/Divine-Comedy-Wordsworth-Classics-Literature/dp/1840221666,1840221666,₹373.34,Paperback
The Messenger: The Meanings of the Life of Muhammad,by Tariq Ramadan,4.9,28.0,https://www.amazon.in/Messenger-Meanings-Life-Muhammad/dp/0141028556,0141028556,₹379,Paperback
Sacred Animals of India,by Nanditha Krishna,4.3,3.0,https://www.amazon.in/Sacred-Animals-India-Nanditha-Krishna/dp/0143423207,0143423207,₹246,Paperback
Religious Interactions in Mughal India,by Vasudha Dalmia,5.0,1.0,https://www.amazon.in/Religious-Interactions-Mughal-Vasudha-Dalmia/dp/0198081677,0198081677,₹894,Hardcover
The Marquess of Temptation (Reluctant Regency Brides Book 3),by Claudia Stone,4.4,3.0,https://www.amazon.in/Marquess-Temptation-Reluctant-Regency-Brides-ebook/dp/B079TQ7DQG,B079TQ7DQG,₹64,Kindle Edition
The Prophet,by Kahlil Gibran,4.4,15.0,https://www.amazon.in/Prophet-Kahlil-Gibran/dp/9382616586,9382616586,₹89,Paperback
MOJO PANDA Handmade Carved Rehal Wooden Holy Book-Stand for Quran Bible Gita...,by MOJO PANDA,2.5,2.0,https://www.amazon.in/MOJO-PANDA-Handmade-Book-Stand-Religious/dp/B07DFPVXX1,B07DFPVXX1,₹699.30,
