Title,Author,Rating,Reviews Count,URL,ISBN-10,Price,Binding
"Good Morning, Holy Spirit",by Benny Hinn,4.9,17.0,https://www.amazon.in/Good-Morning-Holy-Spirit-Benny/dp/0785261265,0785261265,₹170,Paperback
TINKLE DOUBLE DIGEST 5,by ANANT PAI,4.2,5.0,https://www.amazon.in/TINKLE-DOUBLE-DIGEST-ANANT-PAI-ebook/dp/B0758FRLRZ,B0758FRLRZ,₹36,Kindle Edition
The Dalai Lama's Cat: A Novel,by David Michie,4.7,54.0,https://www.amazon.in/Dalai-Lamas-Cat-Novel/dp/938143171X,938143171X,₹222,Paperback
Jewel Fuel 24k Gold Plated Aarti Sangrah Religious Book Gift Set,by JEWEL FUEL,,,https://www.amazon.in/Jewel-Plated-Aarti-Sangrah-Religious/dp/B075V9777K,B075V9777K,₹599,
"Wild Embers: Poems of Rebellion, Fire and Beauty",by Nikita Gill,4.7,29.0,https://www.amazon.in/Wild-Embers-Poems-Rebellion-Beauty/dp/1409173925,1409173925,₹280,Paperback
Cosmology in Vedanta: The Physics Correlation,by C Radhakrishnan,4.7,4.0,https://www.amazon.in/Cosmology-Vedanta-Physics-Correlation-Radhakrishnan-ebook/dp/B06VSM8C6G,B06VSM8C6G,₹0,Kindle Edition
Everything Happens for a Reason: And Other Lies I've Loved,by Kate Bowler - Import,3.2,8.0,https://www.amazon.in/Everything-Happens-Reason-Other-Loved/dp/0399592067,0399592067,₹319,Hardcover
Goodnight Stories from the Quran,by Saniyasnain Khan - Illustrated,4.3,29.0,https://www.amazon.in/Goodnight-Stories-Quran-Saniyasnain-Khan/dp/817898346X,817898346X,₹450,Hardcover
Conversations with God - Book 2: An uncommon dialogue,by Neale Donald Walsch,4.4,11.0,https://www.amazon.in/Conversations-God-Book-uncommon-dialogue/dp/0340765445,0340765445,₹306,Paperback
Jeevan Ke Prishth: Buddh Kee Deshanaa,by Osho,5.0,2.0,https://www.amazon.in/Jeevan-Ke-Prishth-Buddh-Deshanaa/dp/8121611369,8121611369,₹178,Paperback
The Remains of the Day: Booker Prize Winner 1989,by Kazuo Ishiguro,4.3,78.0,https://www.amazon.in/Remains-Day-Booker-Prize-Winner/dp/0571258247,0571258247,₹450,Paperback
A Soldier's Promise (Crystal Lake Series Book 2),by Laura Scott,4.5,215.0,https://www.amazon.in/Soldiers-Promise-Crystal-Lake-Book-ebook/dp/B00D0VMCXO,B00D0VMCXO,₹0,Kindle Edition
Partitions of the Heart: Unmaking the Idea of India,by Mander; Harsh,5.0,1.0,https://www.amazon.in/Partitions-Heart-Unmaking-Idea-India/dp/067008977X,067008977X,₹405,Hardcover
Fear Not: Be Strong,by Swami Tathagatananda,3.1,20.0,https://www.amazon.in/Fear-Not-Strong-Swami-Tathagatananda/dp/8175054034,8175054034,₹35,Paperback
A Search In Secret India,by Paul Brunton,4.6,78.0,https://www.amazon.in/Search-Secret-India-Paul-Brunton/dp/1844130436,1844130436,₹507.19,Paperback
The Bhagavad Gita (Lives of Great Religious Books): A Biography,by Richard H. Davis - Unabridged,5.0,1.0,https://www.amazon.in/Bhagavad-Lives-Great-Religious-Books/dp/B07CV3PPXS,B07CV3PPXS,₹0,Audible Audiobook
Aavarana The Veil,by S.L. Bhyrappa - Abridged,4.8,185.0,https://www.amazon.in/Aavarana-Veil-S-L-Bhyrappa/dp/8129124882,8129124882,₹296,Paperback
Wooden Hand Carved Holy Book Stand 15 INCH (Religious Item) Vrindavan Bazaar,by Vrindavan Bazaar,,,https://www.amazon.in/Wooden-Carved-Religious-Vrindavan-Bazaar/dp/B07HWSP55S,B07HWSP55S,,
Courage: The Joy of Living Dangerously (Osho Insights for a New Way of Living),by Osho,4.4,59.0,https://www.amazon.in/Courage-Living-Dangerously-Osho-Insights/dp/0312205171,0312205171,₹315,Paperback
Sanathana Dharmamu,by Chaganti Koteshwara Rao,4.3,27.0,https://www.amazon.in/Sanathana-Dharmamu-Chaganti-Koteshwara-Rao/dp/9385231502,9385231502,₹70,Perfect Paperback
Suppandi Volume 5: From Hired to Fired,by Rajani Thindiath,4.9,24.0,https://www.amazon.in/Suppandi-Hired-Fired-Rajani-Thindiath-ebook/dp/B07C2X9MMN,B07C2X9MMN,₹58.50,Kindle Edition
Bhagavad Gita for Children,by Sudha Gupta,4.8,9.0,https://www.amazon.in/Bhagavad-Gita-Children-Sudha-Gupta/dp/8131942473,8131942473,₹320,Hardcover
Subrahmanya Vybhavam: శ్రీ సుబ్రహ్మణ్యవైభవం,by Chaganti Koteshwara Rao,4.7,11.0,https://www.amazon.in/Subrahmanya-Vybhavam-%E0%B0%B8%E0%B1%81%E0%B0%AC%E0%B1%8D%E0%B0%B0%E0%B0%B9%E0%B1%8D%E0%B0%AE%E0%B0%A3%E0%B1%8D%E0%B0%AF%E0%B0%B5%E0%B1%88%E0%B0%AD%E0%B0%B5%E0%B0%82-Chaganti-Koteshwara/dp/9385231820,9385231820,₹40,Perfect Paperback
Awareness: The Key to Living in Balance (Osho Insights for a New Way of Living),by Osho,4.8,59.0,https://www.amazon.in/Awareness-Living-Balance-Osho-Insights/dp/0312275633,0312275633,₹322,Paperback
The Little Book of Hindu Deities: From the Goddess of Wealth to the Sacred Cow,by Sanjay Patel,4.6,21.0,https://www.amazon.in/Little-Book-Hindu-Deities-Goddess/dp/0452287758,0452287758,₹399,Paperback
" The Spoiled Princess"" .: Teach Your Kids Not To Take Everything For Granted...""",by Sigal Adler,5.0,3.0,https://www.amazon.in/Spoiled-Princess-Everything-Bedtimes-Childrens-ebook/dp/B0734YXCQX,B0734YXCQX,₹140,Kindle Edition
"Ayodhya: City of Faith, City of Discord",by Valay Singh,5.0,3.0,https://www.amazon.in/Ayodhya-City-Faith-Discord/dp/9388292243,9388292243,₹560,Hardcover
MOJO PANDA Handmade Carved Wooden Religious Holy Book Stand Holder for Quran...,by MOJO PANDA,5.0,1.0,https://www.amazon.in/MOJOPANDA-Handmade-Carved-Wooden-Religious/dp/B07DFS391C,B07DFS391C,₹699.30,
How to Talk So Kids Will Listen & Listen So Kids Will Talk,by Faber,4.7,86.0,https://www.amazon.in/How-Talk-Kids-Will-Listen/dp/1848120478,1848120478,,Paperback
TNPSC GROUP VII-B & VIII - HINDHU RELIGIOUS EXCECUTIVE EXAM QUESTION BANK TNPSC...,by RUTHIS BABU,3.0,1.0,https://www.amazon.in/TNPSC-GROUP-VII-B-VIII-EXCECUTIVE/dp/B07L8TY1L5,B07L8TY1L5,₹300,Paperback
From This Moment On (Windswept Bay Book 1),by Debra Clopton,4.7,4.0,https://www.amazon.in/This-Moment-Windswept-Bay-Book-ebook/dp/B01IE35Q4Y,B01IE35Q4Y,₹0,Kindle Edition
Oneness with All Life,by Eckhart Tolle,5.0,10.0,https://www.amazon.in/Oneness-All-Life-Eckhart-Tolle/dp/0241373824,0241373824,₹359,Hardcover
Islam (Pelican Books),by Tariq Ramadan,5.0,3.0,https://www.amazon.in/Islam-Pelican-Books-Tariq-Ramadan/dp/0141980508,0141980508,₹347,Mass Market Paperback
Enadhu Sinthanaikal - Tamil,by Swami Vivekananda,4.4,6.0,https://www.amazon.in/Enadhu-Sinthanaikal-Tamil-Swami-Vivekananda/dp/8171207480,8171207480,₹90,Paperback
25 Ways To Improve Your Life,by Sri Sri Ravi Shankar,4.3,16.0,https://www.amazon.in/25-Ways-Improve-Your-Life/dp/9380592329,9380592329,₹99,Paperback
"Before the Season Ends: A Romance Novel of Regency England, Book One (The Regency...",by Linore Rose Burkard,4.2,211.0,https://www.amazon.in/Before-Season-Ends-Regency-England-ebook/dp/B079HQNR31,B079HQNR31,₹449,Kindle Edition
Rumi: Bridge to the Soul,by Coleman Barks,4.7,10.0,https://www.amazon.in/Rumi-Bridge-Soul-Coleman-Barks/dp/0061338168,0061338168,₹450,Hardcover
Aafiya handicrafts Premiumu Quality Wooden Holy Book Stand For Reading,by Aafiya handicrafts,3.6,5.0,https://www.amazon.in/Aafiya-handicrafts-Premiumu-Quality-Reading/dp/B07CSZSXGP,B07CSZSXGP,₹198,
"The NKJV, Holy Bible, Larger Print, Paperback (Bible Nkjv)",by Thomas Nelson - Large Print,4.4,12.0,https://www.amazon.in/NKJV-Bible-Larger-Print-Paperback/dp/0718083296,0718083296,₹397,Paperback
Silence,by Thich Nhat Hanh,4.4,28.0,https://www.amazon.in/Silence-Thich-Nhat-Hanh/dp/1846044340,1846044340,₹410,Paperback
The Elementary Forms of the Religious Life,by Emile Durkheim,4.0,2.0,https://www.amazon.in/Elementary-Forms-Religious-Life/dp/9352290585,9352290585,₹525,Paperback
Thathathireyar Thathuvam / தத்தாத்திரேயர் தத்துவம் (மூலமும் உரையும்) / ஆன்மிகம்...,by Swamy (N. R. Sampath),,,https://www.amazon.in/Thathathireyar-Thathuvam-%E0%AE%A4%E0%AE%A4%E0%AF%8D%E0%AE%A4%E0%AE%BE%E0%AE%A4%E0%AF%8D%E0%AE%A4%E0%AE%BF%E0%AE%B0%E0%AF%87%E0%AE%AF%E0%AE%B0%E0%AF%8D-%E0%AE%A4%E0%AE%A4%E0%AF%8D%E0%AE%A4%E0%AF%81%E0%AE%B5%E0%AE%AE%E0%AF%8D-%E0%AE%86%E0%AE%A9%E0%AF%8D%E0%AE%AE%E0%AE%BF%E0%AE%95%E0%AE%AE%E0%AF%8D/dp/B07DRRTJF6,B07DRRTJF6,₹200,Paperback
The Purpose Driven Life: What on Earth Am I Here For?,by Rick Warren - Special Edition,4.6,57.0,https://www.amazon.in/Purpose-Driven-Life-What-Earth/dp/031033750X,031033750X,₹426,Paperback
Sathuragiri Malai / சித்தர்கள் காட்சி தரும் சதுரகிரி மலை / Sadhuragiri / Siddhar,by Gnanamanjari Sampath Kumar,,,https://www.amazon.in/Sathuragiri-%E0%AE%9A%E0%AE%BF%E0%AE%A4%E0%AF%8D%E0%AE%A4%E0%AE%B0%E0%AF%8D%E0%AE%95%E0%AE%B3%E0%AF%8D-%E0%AE%9A%E0%AE%A4%E0%AF%81%E0%AE%B0%E0%AE%95%E0%AE%BF%E0%AE%B0%E0%AE%BF-Sadhuragiri-Siddhar/dp/B07HJDP2DH,B07HJDP2DH,₹60,Paperback
Sri Gurugeetha,by ShivaramakrishnaRao Kotamraju,,,https://www.amazon.in/Sri-Gurugeetha-ShivaramakrishnaRao-Kotamraju/dp/B01EVBK86O,B01EVBK86O,₹60,Perfect Paperback
Suppandi Volume 8—Employee of the Year,by Rajani Thindiath,4.5,19.0,https://www.amazon.in/Suppandi-8-Employee-Year-Rajani-Thindiath-ebook/dp/B07BZKYKXR,B07BZKYKXR,₹98.70,Kindle Edition
Sitayana,by Amit Majmudar,,,https://www.amazon.in/Sitayana-Amit-Majmudar/dp/0143447297,0143447297,₹299,Paperback
Di Grazia Blue Foldable Adjustable Portable Reading Stand/Book Stand Document...,by DI GRAZIA,5.0,1.0,https://www.amazon.in/Foldable-Adjustable-Portable-Document-Blue-Book-Stand/dp/B07L4KKD7Z,B07L4KKD7Z,₹999,
The Journey Within: Exploring the Path of Bhakti,by Radhanath Swami,4.8,99.0,https://www.amazon.in/Journey-Within-Exploring-Path-Bhakti/dp/9352644085,9352644085,₹359,Paperback
Conversations with God - Book 3: An uncommon dialogue,by Neale Donald Walsch,5.0,9.0,https://www.amazon.in/Conversations-God-Book-uncommon-dialogue/dp/0340765453,0340765453,₹421.74,Paperback
The Seat Beside Me (The Steadfast Series Book 1),by Nancy Moser,4.8,103.0,https://www.amazon.in/Seat-Beside-Me-Steadfast-Book-ebook/dp/B01CLWURP2,B01CLWURP2,₹322,Kindle Edition
Sringeri Jagadguru Vybhavam: శృంగేరి జగద్గురు వైభవం,by Chaganti Koteshwara Rao,4.7,4.0,https://www.amazon.in/Sringeri-Jagadguru-Vybhavam-%E0%B0%B6%E0%B1%83%E0%B0%82%E0%B0%97%E0%B1%87%E0%B0%B0%E0%B0%BF-%E0%B0%9C%E0%B0%97%E0%B0%A6%E0%B1%8D%E0%B0%97%E0%B1%81%E0%B0%B0%E0%B1%81/dp/9385231197,9385231197,₹50,Perfect Paperback
Aghori Baba Ki Gita,by Abhinandan Sharma,4.9,24.0,https://www.amazon.in/Aghori-Baba-Gita-Abhinandan-Sharma/dp/9386619296,9386619296,₹166,Paperback
Always and Forever: A Sweet & Clean Historical Romance (Second Chance Brides...,by Wendy Lindstrom,4.4,55.0,https://www.amazon.in/Always-Forever-Historical-Romance-Second-ebook/dp/B016LGU682,B016LGU682,₹0,Kindle Edition
The Bhagavadgita,by S. Radhakrishnan,4.2,40.0,https://www.amazon.in/Bhagavadgita-S-Radhakrishnan/dp/8172238983,8172238983,₹295,Paperback
Al marjaan handicrafts Fashion Folding Brown Religious Prayer Book Holder Display...,by Al marjaan handicrafts,,,https://www.amazon.in/Al-marjaan-handicrafts-Religious-Intricate/dp/B07GYRRKQ6,B07GYRRKQ6,₹499,
Law of Attraction,by Mitesh Khatri,4.6,73.0,https://www.amazon.in/Law-Attraction-Mitesh-Khatri/dp/8184958366,8184958366,₹214,Paperback
Soundaryalahari,by Chaganti Koteshwara Rao,4.2,17.0,https://www.amazon.in/Soundaryalahari-Chaganti-Koteshwara-Rao/dp/9385231839,9385231839,₹75,Perfect Paperback
The Neighbor's Secret (A Secret Billionaire Romance Book 1),by Kimberley Montpetit,4.3,105.0,https://www.amazon.in/Neighbors-Secret-Billionaire-Romance-Book-ebook/dp/B01MRK02VP,B01MRK02VP,₹278,Kindle Edition
"Adi Shankaracharya (Tamil): Adi Sankaracharyar, Hindu Samayathin Sigaramaana...",by Pavan K Varma,,,https://www.amazon.in/Adi-Shankaracharya-Tamil-Sankaracharyar-Sindhanaiyaalar/dp/9387894509,9387894509,₹263,Paperback
Hindu Prilgrimage: A Journey Through the Holy Places of Hindus All Over India,by Sunita Pant Bansal,2.7,3.0,https://www.amazon.in/Hindu-Prilgrimage-Journey-Through-Places/dp/8122309976,8122309976,,Hardcover
India: A Sacred Geography,by Diana L Eck,4.0,12.0,https://www.amazon.in/India-Sacred-Geography-Diana-Eck/dp/0385531923,0385531923,₹525,Paperback
The Book of Mirdad: The strange story of a monastery which was once called The...,by Mikhail Naimy,4.7,51.0,https://www.amazon.in/Book-Mirdad-strange-monastery-called-ebook/dp/B00H144M4I,B00H144M4I,₹258.32,Kindle Edition
Proof of Heaven: A Neurosurgeon's Journey into the Afterlife,by Eben Alexander,4.0,81.0,https://www.amazon.in/Proof-Heaven-Neurosurgeons-Journey-Afterlife/dp/0749958790,0749958790,₹332,Paperback
Lanka’s Princess,by Kavita Kanè - Import,4.1,101.0,https://www.amazon.in/Lankas-Princess-Kavita-Kan%C3%A8/dp/8129144514,8129144514,₹272.26,Paperback
Aanandaanam Jaganyachi Kala,by Swami Rama,5.0,7.0,https://www.amazon.in/Aanandaanam-Jaganyachi-Kala-Swami-Rama/dp/8183225438,8183225438,₹158,Paperback
Shree Sai Vrat Katha - (Set of 12 Books) Religious Book,by Ramneek jewels,,,https://www.amazon.in/Shree-Sai-Vrat-Katha-Religious/dp/B06W2L9MLN,B06W2L9MLN,₹180,
The Power of Myth,by Joseph Campbell,4.4,16.0,https://www.amazon.in/Power-Myth-Joseph-Campbell/dp/0385418868,0385418868,₹434,Paperback
The Powers of The Mind,by Swami Vivekanand,4.3,17.0,https://www.amazon.in/Powers-Mind-Swami-Vivekanand-ebook/dp/B018UFT3C2,B018UFT3C2,₹19.60,Kindle Edition
The Amma Tell Me Hanuman Trilogy,by Bhakti Mathur,5.0,1.0,https://www.amazon.in/Amma-Tell-Me-Hanuman-Trilogy/dp/9881239559,9881239559,₹618,Paperback
Brahma Sutra Bhasya,by Sankaracarya,4.7,13.0,https://www.amazon.in/Brahma-Sutra-Bhasya-Sankaracarya/dp/8175051051,8175051051,₹400,Hardcover
"When You See the Invisible, You Can Do the Impossible",by Oral Roberts,4.6,6.0,https://www.amazon.in/When-You-See-Invisible-Impossible/dp/076842285X,076842285X,₹175,Paperback
The Calling - Unleash Your True Self,by Priya Kumar,4.8,113.0,https://www.amazon.in/Calling-Unleash-Your-True-Self/dp/935258970X,935258970X,₹250,Paperback
Mounamtho Rahasyam,by Sadguru Jaggi Vasudev,4.6,17.0,https://www.amazon.in/Mounamtho-Rahasyam-Sadguru-Jaggi-Vasudev/dp/9380409486,9380409486,₹100,Perfect Paperback
Spiritual Power: Being and Becoming - Vol. 1,by Gian Kumar,4.7,19.0,https://www.amazon.in/Spiritual-Power-Being-Becoming-Vol/dp/9386832178,9386832178,₹247,Paperback
An Envisioned Theory of Everything: A Single Story to Bridge the Gap Between...,by Dr Udayashankar Bhat - Import,5.0,6.0,https://www.amazon.in/Envisioned-Theory-Everything-Between-Theories/dp/1644293412,1644293412,₹175,Paperback
Taking the Leap: Freeing Ourselves from Old Habits and Fears,by Pema Chodron,4.7,3.0,https://www.amazon.in/Taking-Leap-Freeing-Ourselves-Habits/dp/1590308433,1590308433,₹198,Paperback
TINKLE DIGEST VOL 258,by Rajani Thindiath,3.7,4.0,https://www.amazon.in/TINKLE-DIGEST-VOL-Rajani-Thindiath-ebook/dp/B076WX4TCR,B076WX4TCR,₹55.65,Kindle Edition
Black Flags: The Rise of ISIS,by Joby Warrick,4.9,33.0,https://www.amazon.in/Black-Flags-Rise-Joby-Warrick/dp/055217288X,055217288X,₹444.14,Paperback
Creativity: Unleashing the Forces Within (Osho Insights for a New Way of Living),by Osho,4.3,43.0,https://www.amazon.in/Creativity-Unleashing-Forces-Within-Insights/dp/0312205198,0312205198,₹247,Paperback
The Wisdom of Sundays: Life-Changing Insights and Inspirational Conversations,by Oprah Winfrey,4.9,16.0,https://www.amazon.in/Wisdom-Sundays-Life-Changing-Inspirational-Conversations/dp/1509874119,1509874119,₹674,Hardcover
Man's Eternal Quest: Collected Talks and Essays on Realizing God in Daily Life: 1,by Paramahansa Yogananda - Illustrated,4.6,47.0,https://www.amazon.in/Mans-Eternal-Quest-Collected-Realizing/dp/818953503X,818953503X,₹166,Paperback
The Earl and His Lady: A Regency Romance (Branches of Love Book 4),by Sally Britton,5.0,1.0,https://www.amazon.in/Earl-His-Lady-Regency-Branches-ebook/dp/B07DGNVPTT,B07DGNVPTT,₹280,Kindle Edition
"Amma, Take Me to the Dargah of Salim Chishti",by Bhakti Mathur,4.7,5.0,https://www.amazon.in/Amma-Take-Dargah-Salim-Chishti/dp/0143428322,0143428322,₹210,Paperback
Wooden Geeta Ramayan Holy Book Stand,by sdshopping,5.0,1.0,https://www.amazon.in/Wooden-Geeta-Ramayan-Holy-Stand/dp/B07FZJTCBG,B07FZJTCBG,₹320,
My Grandmother's Tweets: Inspired by Avvaiyar's Ancient Wisdom,by Geeta Gopalakrishnan,4.0,2.0,https://www.amazon.in/My-Grandmothers-Tweets-Inspired-Avvaiyars/dp/9353023904,9353023904,₹311,Hardcover
Kundalini: An untold story,by Om Swami,4.5,346.0,https://www.amazon.in/Kundalini-untold-story-Om-Swami-ebook/dp/B01EC9H0LG,B01EC9H0LG,₹136.88,Kindle Edition
"Amma, Take Me to the Dargah of Salim Chishti",by Bhakti Mathur,4.7,5.0,https://www.amazon.in/Amma-Take-Dargah-Salim-Chishti/dp/0143428322,0143428322,₹210,Paperback
" Little Monster Chef "": Every Child is Talented (Bedtime stories children's...""",by Sigal Adler,5.0,1.0,https://www.amazon.in/Little-Monster-Chef-Talented-childrens-ebook/dp/B07DGYG2GC,B07DGYG2GC,₹67,Kindle Edition
My Grandmother's Tweets: Inspired by Avvaiyar's Ancient Wisdom,by Geeta Gopalakrishnan,4.0,2.0,https://www.amazon.in/My-Grandmothers-Tweets-Inspired-Avvaiyars/dp/9353023904,9353023904,₹311,Hardcover
Kundalini: An untold story,by Om Swami,4.5,346.0,https://www.amazon.in/Kundalini-untold-story-Om-Swami-ebook/dp/B01EC9H0LG,B01EC9H0LG,₹136.88,Kindle Edition
The Art of Happiness (Marathi),by His Holiness the Dalai Lama,4.5,11.0,https://www.amazon.in/Happiness-Marathi-Holiness-Dalai-Lama/dp/8183227317,8183227317,₹239,Paperback
The Da Vinci Code: (Robert Langdon Book 2),by Dan Brown,4.6,495.0,https://www.amazon.in/Vinci-Code-Robert-Langdon-Book/dp/0552149519,0552149519,₹210,Paperback
Mother Teresa: Come Be My Light: The revealing private writings of the Nobel...,by Brian Kolodiejchuk,4.7,9.0,https://www.amazon.in/Mother-Teresa-revealing-private-writings/dp/1846041309,1846041309,₹389,Paperback
Ashru Pusnare Wachan,by Ps.Jeevan Wadagle,,,https://www.amazon.in/Ashru-Pusnare-Wachan-Ps-Jeevan-Wadagle/dp/B07J1GL4KS,B07J1GL4KS,₹100,Paperback
Introducing Philosophy: A Graphic Guide (Introducing...),by Dave Robinson,4.0,2.0,https://www.amazon.in/Introducing-Philosophy-Graphic-Guide-ebook/dp/B00KFEK0K6,B00KFEK0K6,₹177.65,Kindle Edition
Indian Philosophy Volume 1 Second Edition: With an Introduction By J.N.Mohanty,by S. Radhakrishnan,4.5,14.0,https://www.amazon.in/Indian-Philosophy-Second-Introduction-J-N-Mohanty/dp/019569841X,019569841X,₹390,Paperback
MOJOPANDA Handcrafted Wooden Carved Religious Rehal Holy Book Stand for Quran...,by MOJO PANDA,,,https://www.amazon.in/MOJOPANDA-Handcrafted-Wooden-Carved-Religious/dp/B07DFR2Z4Q,B07DFR2Z4Q,₹699.30,
Two Saints: Speculations Around and About Ramakrishna Paramahamsa and Ramana...,by Arun Shourie,3.6,36.0,https://www.amazon.in/Two-Saints-Speculations-Ramakrishna-Paramahamsa/dp/9352645049,9352645049,₹378,Hardcover
Manuscript Found in Accra,by Paulo Coelho,4.2,80.0,https://www.amazon.in/Manuscript-Found-Accra-Paulo-Coelho/dp/0007520506,0007520506,₹176,Paperback
Journey to Self-Realization: Collected Talks and Essays on Realizing God in Daily...,by Paramahansa Yogananda,4.8,53.0,https://www.amazon.in/Journey-Self-Realization-Collected-Essays-Realizing/dp/8189535072,8189535072,₹166,Paperback
Worlds Unseen (The Seventh World Trilogy Book 1),by Rachel Starr Thomson,5.0,1.0,https://www.amazon.in/Worlds-Unseen-Seventh-World-Trilogy-ebook/dp/B0067MYOPW,B0067MYOPW,₹0,Kindle Edition
And Now And Here: Beyond the Duality of Life and Death,by Osho,,,https://www.amazon.in/Now-Here-Beyond-Duality-Death/dp/0143446576,0143446576,₹388,Paperback
Spiritual Book for our Enlightenment: SPIRIT OF HIMALAYA - The Story of a Truth...,by Swami Amar Jyoti,4.3,12.0,https://www.amazon.in/Spiritual-Book-our-Enlightenment-HIMALAYA/dp/8190000888,8190000888,₹175,Paperback
The Book of Mirdad: The strange story of a monastery which was once called The...,by Mikhail Naimy,4.7,51.0,https://www.amazon.in/Book-Mirdad-strange-monastery-called-ebook/dp/B00H144M4I,B00H144M4I,₹258.32,Kindle Edition
The Imitation of Christ (Penguin Classics),by Thomas à Kempis,4.7,28.0,https://www.amazon.in/Imitation-Christ-Penguin-Classics/dp/0141191767,0141191767,₹379,Paperback
Night (Penguin Modern Classics),by Elie Wiesel,4.5,35.0,https://www.amazon.in/Night-Penguin-Modern-Classics-Wiesel/dp/0141038993,0141038993,₹319,Paperback
Kamakoti Periyava,by Charukesi,5.0,1.0,https://www.amazon.in/Kamakoti-Periyava-Charukesi/dp/8184763565,8184763565,,Paperback
Swami Vivekananda on Himself,by Swami Vivekananda,4.7,31.0,https://www.amazon.in/Swami-Vivekananda-Himself-ebook/dp/B018J051EC,B018J051EC,₹25,Kindle Edition
Muhammad: His Life Based on the Earliest Sources,by Martin Lings,4.4,67.0,https://www.amazon.in/Muhammad-Life-Based-Earliest-Sources/dp/1594771537,1594771537,₹395,Paperback
जिनवाणी सार : Jinvani Sar Jain Shastra jain books religious in hindi,by Indra Sugandh,,,https://www.amazon.in/%E0%A4%9C%E0%A4%BF%E0%A4%A8%E0%A4%B5%E0%A4%BE%E0%A4%A3%E0%A5%80-%E0%A4%B8%E0%A4%BE%E0%A4%B0-Jinvani-Shastra-religious/dp/B07FTN2QCQ,B07FTN2QCQ,₹435,
Sai Satcharitra Book - Hindi Version,by SHRI SAIBABA SANSTHAN TRUST,4.5,19.0,https://www.amazon.in/Sai-Satcharitra-Book-Hindi-Version/dp/B01D132KEG,B01D132KEG,₹160,Hardcover
Kan Kan Mein Bhagwan,by Aparna Nevatia,5.0,6.0,https://www.amazon.in/Kan-Mein-Bhagwan-Aparna-Nevatia/dp/8185992428,8185992428,₹280,Hardcover
Meditation and Its Practice,by Swami Rama,4.5,26.0,https://www.amazon.in/Meditation-Its-Practice-Swami-Rama/dp/8183225454,8183225454,₹81,Paperback
Way of the Peaceful Warrior: A Book That Changes Lives,by Dan Millman,4.6,41.0,https://www.amazon.in/Way-Peaceful-Warrior-Changes-Lives/dp/1932073205,1932073205,₹659,Paperback
Effective Life Management,by Swami Amartyananda,4.5,41.0,https://www.amazon.in/Effective-Life-Management-Swami-Amartyananda-ebook/dp/B01A4X6GJ6,B01A4X6GJ6,₹10,Kindle Edition
Autobiography of Malcolm X,by MALCOLM X,4.1,31.0,https://www.amazon.in/Autobiography-Malcolm-X-MALCOLM/dp/0345350685,0345350685,₹299,Paperback
Garuda Puranam - Tamil,by R Ponnammal,4.5,2.0,https://www.amazon.in/Garuda-Puranam-Tamil-R-Ponnammal/dp/8179504433,8179504433,,Paperback
Caroline's Love (Mail Order Brides of Hickory Stick Book 1),by Patricia PacJac Carroll,4.5,94.0,https://www.amazon.in/Carolines-Love-Historical-Western-Romance-ebook/dp/B00L6IUCK8,B00L6IUCK8,₹0,Kindle Edition
God Is Not Great: How Religion Poisons Everything,by Christopher Hitchens,4.4,50.0,https://www.amazon.in/God-Not-Great-Religion-Everything/dp/0446697966,0446697966,₹910,Paperback
Illusions : The Adventures of a Reluctant Messiah,by Richard Bach,4.6,35.0,https://www.amazon.in/Illusions-Adventures-Reluctant-Richard-Bach/dp/0099427869,0099427869,₹347,Paperback
Tao Te Ching,by Stephen Mitchell,4.4,51.0,https://www.amazon.in/Tao-Te-Ching-Stephen-Mitchell/dp/8183282504,8183282504,₹159,Paperback
TINKLE DIGEST VOL- 255,by Rajani Thindiath,3.6,10.0,https://www.amazon.in/TINKLE-DIGEST-VOL-Rajani-Thindiath-ebook/dp/B076WXFJB3,B076WXFJB3,₹55.65,Kindle Edition
Dera Sacha Sauda and Gurmeet Ram Rahim: A Decade-long Investigation,by Anurag Tripathi,4.1,49.0,https://www.amazon.in/Dera-Sacha-Sauda-Gurmeet-Rahim/dp/0143442406,0143442406,₹150,Paperback
Tatvarth Ramayan (Religious Books) by Ramchandra Keshav Dongre ji,by Ramneek jewels,,,https://www.amazon.in/Tatvarth-Ramayan-Religious-Ramchandra-Keshav/dp/B01N27QJQR,B01N27QJQR,₹500,
The 108 Upanishads: An Introduction,by Roshen Dalal,,,https://www.amazon.in/108-Upanishads-Introduction-Roshen-Dalal/dp/0143428594,0143428594,₹247,Paperback
Tero Nadir Pare (Bengali),by Sirsho Bandopadhayay,4.0,1.0,https://www.amazon.in/Tero-Nadir-Bengali-Sirsho-Bandopadhayay/dp/9387894312,9387894312,₹248,Hardcover
"Geeta Gyan: Principles and Practices, As Told In Geets, for Conductance of Worldly...",by Brahamm Dutt,,,https://www.amazon.in/Geeta-Gyan-Principles-Practices-Conductance/dp/9381384495,9381384495,₹214,Paperback
TINKLE DIGEST VOL- 255,by Rajani Thindiath,3.6,10.0,https://www.amazon.in/TINKLE-DIGEST-VOL-Rajani-Thindiath-ebook/dp/B076WXFJB3,B076WXFJB3,₹55.65,Kindle Edition
Ice With Very Unusual Spirits,by Ruzbeh N Bharucha - Import,4.8,11.0,https://www.amazon.in/Very-Unusual-Spirits-Ruzbeh-Bharucha/dp/0143426672,0143426672,₹124,Paperback
Adi Shankaracharya: Hindu Dharm Ke Mahaan Vicharak,by Pavan K Varma,3.8,6.0,https://www.amazon.in/Adi-Shankaracharya-Hindu-Mahaan-Vicharak/dp/9387578275,9387578275,₹257,Paperback
Shankara Vijayam: శంకర విజయం,by Chaganti Koteshwara Rao,5.0,5.0,https://www.amazon.in/Shankara-Vijayam-Chaganti-Koteshwara-Rao/dp/9385231200,9385231200,,Perfect Paperback
Life Without Limits: Inspiration for a Ridiculously Good Life,by Nick Vujicic,4.5,96.0,https://www.amazon.in/Life-Without-Limits-Inspiration-Ridiculously/dp/0307589749,0307589749,₹372,Paperback
A First Bible Story Book and A First Book of Prayers,by DK,5.0,1.0,https://www.amazon.in/First-Bible-Story-Book-Prayers/dp/0241283051,0241283051,₹569,Hardcover
Encounter the Enlightened,by Sadguru Jaggi Vasudev,4.9,17.0,https://www.amazon.in/Encounter-Enlightened-Sadguru-Jaggi-Vasudev/dp/818668560X,818668560X,₹280,Paperback
"If You Must Succeed!: Untold Secrets Of; Leadership, Winning And Growth: Winning...",by MICHAEL ENDWELL,4.1,7.0,https://www.amazon.in/If-You-Must-Succeed-Leadership-ebook/dp/B01IELJNKY,B01IELJNKY,₹0,Kindle Edition
Your Soul's Plan: Discovering the Real Meaning of the Life You Planned Before...,by Robert Schwartz,4.8,9.0,https://www.amazon.in/Your-Souls-Plan-Discovering-Meaning/dp/1583942726,1583942726,₹569,Paperback
Sri Madhaandhra Bhagavatham,by Chaganti Koteshwara Rao,4.7,41.0,https://www.amazon.in/Sri-Madhaandhra-Bhagavatham-Chaganti-Koteshwara/dp/9382203966,9382203966,₹500,Perfect Paperback
"The Buddha in Me, the Buddha in You: A Handbook for Happiness",by David Hare,4.5,19.0,https://www.amazon.in/Buddha-Me-You-Handbook-Happiness/dp/1846044952,1846044952,₹450,Paperback
