Title,Author,Rating,Reviews Count,URL,ISBN-10,Price,Binding
The Ancient Science of Mantras,by Om Swami,4.6,194.0,https://www.amazon.in/Ancient-Science-Mantras-Om-Swami/dp/9386348713,9386348713,₹394,Paperback
Life's Amazing Secrets: How to Find Balance and Purpose in Your Life,by Gaur Gopal Das,4.7,895.0,https://www.amazon.in/Lifes-Amazing-Secrets-Balance-Purpose/dp/0143442295,0143442295,₹150,Paperback
The Prophet,by Kahlil Gibran,4.5,247.0,https://www.amazon.in/Prophet-Kahlil-Gibran/dp/817234354X,817234354X,₹69,Paperback
The Power of Your Subconscious Mind: Unlock Your Master Key to Success,by Joseph Murphy,4.5,5009.0,https://www.amazon.in/Power-Your-Subconscious-Mind-Success/dp/8172345666,8172345666,₹75,Paperback
Walking with Nanak,by Haroon Khalid,4.4,47.0,https://www.amazon.in/Walking-Nanak-Haroon-Khalid/dp/9386850826,9386850826,₹461,Paperback
Adi Shankaracharya: Hinduism's Greatest Thinker,by Pavan K Varma,4.3,72.0,https://www.amazon.in/Adi-Shankaracharya-Hinduisms-Greatest-Thinker/dp/8193655613,8193655613,₹368,Hardcover
My Gita,by Devdutt Pattanaik - Special Edition,4.2,685.0,https://www.amazon.in/My-Gita-Devdutt-Pattanaik/dp/8129137704,8129137704,₹153,Paperback
The Prophet (Wisehouse Classics Edition),by Khalil Gibran,4.7,66.0,https://www.amazon.in/Prophet-Wisehouse-Classics-Khalil-Gibran-ebook/dp/B01A7KOY9K,B01A7KOY9K,₹0,Kindle Edition
Immortal Talks,by Shunya,4.5,873.0,https://www.amazon.in/Immortal-Talks-Shunya/dp/8193305205,8193305205,₹245,Paperback
A Million Thoughts: Learn All About Meditation from The Himalayan Mystic,by Om Swami - Import,4.9,338.0,https://www.amazon.in/Million-Thoughts-Meditation-Himalayan-Mystic/dp/8184959451,8184959451,₹321,Paperback
Adiyogi: The Source of Yoga,by Sadhguru,4.6,376.0,https://www.amazon.in/Adiyogi-Source-Yoga-Sadhguru/dp/9352643925,9352643925,₹178,Paperback
Life After Death: The Book of Answers,by Dr Deepak Chopra,3.5,21.0,https://www.amazon.in/Life-After-Death-Book-Answers/dp/1846041007,1846041007,₹394.20,Paperback
Inner Engineering: A Yogi’s Guide to Joy,by Sadhguru,4.7,1253.0,https://www.amazon.in/Inner-Engineering-Yogis-Guide-Joy/dp/0143428845,0143428845,₹176,Paperback
The Art of Happiness: A Handbook for Living,by The Dalai Lama,4.4,37.0,https://www.amazon.in/Art-Happiness-Handbook-Living/dp/0340750154,0340750154,₹419,Paperback
108 PEARLS OF BABA SAI,by Wahi Jaya,4.8,25.0,https://www.amazon.in/108-PEARLS-BABA-Wahi-Jaya/dp/9386206412,9386206412,₹255,Hardcover
Principal Upanisads,by Prof. S. Radhakrishnan,4.7,58.0,https://www.amazon.in/Principal-Upanisads-Prof-S-Radhakrishnan/dp/8172231245,8172231245,₹548,Paperback
"Reiki: A Complete Guide to Real Reiki:How to Increase Vitality, Improve your...",by Kristine Marie Corr,3.9,39.0,https://www.amazon.in/Reiki-Complete-Increase-Vitality-Improve-ebook/dp/B018MMNW6G,B018MMNW6G,₹0,Kindle Edition
The Greatest Salesman in the World,by Og Mandino,4.3,156.0,https://www.amazon.in/Greatest-Salesman-World-Og-Mandino/dp/8179926877,8179926877,₹109,Paperback
The Evolution Of Gods : The Scientific Origin Of Divinity And Religion,by Ajay Kansal - Illustrated,4.3,68.0,https://www.amazon.in/Evolution-Gods-Scientific-Divinity-Religion/dp/9350294389,9350294389,₹225,Paperback
The Wellness Sense: A Practical Guide to your Physical and Emotional Health Based...,by Om Swami,4.8,334.0,https://www.amazon.in/Wellness-Sense-Practical-Emotional-Ayurvedic/dp/9351772624,9351772624,₹178,Paperback
The God Delusion,by Richard Dawkins - Special Edition,4.4,163.0,https://www.amazon.in/God-Delusion-Richard-Dawkins/dp/1784161926,1784161926,₹414,Paperback
The Hidden Power of Gayatri Mantra,by Om Swami,,,https://www.amazon.in/Hidden-Power-Gayatri-Mantra/dp/9388423240,9388423240,₹224,Paperback
Meditations (Penguin Classics),by Marcus Aurelius,4.1,171.0,https://www.amazon.in/Meditations-Penguin-Classics-Marcus-Aurelius/dp/0140449337,0140449337,₹300,Paperback
Mahatma Gandhi Autobiography: The Story Of My Experiments With Truth,by Mahatma Gandhi,4.4,247.0,https://www.amazon.in/Mahatma-Gandhi-Autobiography-Story-Experiments/dp/8172343116,8172343116,₹99,Paperback
Sita: An Illustrated Retelling of Ramayana,by Devdutt Pattanaik - Illustrated,4.4,339.0,https://www.amazon.in/Sita-Illustrated-Retelling-DEVDUTT-PATTANAIK/dp/0143064320,0143064320,₹290,Paperback
The Laws of the Spirit World,by Khorshed Bhavnagri,4.5,434.0,https://www.amazon.in/Laws-Spirit-World-Khorshed-Bhavnagri/dp/817992985X,817992985X,₹197,Paperback
Devlok with Devdutt Pattanaik,by Devdutt Pattanaik,4.3,601.0,https://www.amazon.in/Devlok-Devdutt-Pattanaik/dp/0143427423,0143427423,₹149,Paperback
Train to Pakistan,by Khushwant Singh,4.2,550.0,https://www.amazon.in/Train-Pakistan-Khushwant-Singh/dp/0143065882,0143065882,₹144,Paperback
The Teachings of Ramana Maharshi (The Classic Collection),by Arthur Osborne,4.4,83.0,https://www.amazon.in/Teachings-Ramana-Maharshi-Classic-Collection/dp/1846044332,1846044332,₹179,Paperback
An Introduction to Indian Philosophy,by Satishchandra Chatterjee,4.4,91.0,https://www.amazon.in/Introduction-Indian-Philosophy-Satishchandra-Chatterjee/dp/8129111950,8129111950,₹106,Paperback
How You Can Talk with God,by Paramahansa Yogananda,4.4,76.0,https://www.amazon.in/How-You-Can-Talk-God/dp/8189955330,8189955330,₹83,Hardcover
Devil and Miss Prym,by Paulo Coelho,4.1,23.0,https://www.amazon.in/Devil-Miss-Prym-Paulo-Coelho/dp/8172235151,8172235151,₹218,Paperback
The Secret Letters of the Monk Who Sold His Ferrari,by Robin Sharma,4.6,148.0,https://www.amazon.in/Secret-Letters-Monk-Sold-Ferrari-ebook/dp/B008SNUUPQ,B008SNUUPQ,₹153.99,Kindle Edition
Inner Engineering (Hindi): A Yogi's Guide to Joy,by Sadhguru,,,https://www.amazon.in/Inner-Engineering-Hindi-Yogis-Guide/dp/014344624X,014344624X,₹149,Paperback
The Reconstruction of Religious Thought in Islam,by Sir M. Iqbal,3.8,12.0,https://www.amazon.in/Reconstruction-Religious-Thought-Islam/dp/8171510817,8171510817,₹275,Hardcover
The Quest of the Sparrows,by Kartik Sharma,4.3,222.0,https://www.amazon.in/Quest-Sparrows-Kartik-Sharma/dp/8129118653,8129118653,₹95,Paperback
The Hindu View Of Life,by S. Radhakrishnan,4.3,41.0,https://www.amazon.in/Hindu-View-Life-S-Radhakrishnan/dp/8172238452,8172238452,₹149,Paperback
Tao Te Ching,by Lao Tzu,4.4,59.0,https://www.amazon.in/Tao-Te-Ching-Lao-Tzu/dp/9386538180,9386538180,₹99,Paperback
Sambhaji,by SANJIVANI KHER,3.0,8.0,https://www.amazon.in/Sambhaji-SANJIVANI-KHER-ebook/dp/B071S3KN4X,B071S3KN4X,₹55.65,Kindle Edition
Kumbha: The Traditionally Modern Mela,by Nityananda Misra,,,https://www.amazon.in/Kumbha-Traditionally-Modern-Nityananda-Misra/dp/9388414101,9388414101,₹299,Paperback
Autobiography of a Yogi (Complete Hindi Edition),by Paramahansa Yogananda,4.8,395.0,https://www.amazon.in/Autobiography-Complete-Hindi-Paramahansa-Yogananda/dp/8190256211,8190256211,₹161,Paperback
The Holy Science,by Swami Sri Yukteswar Giri,4.6,156.0,https://www.amazon.in/Holy-Science-Swami-Yukteswar-Giri/dp/8189535196,8189535196,₹75,Paperback
If Truth Be Told: A Monk's Memoir,by Om Swami,4.7,527.0,https://www.amazon.in/If-Truth-Be-Told-Memoir/dp/9351368068,9351368068,₹311,Hardcover
"When All Is Not Well: Depression, Sadness and Healing - A Yogic Perspective",by Om Swami,4.7,157.0,https://www.amazon.in/When-All-Not-Well-Perspective/dp/935177726X,935177726X,₹260,Paperback
Introduction to Religious Philosophy,by Y. Masih,3.7,8.0,https://www.amazon.in/Introduction-Religious-Philosophy-Y-Masih/dp/8120808541,8120808541,₹325,Paperback
Chariots of the Gods,by Erich Von Daniken,4.1,175.0,https://www.amazon.in/Chariots-Gods-Erich-Von-Daniken/dp/0425074811,0425074811,₹260,Mass Market Paperback
Chanakya Neeti,by R.P. Jain,3.9,52.0,https://www.amazon.in/Chanakya-Neeti-R-P-Jain/dp/8184302118,8184302118,₹200,Hardcover
"Seeking Allah, Finding Jesus: A Devout Muslim Encounters Christianity",by Nabeel Qureshi,4.7,98.0,https://www.amazon.in/Seeking-Allah-Finding-Jesus-Christianity/dp/0310527236,0310527236,₹686.65,Paperback
Alchemist,by Paulo Coelho,4.6,3839.0,https://www.amazon.in/Alchemist-Paulo-Coelho/dp/8186685693,8186685693,₹185,Paperback
Hindu Rites and Rituals: Where They Come from and What They Mean,by K V Singh,3.8,54.0,https://www.amazon.in/Hindu-Rites-Rituals-Where-They/dp/0143425102,0143425102,₹150,Paperback
Introducing Buddha: A Graphic Guide (Introducing...),by Jane Hope,4.0,7.0,https://www.amazon.in/Introducing-Buddha-Graphic-Guide-ebook/dp/B00KFEJNY0,B00KFEJNY0,₹180.50,Kindle Edition
Miracles of Your Mind,by Dr. Joseph Murphy,4.2,218.0,https://www.amazon.in/Miracles-Your-Mind-Joseph-Murphy/dp/8183225101,8183225101,₹90,Paperback
Shiva to Shankara: Giving Form to the Formless,by Devdutt Pattanaik,4.4,27.0,https://www.amazon.in/Shiva-Shankara-Giving-Form-Formless/dp/9352641957,9352641957,₹227,Hardcover
Of Mystics & Mistakes,by Sadhguru,4.5,52.0,https://www.amazon.in/Mystics-Mistakes-Sadhguru/dp/8184953089,8184953089,₹235,Paperback
The Prophet,by Kahlil Gibran,4.4,16.0,https://www.amazon.in/Prophet-Kahlil-Gibran/dp/9352230744,9352230744,₹71,Paperback
A Fistful of Wisdom: A Monk's Light Musings on Life's Serious Stuff,by Om Swami,4.9,60.0,https://www.amazon.in/Fistful-Wisdom-Monks-Musings-Serious/dp/9386867281,9386867281,₹315.62,Paperback
Mind Full to Mindful: Zen Wisdom From a Monk's Bowl,by Om Swami - Import,4.8,115.0,https://www.amazon.in/Mind-Full-Mindful-Wisdom-Monks/dp/9352777638,9352777638,₹275.11,Paperback
The Chronicles of Hanuman,by Shubha Vilas - Import,4.7,27.0,https://www.amazon.in/Chronicles-Hanuman-Shubha-Vilas/dp/9384225762,9384225762,₹333,Paperback
The Last Gambit,by Om Swami,4.8,160.0,https://www.amazon.in/Last-Gambit-Om-Swami/dp/9352640926,9352640926,₹225,Paperback
Croissants and Corruption (Margot Durand Cozy Mystery Book 1),by Danielle Collins,5.0,1.0,https://www.amazon.in/Croissants-Corruption-Margot-Durand-Mystery-ebook/dp/B06X9C3G5T,B06X9C3G5T,₹49,Kindle Edition
The Ramayana (Penguin Classics),by R.K. Narayan,4.0,7.0,https://www.amazon.in/Ramayana-Penguin-Classics-R-K-Narayan/dp/0143039679,0143039679,₹340,Paperback
Kaivalya Dharshanam,by Sri Sri Yukteswar Giri,4.5,64.0,https://www.amazon.in/Kaivalya-Dharshanam-Sri-Yukteswar-Giri/dp/8189955039,8189955039,₹75,Paperback
Shiv Mahapuran ( Religious book ),by Ramneek jewels,,,https://www.amazon.in/Ramneek-jewels-Shiv-Mahapuran-Religious/dp/B06WGQKX64,B06WGQKX64,,
Origin (Robert Langdon),by Dan Brown,4.0,1184.0,https://www.amazon.in/Origin-Robert-Langdon-Dan-Brown/dp/0552174165,0552174165,₹215,Paperback
A History of the Sikhs (1469-1839) - Vol. 1: Volume 1 : 1469-1839,by Khushwant Singh,4.4,36.0,https://www.amazon.in/History-Sikhs-1469-1839-Vol/dp/0195673085,0195673085,₹372,Paperback
Kundalini: An Untold Story (Hindi),by Om Swami,4.0,50.0,https://www.amazon.in/Kundalini-Untold-Story-Om-Swami/dp/9386348969,9386348969,₹166,Paperback
"Ramayan Ki Kahani, Vigyan Ki Jubani",by Saroj Bala,5.0,7.0,https://www.amazon.in/Ramayan-Ki-Kahani-Vigyan-Jubani/dp/9353220440,9353220440,₹919,Hardcover
"I DON'T WANT TO SLEEP"": Teaching Kids the Importance of Sleep. (Bedtimes sleep...""",by Sigal Adler,4.8,6.0,https://www.amazon.in/DONT-WANT-SLEEP-Importance-Childrens-ebook/dp/B071RMKKM5,B071RMKKM5,₹70,Kindle Edition
"Vanara: The Legend of Baali, Sugreeva and Tara",by Anand Neelakantan,4.1,52.0,https://www.amazon.in/Vanara-Legend-Baali-Sugreeva-Tara/dp/014344283X,014344283X,₹201,Paperback
"Pindia Wood Book Stand Cover Case (12.5 inch x 12.5 inch, Brown)",by Pindia,3.6,75.0,https://www.amazon.in/Pindia-Wood-Stand-Cover-Brown/dp/B00GMELNI6,B00GMELNI6,₹182,
Apprenticed to a Himalayan Master: A Yogi's Autobiography,by Sri M. - Unabridged,4.6,300.0,https://www.amazon.in/Apprenticed-Himalayan-Master-Yogis-Autobiography/dp/B07MWG4VTZ,B07MWG4VTZ,₹0,Audible Audiobook
Sai Satcharitra Book - Tamil Version,by SHRI SAIBABA SANSTHAN TRUST,4.6,18.0,https://www.amazon.in/Sai-Satcharitra-Book-Tamil-Version/dp/B01D2OIT6W,B01D2OIT6W,₹90,Gift
Do Not Believe in God Till You Experience Him,by Mukul Kumar - Import,4.1,29.0,https://www.amazon.in/Not-Believe-God-Till-Experience/dp/9352017498,9352017498,₹275,Paperback
"Home Sweet Home"":: Teach Your Kids About the Importance of Home! (Bedtimes Story...""",by Sigal Adler,3.3,3.0,https://www.amazon.in/Home-Sweet-Importance-Bedtimes-Childrens-ebook/dp/B076J5YHFN,B076J5YHFN,₹72,Kindle Edition
Autobiography of a Yogi (Complete Paperback Edition),by Paramahansa Yogananda,4.6,1265.0,https://www.amazon.in/Autobiography-Yogi-Complete-Free-CD/dp/818953551X,818953551X,₹89,Paperback
SAI BABA IS STILL ALIVE - TAMIL (RS 299),by JAYA WAHI,5.0,2.0,https://www.amazon.in/SAI-BABA-STILL-ALIVE-TAMIL/dp/9386206846,9386206846,₹269,Paperback
Burn Anger Before Anger Burns You,by J.P. Vaswani,3.7,12.0,https://www.amazon.in/Burn-Anger-Before-Burns-You/dp/8183283829,8183283829,₹176,Paperback
PRAYERS FOR FINANCIAL MIRACLES: AND 3 WAYS TO RECEIVE ANSWERS QUICKLY (PRAYER...,by FRANCIS JONAH,4.4,14.0,https://www.amazon.in/PRAYERS-FINANCIAL-MIRACLES-RECEIVE-ANSWERS-ebook/dp/B01ITWZT60,B01ITWZT60,₹0,Kindle Edition
Ramayana Versus Mahabharata: My Playful Comparison,by Devdutt Pattanaik,4.2,28.0,https://www.amazon.in/Ramayana-Versus-Mahabharata-Playful-Comparison/dp/9353332303,9353332303,₹221,Paperback
Jewel Fuel 24k Gold Plated Hanuman Chalisa Religious Book Gift Set,by JEWEL FUEL,5.0,1.0,https://www.amazon.in/Jewel-Plated-Hanuman-Chalisa-Religious/dp/B075VCCWTN,B075VCCWTN,₹599,
Jaya: An Illustrated Retelling of the Mahabharata,by Devdutt Pattanaik - Illustrated,4.5,705.0,https://www.amazon.in/Jaya-Illustrated-Mahabharata-Devdutt-Pattanaik/dp/014310425X,014310425X,₹290,Paperback
Om Swami: As We Know Him,by Ismita Tandon,4.9,171.0,https://www.amazon.in/Om-Swami-As-Know-Him/dp/935029737X,935029737X,₹321.92,Paperback
Sri Kamakshi Vybhavam: కామాక్షి వైభవం,by Chaganti Koteshwara Rao,4.4,8.0,https://www.amazon.in/Sri-Kamakshi-Vybhavam-%E0%B0%95%E0%B0%BE%E0%B0%AE%E0%B0%BE%E0%B0%95%E0%B1%8D%E0%B0%B7%E0%B0%BF-%E0%B0%B5%E0%B1%88%E0%B0%AD%E0%B0%B5%E0%B0%82/dp/9385231162,9385231162,₹50,Perfect Paperback
Asli Prachin Brihad Ravan Sanhita,by Tantrik Bahal,3.2,9.0,https://www.amazon.in/Asli-Prachin-Brihad-Ravan-Sanhita/dp/8184911211,8184911211,₹895,Hardcover
TNPSC Exam Guide for Executive Officer Grade III & IV in Hindu Religious and...,by S.S.Kumar Advocate,,,https://www.amazon.in/Executive-Religious-Endowment-Religion-Vainavam/dp/B07KRFPQH4,B07KRFPQH4,₹324,Paperback
"Pilgrim’s Progress (Illustrated): Updated, Modern English. More than 100 Illustrations...",by John Bunyan,5.0,12.0,https://www.amazon.in/Pilgrims-Progress-Illustrated-English-Illustrations-ebook/dp/B00Q8NFZY4,B00Q8NFZY4,₹0,Kindle Edition
Educated: The international bestselling memoir,by Tara Westover - Import,4.8,16.0,https://www.amazon.in/Educated-international-bestselling-Tara-Westover/dp/0099511029,0099511029,₹374,Paperback
Swami Vivekananda: A Biography,by Gautam Ghosh,4.1,23.0,https://www.amazon.in/Swami-Vivekananda-Biography-Gautam-Ghosh/dp/8129101491,8129101491,₹375,Paperback
Shri Sai Satcharita: The Life and Teachings of Shirdi Sai Baba,by Govind R. Dabholkar,4.6,40.0,https://www.amazon.in/Shri-Sai-Satcharita-Teachings-Shirdi/dp/8120721535,8120721535,₹405,Paperback
SUPPANDI (VOL 4) : TINKLE COLLECTION (SUPPANDI : TINKLE COLLECTION),by Rajani Thindiath,4.4,26.0,https://www.amazon.in/SUPPANDI-VOL-TINKLE-COLLECTION-ebook/dp/B076WXR4LX,B076WXR4LX,₹98.70,Kindle Edition
Jeevan Ke Adbhut Rahasya,by Gaur Gopal Das,,,https://www.amazon.in/Jeevan-Adbhut-Rahasya-Gaur-Gopal/dp/0143446797,0143446797,₹143,Paperback
Gurudev: On the Plateau of the Peak: The Life of Sri Sri Ravi Shankar,by Bhanumathi Narasimhan,4.9,330.0,https://www.amazon.in/Gurudev-Plateau-Peak-Life-Shankar/dp/9386850575,9386850575,₹293,Hardcover
Land of the Seven Rivers: A Brief History of India's Geography,by Sanjeev Sanyal,4.6,293.0,https://www.amazon.in/Land-Seven-Rivers-History-Geography/dp/0143420933,0143420933,₹217,Paperback
Transgression: A Time-Travel Suspense Novel (City of God Book 1),by R.S. Ingermanson,3.6,28.0,https://www.amazon.in/Transgression-Time-Travel-Suspense-Novel-City-ebook/dp/B00K8N8NV2,B00K8N8NV2,₹0,Kindle Edition
Unposted Letter,by Mahatria Ra,4.7,248.0,https://www.amazon.in/Unposted-Letter-Mahatria-Ra/dp/8183225705,8183225705,₹218,Hardcover
The Religions Book (Big Ideas),by D.K.,4.7,8.0,https://www.amazon.in/Religions-Book-Big-Ideas/dp/1409324915,1409324915,₹750,Hardcover
Charles and the Intruder: Clean Historical Regency Romance (House of Catesby...,by Sunny Brooks,4.3,36.0,https://www.amazon.in/Charles-Intruder-Historical-Regency-Romance-ebook/dp/B072F68G4Z,B072F68G4Z,₹255,Kindle Edition
Finding Radha: The Quest for Love,by Gokhale Namita,5.0,1.0,https://www.amazon.in/Finding-Radha-Quest-Gokhale-Namita/dp/0143441450,0143441450,₹248,Paperback
The Book of Faith,by Navjot Gautam - Import,5.0,26.0,https://www.amazon.in/Book-Faith-Navjot-Gautam/dp/9387944956,9387944956,₹303,Paperback
Freedom from the Known,by J Krishnamurti,4.6,86.0,https://www.amazon.in/Freedom-Known-J-Krishnamurti/dp/1846042135,1846042135,₹213,Paperback
Ramayana for Children,by Sudha Gupta - Import,4.7,16.0,https://www.amazon.in/Ramayana-Children-Sudha-Gupta/dp/813193702X,813193702X,₹320,Hardcover
" BEAUTY AND THE WITCH "": Teach your Kids kindness (Bedtime story children's...""",by Sigal Adler,5.0,2.0,https://www.amazon.in/BEAUTY-WITCH-kindness-Bedtime-childrens-ebook/dp/B076TSNRMT,B076TSNRMT,₹64,Kindle Edition
What Are You Doing with Your Life?,by J. Krishnamurti,4.8,6.0,https://www.amazon.in/What-Are-Doing-Your-Life/dp/1846045851,1846045851,₹199,Paperback
Arohan: Pramukh Swamiji Ke Saath Mera Adyatmik Safar: Pramukh Swamiji Ke Saath...,by A P J Abdul Kalam,5.0,4.0,https://www.amazon.in/Arohan-Pramukh-Swamiji-Adyatmik-Adhyatmik/dp/9351776190,9351776190,₹279,Paperback
Asankhya Vichaar (A Million Thoughts),by Om Swami,5.0,2.0,https://www.amazon.in/Asankhya-Vichaar-Million-Thoughts-Swami/dp/9387944395,9387944395,,Paperback
Amma Tell Me about Hanuman's Adventures in Lanka!: Part 3 in the Hanuman Trilogy,by Bhakti Mathur,5.0,1.0,https://www.amazon.in/Amma-about-Hanumans-Adventures-Lanka/dp/9881239516,9881239516,₹227,Paperback
CLASSIC SHOPPE Wooden Hand Carved Holy Book Stand 10 INCH ( Religious Item ),by CLASSIC SHOPPE,3.8,3.0,https://www.amazon.in/CLASSIC-SHOPPE-Wooden-Carved-Religious/dp/B078TKN5M4,B078TKN5M4,₹138,
Everybody Loves a Good Drought,by P. Sainath,4.5,87.0,https://www.amazon.in/Everybody-Loves-Good-Drought-Sainath/dp/0140259848,0140259848,₹375,Paperback
Sadhguru Nanak - Sadhana Rahasya Aur Jeevan Charitra,by Sirshree,5.0,6.0,https://www.amazon.in/Sadhguru-Nanak-Sadhana-Rahasya-Charitra/dp/8183226949,8183226949,₹100,Paperback
THE SNAIL WHO FORGOT THE MAIL (Bedtime stories children's picture books Book 1),by sigal adler,4.7,8.0,https://www.amazon.in/FORGOT-Bedtime-Dreaming-fiction-childrens-ebook/dp/B00EVDUR1Y,B00EVDUR1Y,₹76,Kindle Edition
The Road Less Travelled (Arrow New-Age),by M. Scott Peck,4.3,95.0,https://www.amazon.in/Road-Less-Travelled-Arrow-New-Age/dp/0099727404,0099727404,₹298,Paperback
Aghora: At the Left Hand of God,by Robert Svobod,4.4,82.0,https://www.amazon.in/Aghora-At-Left-Hand-God/dp/8171673422,8171673422,₹272.26,Paperback
Nine Lives: In Search of the Sacred in Modern India,by William Dalrymple - Unabridged,4.2,51.0,https://www.amazon.in/Nine-Lives-Search-Sacred-Modern/dp/B07D6X16S2,B07D6X16S2,₹0,Audible Audiobook
100 World's Greatest Speeches,by Various,4.8,6.0,https://www.amazon.in/100-Worlds-Greatest-Speeches-Various/dp/9387779408,9387779408,₹199,Paperback
Valmiki's Ramayana,by Anant pai,4.4,4.0,https://www.amazon.in/Valmikis-Ramayana-Anant-pai-ebook/dp/B071VT9MZT,B071VT9MZT,₹55.65,Kindle Edition
A New Earth: The LIFE-CHANGING follow up to The Power of Now. 'An otherworldly...,by Eckhart Tolle,4.7,131.0,https://www.amazon.in/New-Earth-LIFE-CHANGING-otherworldly-Breakfast/dp/0141039418,0141039418,₹414,Paperback
Store Indya Hand Carved Folding Religious Book Stand Holder with Intricate Carvings,by Store Indya,,,https://www.amazon.in/Store-Indya-Religious-Intricate-Carvings/dp/B01M6390JW,B01M6390JW,₹699,
The Power of Now: A Guide to Spiritual Enlightenment,by Eckhart Tolle,4.3,10.0,https://www.amazon.in/Power-Now-Guide-Spiritual-Enlightenment/dp/0340920831,0340920831,₹285,Paperback
"GoldGiftIdeas 24K Gold Plated Bhaktamar Stotra, Jain Religious Book, Gift for...",by GoldGiftIdeas,5.0,2.0,https://www.amazon.in/GoldGiftIdeas-Bhaktamar-Religious-Parents-Grandparents/dp/B074V6SWBF,B074V6SWBF,₹679,
Mystic’s Musings,by Sadhguru,4.6,59.0,https://www.amazon.in/Mystics-Musings-Sadhguru/dp/8184959842,8184959842,₹379,Paperback
"Don’t Feed the Monster!"": Help Kids Overcome their Fears. (Bedtimes Story  Fiction...""",by Sigal Adler,4.4,10.0,https://www.amazon.in/Dont-Feed-Monster-Overcome-Childrens-ebook/dp/B07FYPYF24,B07FYPYF24,₹70,Kindle Edition
Most And More,by Mahatria Ra,4.7,93.0,https://www.amazon.in/Most-More-Mahatria-Ra/dp/8183225748,8183225748,₹310,Hardcover
Sai Satcharitra Book - English,by SHRI SAIBABA SANSTHAN TRUST,4.9,19.0,https://www.amazon.in/Satcharitra-Book-SAIBABA-SANSTHAN-TRUST/dp/B073RDMPVY,B073RDMPVY,₹90,Hardcover
Karuda Puranam,by Sri Govindarajan,3.9,33.0,https://www.amazon.in/Karuda-Puranam-Sri-Govindarajan/dp/8183684955,8183684955,,Paperback
Mahabharata for Children,by Sudha Gupta - Import,4.5,4.0,https://www.amazon.in/Mahabharata-Children-Sudha-Gupta/dp/8131937011,8131937011,₹356,Hardcover
The Tibetan Book Of Living And Dying: A Spiritual Classic from One of the Foremost...,by Sogyal Rinpoche,4.5,55.0,https://www.amazon.in/Tibetan-Book-Living-Dying-Interpreters/dp/1846041058,1846041058,₹341,Paperback
Karma Sutra - Karmachi Sanketik Bhasha Ulgadna (Marathi) (Karma Sutra -Cracking...,by HINGORI,5.0,2.0,https://www.amazon.in/Karma-Sutra-Karmachi-Sanketik-Cracking/dp/8193371410,8193371410,₹146,Paperback
100 Stories You Will Never Forget,by J. P. Vaswani,4.5,7.0,https://www.amazon.in/100-Stories-Will-Never-Forget-ebook/dp/B00SZT7LIC,B00SZT7LIC,₹184.17,Kindle Edition
Milk and Honey,by Rupi Kaur,4.3,314.0,https://www.amazon.in/Milk-Honey-Rupi-Kaur/dp/144947425X,144947425X,₹250,Paperback
What Is Hinduism?: A Guide for the Global Mind,by David Frawley,4.4,11.0,https://www.amazon.in/What-Hinduism-Guide-Global-Mind/dp/9388038630,9388038630,₹374,Paperback
Mandodari: Queen of Lanka,by Manini J. Anandani,4.5,21.0,https://www.amazon.in/Mandodari-Queen-Manini-J-Anandani/dp/0143442686,0143442686,₹171,Paperback
Justice Delayed ( Book #1),by Patricia Bradley,4.4,148.0,https://www.amazon.in/Justice-Delayed-Book-Patricia-Bradley-ebook/dp/B01M07AN3K,B01M07AN3K,₹0,Kindle Edition
The Case for Reason: Volume One: Understanding the Anti-superstition Movement,by Narendra Dabholkar,4.0,5.0,https://www.amazon.in/Case-Reason-Understanding-Anti-superstition-Movement/dp/9387894142,9387894142,₹461,Hardcover
TRUTH ETERNAL-THE HEARTFULNESS WAY SERIES: By the spiritual scientist who rediscovered...,by Ram Chandra of Fatehgarh,5.0,9.0,https://www.amazon.in/TRUTH-ETERNAL-HEARTFULNESS-WAY-rediscovered/dp/9388095162,9388095162,,Paperback
The Book of Children: Supporting the Freedom and Intelligence of a New Generation...,by Osho,4.6,35.0,https://www.amazon.in/Book-Children-Supporting-Intelligence-Foundations/dp/1250006201,1250006201,₹298,Paperback
I've Only Got Three Hands:: Teach Your Children to Keep Their Room Clean (Bedtimes...,by Sigal Adler,4.6,69.0,https://www.amazon.in/Ive-Only-Got-Three-Hands-ebook/dp/B07BD4JGMQ,B07BD4JGMQ,₹71,Kindle Edition
The Supreme Yoga: Yoga Vasistha,by Swami Venkatesananda,4.4,45.0,https://www.amazon.in/Supreme-Yoga-Vasistha/dp/8120819756,8120819756,₹375,Paperback
Light From Many Lamps,by Watson,4.6,204.0,https://www.amazon.in/Light-Many-Lamps-Watson/dp/0671652508,0671652508,₹404,Paperback
"How to Study the Bible (Updated, Annotated)",by Dwight L. Moody,4.5,11.0,https://www.amazon.in/How-Study-Bible-Updated-Annotated-ebook/dp/B071WQ34XY,B071WQ34XY,₹0,Kindle Edition
Aghora III: 3,by Svoboda,4.6,18.0,https://www.amazon.in/Aghora-III-3-Svoboda/dp/0914732374,0914732374,₹178,Paperback
Conversations With God: 1,by Neale Donald Walsch,4.4,64.0,https://www.amazon.in/Conversations-God-Neale-Donald-Walsch/dp/0340693258,0340693258,₹291,Paperback
"GoldGiftIdeas 24K Gold Plated Aarti Sangrah, Hindu Religious Book, Gift for Parents...",by GoldGiftIdeas,4.6,3.0,https://www.amazon.in/GoldGiftIdeas-Sangrah-Religious-Parents-Grandparents/dp/B074V4Z56C,B074V4Z56C,₹479,
Only Love is Real: The Story of Soulmates Reunited,by Brian Weiss,4.4,70.0,https://www.amazon.in/Only-Love-Real-Soulmates-Reunited/dp/0749916206,0749916206,₹273,Paperback
Kundalini: The Evolutionary Energy in Man,by Krishna Gopi,4.5,2.0,https://www.amazon.in/Kundalini-Evolutionary-Energy-Krishna-Gopi/dp/1570622809,1570622809,,Paperback
The Fashion Designer (Free Preview) (Pattern Artist Book 2),by Nancy Moser,5.0,1.0,https://www.amazon.in/Fashion-Designer-Preview-Pattern-Artist-ebook/dp/B07D3K8XF7,B07D3K8XF7,₹0,Kindle Edition
Living with the Himalayan Masters,by Rama Swami - Import,4.6,187.0,https://www.amazon.in/Living-Himalayan-Masters-Rama-Swami/dp/0893891568,0893891568,₹383,Paperback
The Next Person You Meet in Heaven: The sequel to the Five People You Meet in...,by Mitch Albom,4.0,7.0,https://www.amazon.in/Next-Person-You-Meet-Heaven/dp/075157189X,075157189X,₹399,Hardcover
Dharmik Suktiyan: Popular Religious Innovations,by Prakash Chandra Gangrade,3.9,2.0,https://www.amazon.in/Dharmik-Suktiyan-Popular-Religious-Innovations/dp/9381448876,9381448876,₹124,Paperback
The Classical Music Book (Big Ideas),by DK,5.0,1.0,https://www.amazon.in/Classical-Music-Book-Big-Ideas/dp/0241301971,0241301971,₹874,Hardcover
