Title,Author,Rating,Reviews Count,URL,ISBN-10,Price,Binding
"SAS Survival Guide: How to Survive in the Wild, on Land or Sea (Collins Gem)",by John ‘Lofty’ Wiseman,3.9,7,https://www.amazon.in/SAS-Survival-Guide-Survive-Collins/dp/0008133786,0008133786,₹319,Paperback
"Gerrard",by Steven Gerrard,4.3,23,https://www.amazon.in/Gerrard-Steven/dp/0553817337,0553817337,₹374,Paperback
"Clean Bowled! Butterfingers",by Khyrunnisa A.,5,6,https://www.amazon.in/Clean-Bowled-Butterfingers-Khyrunnisa/dp/0143333364,0143333364,₹179,Paperback
"Strength Training Anatomy",by Frederic Delavier - Import,4.5,2,https://www.amazon.in/Strength-Training-Anatomy-Frederic-Delavier/dp/0736063684,0736063684,₹715,Paperback
"Sports Biomechanics and Kinesiology (M.P.Ed. New Syllabus)",by Dr. Aajy Vasantrao Gulhane,,,https://www.amazon.in/Sports-Biomechanics-Kinesiology-M-P-Ed-Syllabus/dp/B07C1BYFZP,B07C1BYFZP,₹280,Paperback
"Teenage Mutant Ninja Turtles Playtime Stories",by Edda USA Editorial Team - Import,,,https://www.amazon.in/Teenage-Mutant-Turtles-Playtime-Stories/dp/1940787564,1940787564,₹103,Paperback
"To the Top!: Climbing the World's Highest Mountain (Step into Reading)",by Sydelle Kramer,4,2,https://www.amazon.in/Top-Climbing-Highest-Mountain-Reading/dp/0679838856,0679838856,₹135,Paperback
"Sports Illustrated Kids Big Book of Who Basketball (Sports Illustrated Kids Big...",by The Editors of Sports Illustrated Kids,4.8,58,https://www.amazon.in/Sports-Illustrated-Kids-Basketball-Books/dp/1618931342,1618931342,,Hardcover
"கருப்பு முத்து பீலே (Tamil Edition)",by ராஜேஷ் தேவநாதன்,5,1,https://www.amazon.in/%E0%AE%95%E0%AE%B0%E0%AF%81%E0%AE%AA%E0%AF%8D%E0%AE%AA%E0%AF%81-%E0%AE%AE%E0%AF%81%E0%AE%A4%E0%AF%8D%E0%AE%A4%E0%AF%81-Tamil-%E0%AE%B0%E0%AE%BE%E0%AE%9C%E0%AF%87%E0%AE%B7%E0%AF%8D-%E0%AE%A4%E0%AF%87%E0%AE%B5%E0%AE%A8%E0%AE%BE%E0%AE%A4%E0%AE%A9%E0%AF%8D-ebook/dp/B07MLJR594,B07MLJR594,₹60,Kindle Edition
"Football Stars",by Pegasus Team - Import,4.7,10,https://www.amazon.in/Football-Stars-Pegasus-Team/dp/8131937127,8131937127,₹142,Paperback
"The Way of the Runner: A journey into the obsessive world of Japanese running",by Adharanand Finn,4.7,4,https://www.amazon.in/Way-Runner-journey-obsessive-Japanese/dp/057130317X,057130317X,₹407,Paperback
"Shooting a Tiger: Big-Game Hunting and Conservation in Colonial India",by Vijaya Ramadas Mandala,,,https://www.amazon.in/Shooting-Tiger-Big-Game-Conservation-Colonial/dp/0199489386,0199489386,₹1,235,Hardcover
"Spinderella (Reading Ladder Level 2)",by Julia Donaldson,5,1,https://www.amazon.in/Spinderella-Reading-Ladder-Level-2/dp/1405282029,1405282029,₹179,Paperback
"Rupa Book of Indian Wildlife Quiz",by Seep Narayan Pandey,4.5,17,https://www.amazon.in/Rupa-Book-Indian-Wildlife-Quiz/dp/8171670458,8171670458,₹76,Paperback
