Title,Author,Rating,Reviews Count,URL,ISBN-10,Price,Binding
"281 and Beyond",by VVS Laxman,4.6,23,https://www.amazon.in/281-Beyond-VVS-Laxman/dp/9387578771,9387578771,₹411,Hardcover
"Eleven Gods and a Billion Indians: The On and Off the Field Story of Cricket...",by Boria Majumdar - Import,4.4,24,https://www.amazon.in/Eleven-Gods-Billion-Indians-Cricket/dp/9386797186,9386797186,₹373,Hardcover
"A Century is not Enough: My Roller-coaster Ride to Success",by Sourav Ganguly - Illustrated,4.6,324,https://www.amazon.in/Century-not-Enough-Roller-coaster-Success/dp/9386228564,9386228564,₹434,Hardcover
"Faster than Lightning My Story",by Usain Bolt,4.6,91,https://www.amazon.in/Faster-than-Lightning-My-Story/dp/0008154201,0008154201,₹218,Paperback
"Playing It My Way",by Sachin Tendulkar - Abridged,4.5,2065,https://www.amazon.in/Playing-My-Way-Sachin-Tendulkar/dp/1473605172,1473605172,₹419,Paperback
"Barefoot to Boots: The Many Lives of Indian Football",by Novy Kapadia,4.9,12,https://www.amazon.in/Barefoot-Boots-Lives-Indian-Football/dp/0143426419,0143426419,₹274,Paperback
"Dipa Karmakar: The Small Wonder (India's First Ever Female Gymnast to Compete...",by Bishweshwar Nandi,4.7,4,https://www.amazon.in/Dipa-Karmakar-Gymnast-Compete-Olympics/dp/9388369505,9388369505,₹349,Hardcover
"The Complete Indian Sports Quiz Book",by Vijayan Bala,4,5,https://www.amazon.in/Complete-Indian-Sports-Quiz-Book/dp/9351941450,9351941450,₹396,Paperback
"Endure: Mind, Body and the Curiously Elastic Limits of Human Performance",by Alex Hutchinson,4.6,5,https://www.amazon.in/Endure-Curiously-Elastic-Limits-Performance/dp/0008277060,0008277060,₹434,Paperback
"Women in Sports (Women in Science)",by Rachel Ignotofsky,5,1,https://www.amazon.in/Women-Sports-Science-Rachel-Ignotofsky/dp/1607749785,1607749785,₹375,Hardcover
"A Corner of a Foreign Field: The Indian History of a British Sport",by Ramachandra Guha,4.5,16,https://www.amazon.in/Corner-Foreign-Field-History-British/dp/0143427687,0143427687,₹390,Paperback
"Relentless: From Good to Great to Unstoppable",by Tim S. Grover,4.4,51,https://www.amazon.in/Relentless-Unstoppable-Tim-S-Grover/dp/1476714207,1476714207,₹399,Paperback
"The Ultimate Bodybuilding Diet, Nutrition and Workout Plan for Men and Women",by Jenny Allan,3.8,26,https://www.amazon.in/Ultimate-Bodybuilding-Nutrition-Workout-Women-ebook/dp/B00EKH4H3A,B00EKH4H3A,₹0,Kindle Edition
"The Dhoni Touch: Unravelling the Enigma That Is Mahendra Singh Dhoni",by Bharat Sundaresan,4.6,87,https://www.amazon.in/Dhoni-Touch-Unravelling-Enigma-Mahendra/dp/0143440063,0143440063,₹174,Paperback
"India Unlimited Book 4: The Sports Quiz Book",by Kunal Savarkar,5,2,https://www.amazon.in/India-Unlimited-Book-Sports-Quiz/dp/9386106469,9386106469,₹138,Paperback
"The Sports Book (Dk)",by DK,4,9,https://www.amazon.in/Sports-Book-Dk-DK/dp/1409335089,1409335089,₹903,Hardcover
"Alex Ferguson: My Autobiography",by Alex Ferguson,4.7,81,https://www.amazon.in/Alex-Ferguson-My-Autobiography/dp/034091940X,034091940X,₹492,Paperback
"The Winning Way 2.0: Learnings From Sport for Managers",by Anita Bhogle,4.2,86,https://www.amazon.in/Winning-Way-2-0-Learnings-Managers/dp/938622478X,938622478X,₹219,Paperback
"Yoga Anatomy",by Leslie Kaminoff,4.7,24,https://www.amazon.in/Yoga-Anatomy-Leslie-Kaminoff/dp/1450400248,1450400248,₹945,Paperback
"I Am Zlatan Ibrahimovic",by Zlatan Ibrahimovic,4.8,51,https://www.amazon.in/I-Am-Zlatan-Ibrahimovic/dp/0241966833,0241966833,₹374,Paperback
"Shoe Dog: A Memoir by the Creator of NIKE",by Phil Knight,4.6,377,https://www.amazon.in/Shoe-Dog-Memoir-Creator-NIKE/dp/1471146723,1471146723,₹350.52,Paperback
"Children's Book of Sport (Dk)",by DK,4.5,2,https://www.amazon.in/Childrens-Book-Sport-Dk-DK/dp/1405368500,1405368500,₹434,Hardcover
"AB de Villiers - The Autobiography",by A B de Villiers,4.6,227,https://www.amazon.in/AB-Villiers-Autobiography-B/dp/1509842764,1509842764,₹565,Paperback
"Peppa Pig: Sports Day - Read it yourself with Ladybird: Level 2",by NA,4.5,24,https://www.amazon.in/Peppa-Pig-Sports-yourself-Ladybird/dp/0723273170,0723273170,₹111,Paperback
"Federer",by Chris Bowers,4,16,https://www.amazon.in/Federer-Chris-Bowers/dp/9381506841,9381506841,₹326,Paperback
"The Illustrated History of Football",by David Squires,4.7,9,https://www.amazon.in/Illustrated-History-Football-David-Squires/dp/1780895585,1780895585,₹531.23,Hardcover
"Open: An Autobiography",by Andre Agassi,4.7,160,https://www.amazon.in/Open-Autobiography-Andre-Agassi/dp/0007416792,0007416792,₹311,Paperback
"Bobby Fischer Teaches Chess",by Bobby Fischer,3.7,85,https://www.amazon.in/Bobby-Fischer-Teaches-Chess/dp/0553263153,0553263153,₹350,Mass Market Paperback
"Unbreakable",by Mary Kom,4.6,158,https://www.amazon.in/Unbreakable-Mary-Kom/dp/9351160092,9351160092,₹145,Paperback
"Cricket Stars",by Pegasus Team - Import,4.3,18,https://www.amazon.in/Cricket-Stars-Pegasus-Team/dp/8131937135,8131937135,₹142,Paperback
"Ronaldo - 2018 Updated Edition: The Obsession For Perfection (Luca Caioli)",by Luca Caioli,5,9,https://www.amazon.in/Ronaldo-Updated-Obsession-Perfection-Caioli/dp/1785782312,1785782312,₹359,Paperback
"Winning Like Virat: Think and Succeed like Kohli",by Abhirup Bhattacharya - Import,4.1,34,https://www.amazon.in/Winning-Like-Virat-Think-Succeed/dp/8129146061,8129146061,₹195,Paperback
"It's Not About The Bike: My Journey Back to Life",by Lance Armstrong,4.3,34,https://www.amazon.in/Its-Not-About-Bike-Journey/dp/0224060872,0224060872,₹341,Paperback
"Messi, Neymar, Ronaldo - 2017",by Luca Caioli,4.1,11,https://www.amazon.in/Messi-Neymar-Ronaldo-Luca-Caioli/dp/1785781111,1785781111,₹291,Paperback
"Rafa: My Story",by Rafael Nadal - International Edition,4.6,64,https://www.amazon.in/Rafa-My-Story-Rafael-Nadal/dp/0751547735,0751547735,₹552.94,Paperback
"Democracy's XI: The Great Indian Cricket Story",by Rajdeep Sardesai,2.4,63,https://www.amazon.in/Democracys-XI-Great-Indian-Cricket/dp/9386228483,9386228483,₹458,Hardcover
"Yuvraj singh The Test Of My Life",by Yuvraj Singh - Illustrated,4.7,212,https://www.amazon.in/Yuvraj-singh-Test-My-Life/dp/818400298X,818400298X,₹320,Hardcover
"The Champion's Mind: How Great Athletes Think, Train, and Thrive",by Jim Afremow,5,12,https://www.amazon.in/Champions-Mind-Great-Athletes-Thrive/dp/1623365627,1623365627,₹923,Paperback
"Leading",by Alex Ferguson,4.4,58,https://www.amazon.in/Leading-Alex-Ferguson/dp/147362164X,147362164X,₹421.74,Paperback
"The Illustrated History of Football World Cup 1930-2018: Collector's Edition",by Christopher Fritz,4.6,41,https://www.amazon.in/Illustrated-History-Football-World-1930-2018/dp/9387779254,9387779254,₹537.60,Hardcover
"A Shot at History: My Obsessive Journey to Olympic Gold and Beyond",by Abhinav Bindra,4.8,64,https://www.amazon.in/Shot-History-Obsessive-Journey-Olympic/dp/9352645758,9352645758,₹315,Paperback
"Unstoppable: My Life So Far",by Maria Sharapova,4.8,23,https://www.amazon.in/Unstoppable-My-Life-So-Far/dp/1846149843,1846149843,₹430,Paperback
"Imperfect",by Sanjay Manjrekar - Import,4.4,92,https://www.amazon.in/Imperfect-Sanjay-Manjrekar/dp/9352774515,9352774515,₹433,Hardcover
"2018 FIFA World Cup Russia (TM) The Official Book (World Cup Russia 2018)",by Keir Radnedge - Import,4.8,7,https://www.amazon.in/2018-FIFA-World-Russia-Official/dp/1787390306,1787390306,₹1,951,Paperback
"HBR’s 10 Must Reads on Leadership Lessons from Sports (Featuring interviews with...",by Harvard Business Review,,,https://www.amazon.in/Leadership-Featuring-interviews-Ferguson-Abdul-Jabbar/dp/1633694348,1633694348,₹583,Paperback
"Big Win (Brit Boys Sports Romance Book 2)",by J.H. Croix,4.8,220,https://www.amazon.in/Brit-Boys-Sports-Romance-Book-ebook/dp/B06XB9W4QW,B06XB9W4QW,₹0,Kindle Edition
"Messi: A Biography",by Leonardo Faccio,4.4,5,https://www.amazon.in/Messi-Biography-Leonardo-Faccio/dp/0345802691,0345802691,₹397,Paperback
"Rules of Games and Sports - 2018",by Dr. Kalpana Sharma,4,1,https://www.amazon.in/Rules-Games-Sports-Kalpana-Sharma/dp/817524996X,817524996X,₹230,Paperback
"Let's Colour Copy Colouring Pack: Set of 8 books (Transport, Professions, Pets...",by Wonder House Books Editorial,4.6,3,https://www.amazon.in/Lets-Colour-Copy-Colouring-Pack/dp/9388144058,9388144058,₹299,Paperback
"The Complete Running and Marathon Book: How to Run Faster, Further, Smarter (...",by DK,4.7,5,https://www.amazon.in/Complete-Running-Marathon-Book-Activities/dp/1409337634,1409337634,,Paperback
"My Olympic Journey: 50 of India's Leading Sportspersons on the Biggest Test of...",by Digvijay Singh Deo,4.2,11,https://www.amazon.in/My-Olympic-Journey-Leading-Sportspersons/dp/014342663X,014342663X,₹275,Paperback
"The Football Book",by DK,3.3,4,https://www.amazon.in/Football-Book-DK/dp/0241317630,0241317630,₹1,024,Hardcover
"Physical Education and Sports Science (Book for All Competitive Exams D.S.S.S.B...",by Umesh Kr. Ahlawat,4.2,6,https://www.amazon.in/Physical-Education-Science-Competitive-D-S-S-S-B/dp/8175249714,8175249714,₹434,Paperback
"No Shortcuts to the Top: Climbing the World's 14 Highest Peaks",by Ed Viesturs,4.2,24,https://www.amazon.in/No-Shortcuts-Top-Climbing-Highest/dp/0767924711,0767924711,₹490,Paperback
"Match of the Day Annual 2018 (Annuals)",by Various,5,4,https://www.amazon.in/Match-Day-Annual-2018-Annuals/dp/1785942050,1785942050,₹274,Hardcover
"THE WINNING WAY:LEARNINGS FROM SPORT MANAGERS: Learning from Sport for Managers: 1",by Anita Bhogle^Harsha Bhogle,4.2,86,https://www.amazon.in/WINNING-WAY-LEARNINGS-MANAGERS-Learning/dp/938065832X,938065832X,₹250,Paperback
"Spot Plays Football",by Eric Hill,5,1,https://www.amazon.in/Spot-Plays-Football-Eric-Hill/dp/0241327059,0241327059,₹179,Board book
"Yoga for Sports: A Journey Towards Health and Healing: 1",by BKS Iyengar,4.5,17,https://www.amazon.in/Yoga-Sports-Journey-Towards-Healing/dp/9385152580,9385152580,₹989,Paperback
"The Big Switch: It's never too late",by John Thomas,4.4,570,https://www.amazon.in/Big-Switch-Its-never-late-ebook/dp/B0776ZJGNR,B0776ZJGNR,₹49,Kindle Edition
"Yuvraj Singh: Powerful Elegance",by Ayaz Memon - Import,4.1,9,https://www.amazon.in/Yuvraj-Singh-Powerful-Ayaz-Memon/dp/818495526X,818495526X,₹61,Paperback
"The Race of My Life: An Autobiography",by Rakeysh Omprakash Mehra,4.4,65,https://www.amazon.in/Race-My-Life-Autobiography/dp/8129129108,8129129108,₹137,Paperback
"Living on the Volcano: The Secrets of Surviving as a Football Manager",by Michael Calvin,4,2,https://www.amazon.in/Living-Volcano-Secrets-Surviving-Football/dp/0099598655,0099598655,₹324,Paperback
"Peppa Pig: Sports Day Activity Book – Ladybird Readers Level 2",by LADYBIRD,5,2,https://www.amazon.in/Peppa-Pig-Activity-Ladybird-Readers/dp/0241262267,0241262267,₹74,Paperback
"Sports Injuries: Prevention, Treatment and Rehabilitation, Fourth Edition",by Lars Peterson - Import,5,2,https://www.amazon.in/Sports-Injuries-Prevention-Treatment-Rehabilitation/dp/1841847054,1841847054,₹4,271,Hardcover
"No Spin: My Autobiography",by Shane Warne,3.8,14,https://www.amazon.in/No-Spin-Autobiography-Shane-Warne/dp/1785037714,1785037714,₹559,Paperback
"The Book of Why: The New Science of Cause and Effect",by Judea Pearl - Unabridged,5,1,https://www.amazon.in/Book-Why-Science-Cause-Effect/dp/B07CYQ1YSZ,B07CYQ1YSZ,₹0,Audible Audiobook
"The Greatest: My Own Story",by Muhammad Ali,4.3,9,https://www.amazon.in/Greatest-My-Own-Story/dp/1631680498,1631680498,₹992,Paperback
"The Book of Basketball: The NBA According to The Sports Guy",by Bill Simmons,5,3,https://www.amazon.in/Book-Basketball-NBA-According-Sports/dp/0345520106,0345520106,₹1,694.89,Paperback
"The Complete Guide to Sports Nutrition: 8th edition (Complete Guides)",by Anita Bean,3.8,7,https://www.amazon.in/Complete-Guide-Sports-Nutrition-Guides/dp/1472924207,1472924207,₹1,720,Paperback
"The Sports Gene: Talent, Practice and the Truth About Success",by David Epstein,3.7,3,https://www.amazon.in/Sports-Gene-Talent-Practice-Success/dp/022409162X,022409162X,₹324,Paperback
"Quidditch Through the Ages (Hogwarts Library book Book 2)",by J.K. Rowling,4.5,71,https://www.amazon.in/Quidditch-Through-Ages-Hogwarts-Library-ebook/dp/B01F3ET2SS,B01F3ET2SS,₹199,Kindle Edition
"Quiet Genius: Bob Paisley, British football’s greatest manager SHORTLISTED FOR...",by Ian Herbert - Import,4.4,5,https://www.amazon.in/Quiet-Genius-footballs-greatest-SHORTLISTED/dp/1472937333,1472937333,₹296,Paperback
"M S Dhoni: Captain Cool",by Ayaz Memon - Import,4.3,31,https://www.amazon.in/M-S-Dhoni-Captain-Cool/dp/8184955235,8184955235,₹110,Paperback
"Jonathan Livingston Seagull: A Story",by Richard Bach - Illustrated,4.6,336,https://www.amazon.in/Jonathan-Livingston-Seagull-Richard-Bach/dp/817223578X,817223578X,₹129,Paperback
"KP: My Autobiography",by Kevin Pietersen,4.1,35,https://www.amazon.in/KP-My-Autobiography-Kevin-Pietersen/dp/0751557579,0751557579,₹473,Paperback
"How to Win at the Sport of Business: If I Can Do It, You Can Do It",by Mark Cuban,3.7,11,https://www.amazon.in/How-Win-Sport-Business-Can/dp/1626810915,1626810915,₹705,Paperback
"The Best Things in Life are Free (Lonely Planet)",by Lonely Planet,5,1,https://www.amazon.in/Best-Things-Life-Lonely-Planet-ebook/dp/B01JR8CX3W,B01JR8CX3W,₹1,101.99,Kindle Edition
"Mossad",by Michael Bar-Zohar - Import,4.6,637,https://www.amazon.in/Mossad-Michael-Bar-Zohar/dp/8184958455,8184958455,₹340,Paperback
"Sports Training",by Prof. V. Satyanarayana,4,1,https://www.amazon.in/Sports-Training-Prof-V-Satyanarayana/dp/8178799790,8178799790,₹220,Paperback
"The Queen of Katwe: One Girl's Triumphant Path to Becoming a Chess Champion",by Tim Crothers,5,1,https://www.amazon.in/Queen-Katwe-Triumphant-Becoming-Champion/dp/145165782X,145165782X,₹591,Paperback
"The Manager: Inside the Minds of Football's Leaders",by Mike Carson,4.8,9,https://www.amazon.in/Manager-Inside-Minds-Footballs-Leaders/dp/1408843501,1408843501,₹749,Paperback
"Michael Jordan",by Roland Lazenby,5,2,https://www.amazon.in/Michael-Jordan-Roland-Lazenby/dp/031619476X,031619476X,₹949,Paperback
"MSD: The Man, The Leader",by Biswadeep Ghosh - Unabridged,4.4,46,https://www.amazon.in/MSD-Man-Leader-Biswadeep-Ghosh/dp/8129135817,8129135817,₹272.26,Paperback
"Outstanding Sportsman's Biography: Steffi Graf",by Ileen Bear - Import,,,https://www.amazon.in/Outstanding-Sportsmans-Biography-Steffi-Graf/dp/9387513270,9387513270,₹146.25,Paperback
"The Anatomy of Stretching, Second Edition: Your Illustrated Guide to Flexibility...",by Brad Walker,4.4,5,https://www.amazon.in/Anatomy-Stretching-Second-Illustrated-Rehabilitation/dp/1583943714,1583943714,₹1,250,Paperback
"The Men's Health Big Book of Exercises: Four Weeks to a Leaner, Stronger, More...",by Adam Campbell MS  CSCS,4.4,12,https://www.amazon.in/Mens-Health-Big-Book-Exercises/dp/1623368413,1623368413,₹606.44,Paperback
"Sports Medicine, Physiotherapy and Rehabilitation",by Dr. Abhay N. Buchha,5,1,https://www.amazon.in/Sports-Medicine-Physiotherapy-Rehabilitation-Buchha/dp/8178799812,8178799812,₹220,Paperback
"Blue 17" Classic Sport Wholesale Backpack - Bulk case of 24 bookbags",by true brand,,,https://www.amazon.in/Blue-Classic-Sport-Wholesale-Backpack/dp/B07GC7G9MF,B07GC7G9MF,₹15,979,
"Eiger Dreams: Ventures Among Men and Mountains",by Jon Krakauer,3.8,11,https://www.amazon.in/Eiger-Dreams-Ventures-Among-Mountains/dp/0330370006,0330370006,₹319,Paperback
"Delavier's Core Training Anatomy",by Frederic Delavier,4.6,3,https://www.amazon.in/Delaviers-Training-Anatomy-Frederic-Delavier/dp/1450413994,1450413994,₹1,289,Paperback
"The Deal (Off-Campus Book 1)",by Elle Kennedy,4.7,6,https://www.amazon.in/Deal-Off-Campus-Book-1-ebook/dp/B00TG1CZFC,B00TG1CZFC,₹0,Kindle Edition
"Ram - Scion of Ikshvaku (Book 1 - Ram Chandra Series): 2015 Edition with Updated...",by Amish Tripathi,4.1,4651,https://www.amazon.in/Ram-Scion-Ikshvaku-Chandra-Updated/dp/9385152149,9385152149,₹240,Paperback
"Savage Summit: The Life and Death of the First Women of K2",by Jennifer Jordan - Import,5,1,https://www.amazon.in/Savage-Summit-Death-First-Women/dp/0060587164,0060587164,₹308,Paperback
"ACSM's Resources for the Personal Trainer",by American College of Sports Medicine,5,1,https://www.amazon.in/Resources-Personal-Trainer-American-Medicine/dp/1496322894,1496322894,₹3,172,Hardcover
"Ace against Odds",by Sania Mirza,4.1,68,https://www.amazon.in/Ace-against-Odds-Sania-Mirza/dp/9351362639,9351362639,₹290,Hardcover
"Health Education and Sports Nutrition (M.P.Ed. New Syllabus) (Hindi)",by Dr. S. Narayan murthy,,,https://www.amazon.in/Health-Education-Nutrition-M-P-Ed-Syllabus/dp/B07C1PDDPW,B07C1PDDPW,₹280,Paperback
"Michael Jordan (Legends in Sports)",by Matt Christopher,4.7,75,https://www.amazon.in/Michael-Jordan-Legends-Sports-Christopher/dp/0316023809,0316023809,₹236,Paperback
"Sir Matt Busby: The Man Who Made a Football Club",by Patrick Barclay,,,https://www.amazon.in/Sir-Matt-Busby-Made-Football/dp/1785032089,1785032089,₹259,Paperback
"A Textbook Of Sports & Exercise Physiology",by Kumar Dey,1,1,https://www.amazon.in/Textbook-Sports-Exercise-Physiology/dp/9350258730,9350258730,₹618,Paperback
"Sports Nutrition: Maximizing Performance: A Condensed Guide on How Nutrients...",by Meg FitzGerald Heithcock,4,1,https://www.amazon.in/Sports-Nutrition-Maximizing-Performance-Condensed/dp/098859319X,098859319X,₹716,Paperback
"Tiger Woods: Shortlisted for the William Hill Sports Book of the Year 2018",by Jeff Benedict,4.5,2,https://www.amazon.in/Tiger-Woods-Shortlisted-William-Sports-ebook/dp/B0791LQW14,B0791LQW14,₹327.45,Kindle Edition
"Born to Run: The hidden tribe, the ultra-runners, and the greatest race the world...",by Christopher McDougall,4.6,150,https://www.amazon.in/Born-Run-hidden-ultra-runners-greatest/dp/1861978774,1861978774,₹459,Paperback
"Sport Nutrition for Coaches",by Leslie Bonci - Import,4.5,11,https://www.amazon.in/Sport-Nutrition-Coaches-Leslie-Bonci/dp/0736069178,0736069178,₹759,Paperback
"The Men's Health Diet: 27 Days to Sculpted Abs, Maximum Muscle & Superhuman Sex!",by Stephen Perrine,4.2,4,https://www.amazon.in/Mens-Health-Diet-Sculpted-Superhuman/dp/1609619919,1609619919,₹432,Paperback
"Sports Medicine, Physiotherapy and Rehabilitation (Khel Chikitsa Physiotheraphy...",by Dr. Jitender Thakur,,,https://www.amazon.in/Medicine-Physiotherapy-Rehabilitation-Chikitsa-Physiotheraphy/dp/B0771N8WC6,B0771N8WC6,₹200,Paperback
"Winning With Data: CRM and Analytics for the Business of Sports",by Fiona Green - Import,5,1,https://www.amazon.in/Winning-Data-Analytics-Business-Sports/dp/1138090638,1138090638,₹2,804,Hardcover
"The Illustrated History of Football - Book 2 (Hall of Fame)",by David Squires,5,3,https://www.amazon.in/Illustrated-History-Football-Book-Hall/dp/1780895593,1780895593,₹495,Hardcover
"SMART TASS (The OHellNO Series Book 1)",by Mimi Jean Pamfiloff,4,1,https://www.amazon.in/SMART-TASS-OHellNO-Book-1-ebook/dp/B06XW2B4VD,B06XW2B4VD,₹0,Kindle Edition
"The Fire Burns Blue: A History of Women's Cricket in India",by Sidhanta Patnaik,4.5,2,https://www.amazon.in/Fire-Burns-Blue-History-Cricket/dp/9387894436,9387894436,₹527,Hardcover
"Zen And The Art Of Motorcycle Maintenance: 40th Anniversary Edition",by Robert Pirsig - Special Edition,4.2,59,https://www.amazon.in/Zen-Art-Motorcycle-Maintenance-Anniversary/dp/0099598167,0099598167,₹338,Paperback
"Surya Namaskar",by Satyananda Saraswati,4.7,38,https://www.amazon.in/Surya-Namaskar-Satyananda-Saraswati/dp/8185787352,8185787352,₹178,Paperback
"El Diego: The Autobiography of the World's Greatest Footballer",by Diego Armando Maradona,4.4,8,https://www.amazon.in/El-Diego-Autobiography-Greatest-Footballer/dp/0224071904,0224071904,₹390,Paperback
"Shaareerik shiksha Aur Khelkud Mein Vyavharik Saankhyikee / Applied Statistics...",by Kusumlata,,,https://www.amazon.in/Shaareerik-Vyavharik-Saankhyikee-Statistics-Education/dp/B07LGFG912,B07LGFG912,₹220,Paperback
"Sports Management (khel prabandhan) (B.P.Ed. New Syllabus) (Hindi)",by Based on B.P.Ed. Syllabus according to NCTE New Syllabus,,,https://www.amazon.in/Sports-Management-prabandhan-B-P-Ed-Syllabus/dp/B0776CL9F7,B0776CL9F7,₹200,Paperback
"Outstanding Sportsman's Biography: Usain Bolt",by Nevaeh Melancon - Import,,,https://www.amazon.in/Outstanding-Sportsmans-Biography-Usain-Bolt/dp/9387513181,9387513181,₹146.25,Paperback
"Stillness and Speed: My Story",by Dennis Bergkamp,4.6,10,https://www.amazon.in/Stillness-Speed-Story-Dennis-Bergkamp/dp/1471129535,1471129535,,Paperback
"Messi 2018 (Luca Caioli)",by Luca Caioli,5,7,https://www.amazon.in/Messi-2018-Luca-Caioli/dp/1785782304,1785782304,₹399,Paperback
"A Sport and a Pastime: Picador Classic",by James Salter,5,1,https://www.amazon.in/Sport-Pastime-Picador-Classic/dp/150982331X,150982331X,₹450,Paperback
"DK Biography: Pele: A Photographic Story of a Life",by James Buckley Jr.,4.8,21,https://www.amazon.in/DK-Biography-Pele-Photographic-Story/dp/075662987X,075662987X,₹299,Paperback
"B.P.ED. NEW SYLLYBUS. Sports Psychology and Sociology",by Prof. V. Satyanarayana,4,1,https://www.amazon.in/B-P-ED-SYLLYBUS-Sports-Psychology-Sociology/dp/B0771LNHH6,B0771LNHH6,₹220,Paperback
"Nancy Clark's Sports Nutrition Guidebook",by Nancy Clark - Import,4.4,201,https://www.amazon.in/Nancy-Clarks-Sports-Nutrition-Guidebook/dp/0736074155,0736074155,₹875.91,Paperback
"Clinical Sports Medicine With CD-ROM",by Peter Brukner,4.7,4,https://www.amazon.in/Clinical-Sports-Medicine-CD-ROM-Brukner/dp/0070230099,0070230099,₹1,350,Hardcover
"Just Say Yes: Indianapolis Eagles Series Book 1",by Samantha Lind,4.3,87,https://www.amazon.in/Just-Say-Yes-Indianapolis-Eagles-ebook/dp/B075PGXJ3K,B075PGXJ3K,₹0,Kindle Edition
"Sport Stars",by Pegasus Team - Import,5,1,https://www.amazon.in/Sport-Stars-Pegasus-Team/dp/8131937143,8131937143,₹141.50,Paperback
"The Everything Kids' Soccer Book: Rules, Techniques, and More About Your Favorite...",by Deborah W Crisfield,4.4,110,https://www.amazon.in/Everything-Kids-Soccer-Book-Techniques/dp/1440586888,1440586888,₹646,Paperback
"Sport Bikes (Gearhead Garage)",by Peter Bodensteiner,,,https://www.amazon.in/Sport-Bikes-Gearhead-Garage-Bodensteiner/dp/1680722611,1680722611,₹98,Hardcover
"Bounce: The Myth of Talent and the Power of Practice",by Matthew Syed,4.4,18,https://www.amazon.in/Bounce-Myth-Talent-Power-Practice/dp/0007350546,0007350546,₹275.11,Paperback
"The New Encyclopedia of Modern Bodybuilding: The Bible of Bodybuilding, Fully...",by Schwarzenegger,4.5,148,https://www.amazon.in/New-Encyclopedia-Modern-Bodybuilding-Updated/dp/0684857219,0684857219,₹1,049,Paperback
"A Gift of Passion: Wrapped In Run",by Hemanta Pati,5,7,https://www.amazon.in/Gift-Passion-Wrapped-Run/dp/9387502147,9387502147,₹199,Paperback
"Stars of World Soccer (World Soccer Legends)",by Illugi Jokulsson,4.7,30,https://www.amazon.in/Stars-World-Soccer-Legends/dp/0789212390,0789212390,₹639,Hardcover
"Routledge Handbook of Sport Management",by imusti,5,1,https://www.amazon.in/Routledge-Handbook-of-Sport-Management/dp/1138777250,1138777250,₹3,739,
"Sports Psychology (M.P.Ed. New Syllabus) (Hindi)",by Dr. Khailash Kotikrao Pawar,,,https://www.amazon.in/Sports-Psychology-M-P-Ed-Syllabus-Hindi/dp/B07CBS1JKY,B07CBS1JKY,₹280,Paperback
"The Little Book of Talent",by Daniel Coyle,4.6,19,https://www.amazon.in/Little-Book-Talent-Daniel-Coyle/dp/1847946798,1847946798,₹319,Paperback
"Shinrin-Yoku: The Art and Science of Forest Bathing",by Dr Qing Li,5,2,https://www.amazon.in/Shinrin-Yoku-Art-Science-Forest-Bathing/dp/0241346959,0241346959,₹389,Hardcover
"BMA Bad Back Book: 2nd Edition Fully Revised and Updated",by DK - Import,5,4,https://www.amazon.in/BMA-Bad-Back-Book-Revised/dp/0241317894,0241317894,₹364,Paperback
"My Little General Knowledge Quiz Book Vol 1: 100 Multiple-Choice Questions",by Bernard Morris,3.7,13,https://www.amazon.in/Little-General-Knowledge-Quiz-Book-ebook/dp/B073R5Z7VJ,B073R5Z7VJ,₹0,Kindle Edition
"The Karate Mouse: 40 (Geronimo Stilton)",by Geronimo Stilton,4.4,86,https://www.amazon.in/Karate-Mouse-40-Geronimo-Stilton/dp/054510369X,054510369X,₹251,Paperback
"The Zoya Factor",by Anuja Chauhan,4.1,62,https://www.amazon.in/Zoya-Factor-Anuja-Chauhan/dp/9385724835,9385724835,₹227,Paperback
"The Ultimate Sports Quiz Book",by Derek O'Brien,2,1,https://www.amazon.in/Ultimate-Sports-Quiz-Book/dp/014302969X,014302969X,₹225,Paperback
"Football School: The Amazing Quiz Book",by Alex Bellos,5,1,https://www.amazon.in/Football-School-Amazing-Quiz-Book/dp/1406379581,1406379581,₹269,Paperback
"Sports Journalism And Mass Media (New Syllabus)",by Dr. Hoshiyar Singh,,,https://www.amazon.in/Sports-Journalism-Mass-Media-Syllabus/dp/817524898X,817524898X,₹250,Paperback
"Into Thin Air: A Personal Account of the Everest Disaster",by Jon Krakauer,4.7,117,https://www.amazon.in/Into-Thin-Air-Personal-Disaster/dp/1447200187,1447200187,₹359,Paperback
"History, Principles & Foundation of Physical Education (in Hindi)",by Jang Bahadur,,,https://www.amazon.in/History-Principles-Foundation-Physical-Education/dp/8178799049,8178799049,₹180,Paperback
"Sports Manga Essentials (Manga 101)",by Oda, Eiichiro,Kishimoto, Masashi,Tsukuda, Yuto,Kubo, Tite,Takeuchi, Ryosuke,5,1,https://www.amazon.in/Sports-Manga-Essentials-101-ebook/dp/B01IQF31H4,B01IQF31H4,₹0,Kindle Edition
"HBR's 10 Must Reads: On Managing People (Harvard Business Review Must Reads)",by HBR,4.7,11,https://www.amazon.in/HBRs-10-Must-Reads-Managing/dp/1422158012,1422158012,₹555,Paperback
"Sports Management (B.P.Ed. New Syllabus)",by Maheep Prof. V. Satyanarayana,,,https://www.amazon.in/Sports-Management-B-P-Ed-New-Syllabus/dp/B07C1QP2FL,B07C1QP2FL,₹220,Paperback
