Title,Author,Rating,Reviews Count,URL,ISBN-10,Price,Binding
"The Motorcycle Diaries",by Ernesto 'Che' Guevara,4.5,204,https://www.amazon.in/Motorcycle-Diaries-Ernesto-Che-Guevara/dp/0007272901,0007272901,₹218,Paperback
"Little Artist Series Sports: Copy Colour Books",by Wonder House Books Editorial,,,https://www.amazon.in/Little-Artist-Sports-Colour-Books/dp/9387779971,9387779971,₹49,Paperback
"Indian Sports Conversations and Reflections",by Vijayan Bala - Import,,,https://www.amazon.in/Indian-Sports-Conversations-Reflections-Vijayan/dp/9387456749,9387456749,₹299,Paperback
"Sporting Times: 175 Years",by Times Group,4.3,3,https://www.amazon.in/Sporting-Times-175-Years-Group/dp/9382299408,9382299408,₹500,Hardcover
"Let Me Love You (Australian Sports Star Series Book 2)",by Iris Blobel,3.1,5,https://www.amazon.in/Love-Australian-Sports-Star-Book-ebook/dp/B00RQRKAXM,B00RQRKAXM,₹233.64,Kindle Edition
"250 Days: Cantona’s Kung Fu and the Making of Man U",by Daniel Storey - Import,,,https://www.amazon.in/250-Days-Cantonas-Kung-Making/dp/0008320497,0008320497,₹806,Hardcover
"How to Build a Car: The Autobiography of the World’s Greatest Formula 1 Designer",by Adrian Newey,4.6,18,https://www.amazon.in/How-Build-Car-Autobiography-Greatest/dp/000819680X,000819680X,₹899,Hardcover
"Free Hit: The Story of Women's Cricket in India",by Suprita Das,5,1,https://www.amazon.in/Free-Hit-Story-Womens-Cricket/dp/9353024552,9353024552,₹311,Paperback
"Red Card",by Kautuk Srivastava,4.8,12,https://www.amazon.in/Red-Card-Kautuk-Srivastava/dp/0143441957,0143441957,₹185,Paperback
"Harper's Bazaar India - Jan-Feb 2019",by Living Media India Limited,,,https://www.amazon.in/Harpers-Bazaar-India-Jan-Feb-2019/dp/B07MHLC82K,B07MHLC82K,₹200,Paperback
"Guts & Glory",by Makarand Waingankar - Import,,,https://www.amazon.in/Guts-Glory-Makarand-Waingankar/dp/8184956142,8184956142,₹104,Paperback
"Cricket: 1 (Sports)",by Pegasus,4.2,3,https://www.amazon.in/Cricket-1-Sports-Pegasus/dp/8131913473,8131913473,₹86,Paperback
"Beauty and the Blitz: A Sports Romance (Touchdowns and Tiaras Book 1)",by Sosie Frost,4.5,341,https://www.amazon.in/Beauty-Blitz-Sports-Romance-Touchdowns-ebook/dp/B01FIGE8YE,B01FIGE8YE,₹0,Kindle Edition
"Us Against You: From The New York Times Bestselling Author of A Man Called Ove...",by Fredrik Backman,4.7,8,https://www.amazon.in/Us-Against-You-Bestselling-Beartown/dp/0718186605,0718186605,₹494,Paperback
"Us Against You: From The New York Times Bestselling Author of A Man Called Ove...",by Fredrik Backman,4.7,8,https://www.amazon.in/Us-Against-You-Bestselling-Beartown/dp/0718186605,0718186605,₹494,Paperback
"Black Box Thinking: Psychology",by Matthew Syed,4.4,26,https://www.amazon.in/Black-Box-Thinking-Matthew-Syed/dp/1473613809,1473613809,₹377,Paperback
"Strength Training Anatomy",by Frederic Delavier,4.4,27,https://www.amazon.in/Strength-Training-Anatomy-Frederic-Delavier/dp/0736092269,0736092269,₹1,146,Paperback
"Geronimo and the Gold Medal Mystery: 33 (Geronimo Stilton)",by Geronimo Stilton,4.1,20,https://www.amazon.in/Geronimo-Gold-Medal-Mystery-Stilton/dp/0545021332,0545021332,₹184,Mass Market Paperback
"ROAR: How to Match Your Food and Fitness to Your Unique Female Physiology for...",by Stacy Sims,4.6,108,https://www.amazon.in/ROAR-Fitness-Physiology-Optimum-Performance/dp/1623366860,1623366860,₹643,Paperback
"Cristiano and Leo: The Race to Become the Greatest Football Player of All Time...",by Jimmy Burns,4.6,6,https://www.amazon.in/Cristiano-Leo-Become-Greatest-Football/dp/1509849130,1509849130,₹389,Paperback
"21 Popular Sports and Games : Rules and Regulations",by B.K. Chaturvedi,,,https://www.amazon.in/21-Popular-Sports-Games-Regulations/dp/8172451229,8172451229,₹271,Paperback
"Cricket: 1 (Sports)",by Pegasus,4.2,3,https://www.amazon.in/Cricket-1-Sports-Pegasus/dp/8131913473,8131913473,₹86,Paperback
"Advanced Sports Nutrition",by Dan Benardot,5,2,https://www.amazon.in/Advanced-Sports-Nutrition-Dan-Benardot/dp/1450401619,1450401619,,Paperback
"India At the Olympic Games",by Deeya Nayar,2.9,2,https://www.amazon.in/India-Olympic-Games-Deeya-Nayar/dp/9350461897,9350461897,₹91,Paperback
"The Story of the World Cup: 2018",by Brian Glanville - Import,4.4,11,https://www.amazon.in/Story-World-Cup-2018/dp/0571325564,0571325564,₹450,Paperback
"Coaching for Performance",by John Whitmore,5,4,https://www.amazon.in/Coaching-Performance-John-Whitmore/dp/1473658128,1473658128,₹2,172.98,Paperback
"A Little Bit of Deja Vu (Return to Redemption, Book 1)",by Laurie Kellogg,4,2,https://www.amazon.in/Little-Deja-Return-Redemption-Book-ebook/dp/B007T327LQ,B007T327LQ,₹0,Kindle Edition
"Dean Jones' Cricket Tips: The things They Don't Teach You at the Academy",by Dean Jones,4.9,11,https://www.amazon.in/Dean-Jones-Cricket-Tips-Academy/dp/9386224666,9386224666,₹169,Paperback
"Cricket Quiz Book: Facts, Trivia and Anecdotes from the Game",by Kalyan B. Bhattacharyya,4,1,https://www.amazon.in/Cricket-Quiz-Book-Trivia-Anecdotes/dp/8129151731,8129151731,₹153,Paperback
"17" Kids Black mesh Sport Wholesale Backpacks - Bulk case of 24 bookbags",by moda west,,,https://www.amazon.in/Kids-Black-Sport-Wholesale-Backpacks/dp/B07F9418PP,B07F9418PP,₹25,429,
"Man Eaters of Kumaon",by Corbett Jim,4.7,114,https://www.amazon.in/Man-Eaters-Kumaon-Corbett-Jim/dp/0195622553,0195622553,₹233,Paperback
"Match Annual 2019 (Annuals 2019)",by MATCH,4.5,2,https://www.amazon.in/Match-Annual-2019-Annuals/dp/0752266071,0752266071,₹340,Hardcover
"My Turn: The Autobiography",by Johan Cruyff,4.8,7,https://www.amazon.in/My-Turn-Autobiography-Johan-Cruyff/dp/1509813926,1509813926,₹354,Paperback
"National Geographic Kids Dinos Sticker Activity Book: Over 1,000 Stickers! (NG...",by National Geographic Kids,5,3,https://www.amazon.in/National-Geographic-Dinos-Sticker-Activity/dp/1426317735,1426317735,₹900.32,Paperback
"Usain Bolt: 9.58",by Usain Bolt,4.2,10,https://www.amazon.in/Usain-Bolt-9-58-ebook/dp/B004APA524,B004APA524,₹593.18,Kindle Edition
"Rajesh Khanna : The Untold Story of India's First Superstar",by Yasser Usman,4.4,43,https://www.amazon.in/Rajesh-Khanna-Untold-Indias-Superstar/dp/0143423614,0143423614,₹332,Paperback
"Contemporary Issues in Physical Education, Fitness and Wellness (B.P.Ed. New...",by Dr. Parmod Singh,,,https://www.amazon.in/Contemporary-Physical-Education-Wellness-Syllabus/dp/B07FSJY824,B07FSJY824,₹200,Paperback
"Sports Medicine (M.P.Ed. New Syllabus)",by Dr. Ramesh Chnadra Pradhan,,,https://www.amazon.in/Sports-Medicine-M-P-Ed-New-Syllabus/dp/B07DY7JGZD,B07DY7JGZD,₹220,Paperback
"Theory of Sports & Games (Khelkud ke Siddhant) (B.P.Ed. New Syllabus) (Hindi)",by Dr. Abhay N. Buchha,,,https://www.amazon.in/Theory-Khelkud-Siddhant-B-P-Ed-Syllabus/dp/B0771MW89X,B0771MW89X,₹220,Paperback
"The Midwife’s Here!",by Linda Fairley - Import,4.5,311,https://www.amazon.in/Midwifes-Here-Linda-Fairley/dp/0007446306,0007446306,₹186,Paperback
"Strength Training: The Complete Step-by-Step Guide to a Stronger, Sculpted Body...",by DK,4.8,8,https://www.amazon.in/Strength-Training-Complete-Step-Step/dp/1405344377,1405344377,₹664,Paperback
"Cristiano Ronaldo: The Biography",by Guillem Balague,4.2,9,https://www.amazon.in/Cristiano-Ronaldo-Biography-Guillem-Balague/dp/1409155064,1409155064,₹420,Paperback
"Runner's World Run Less, Run Faster: Become a Faster, Stronger Runner with the...",by Bill Pierce Ed.D.,4.8,13,https://www.amazon.in/Runners-World-Faster-3-Run-Week/dp/1609618025,1609618025,₹746,Paperback
"Friend Zone: A New Adult College Romance (Just Friends Book 2)",by Camilla Isley,4.2,20,https://www.amazon.in/Friend-Zone-College-Romance-Friends-ebook/dp/B01MZA213Z,B01MZA213Z,₹3.89,Kindle Edition
"Anywhere But Home: Adventures in Endurance",by Anu Vaidyanathan,4.5,77,https://www.amazon.in/Anywhere-But-Home-Adventures-Endurance/dp/9351775240,9351775240,₹280,Paperback
"Let's Crack CDS Exam - Combined Defence Services Examination [Free eBooks Inside]",by SSBCrack,3.7,65,https://www.amazon.in/Lets-Crack-CDS-Exam-Examination/dp/8193108736,8193108736,₹390,Paperback
"Dr. Jordan Metzl's Running Strong: The Sports Doctor's Complete Guide to Staying...",by Jordan Metzl MD,5,2,https://www.amazon.in/Dr-Jordan-Metzls-Running-Strong/dp/1623364590,1623364590,₹562.44,Paperback
"The Elite Batter",by Rajesh Kamath,4.9,76,https://www.amazon.in/Elite-Batter-Rajesh-Kamath/dp/B06XKY4JX6,B06XKY4JX6,₹251,Paperback
"Ultramarathon Man: Confessions of an All-Night Runner",by Dean Karnazes,4.7,4,https://www.amazon.in/Ultramarathon-Man-Confessions-All-Night-Runner/dp/1585424803,1585424803,₹348,Paperback
"Match of the Day Annual 2019 (Annuals 2019)",by Various,5,2,https://www.amazon.in/Match-Day-Annual-2019-Annuals/dp/1785942972,1785942972,₹319,Hardcover
"The Mamba Mentality: How I Play",by Kobe Bryant - Import,5,2,https://www.amazon.in/Mamba-Mentality-How-Play/dp/0374201234,0374201234,₹2,209,Hardcover
"Lonely Planet Trekking in the Nepal Himalaya (Travel Guide)",by Lonely Planet,4.4,5,https://www.amazon.in/Lonely-Planet-Trekking-Himalaya-Travel-ebook/dp/B0197I1W7K,B0197I1W7K,₹861.65,Kindle Edition
"Miles to Run Before I Sleep: How an Ordinary Woman Ran an Extraordinary Distance",by Sumedha Mahajan,4.6,84,https://www.amazon.in/Miles-Run-Before-Sleep-Extraordinary/dp/8129135469,8129135469,₹185,Paperback
"Captain Cool: The M.S. Dhoni Story - 4th Revised Edition",by Gulu Ezekiel,4.4,11,https://www.amazon.in/Captain-Cool-Dhoni-Story-Revised/dp/8193655648,8193655648,₹218,Paperback
"Run to Realise",by Abhishek Mishra,4.7,12,https://www.amazon.in/Run-Realise-Abhishek-Mishra/dp/1644292629,1644292629,₹299,Paperback
"History of Indian Cinema",by Renu Saran,2.9,23,https://www.amazon.in/History-Indian-Cinema-Renu-Saran/dp/8128837613,8128837613,₹238,Paperback
"Spinderella",by Julia Donaldson,5,1,https://www.amazon.in/Spinderella-Julia-Donaldson/dp/140528272X,140528272X,₹323.93,Paperback
"The Man Eating Leopard of Rudraprayag",by Jim Corbett - Import,4.7,72,https://www.amazon.in/Man-Eating-Leopard-Rudraprayag/dp/8129141841,8129141841,₹140,Paperback
"A Feast of Vultures: The Hidden Business of Democracy in India",by Josy Joseph,4.5,254,https://www.amazon.in/Feast-Vultures-Hidden-Business-Democracy/dp/9350297515,9350297515,₹522.95,Hardcover
"Easier Said Than Done: A Life in Sport",by Alan Wilkins,4,1,https://www.amazon.in/Easier-Said-Than-Done-Sport/dp/819375011X,819375011X,₹476,Hardcover
"Think Like a Warrior: The Five Inner Beliefs That Make You Unstoppable: Volume...",by Darrin Donnelly,5,1,https://www.amazon.in/Think-Like-Warrior-Beliefs-Unstoppable/dp/0692705465,0692705465,₹955,Paperback
"Lonely Planet Trekking in the Nepal Himalaya (Travel Guide)",by Lonely Planet,4.4,5,https://www.amazon.in/Lonely-Planet-Trekking-Himalaya-Travel-ebook/dp/B0197I1W7K,B0197I1W7K,₹861.65,Kindle Edition
"Inverting the Pyramid (reissue)",by Jonathan Wilson,4,9,https://www.amazon.in/Inverting-Pyramid-reissue-Jonathan-Wilson/dp/1474609295,1474609295,₹492.97,Paperback
"Peak: Secrets from the New Science of Expertise",by Anders Ericsson,4.5,13,https://www.amazon.in/Peak-Secrets-New-Science-Expertise/dp/0544947223,0544947223,₹543,Paperback
"The New Toughness Training for Sports: Mental Emotional Physical Conditioning...",by James E. Loehr,5,2,https://www.amazon.in/New-Toughness-Training-Sports-Conditioning/dp/0452269989,0452269989,₹649,Paperback
"How Champions Think: In Sports and in Life",by Dr. Bob Rotella,4.3,98,https://www.amazon.in/How-Champions-Think-Sports-Life/dp/1476788642,1476788642,₹876,Paperback
"Jim Stoppani's Encyclopedia of Muscle & Strength",by PhD Jim Stoppani,4.1,14,https://www.amazon.in/Jim-Stoppanis-Encyclopedia-Muscle-Strength/dp/1450459749,1450459749,₹1,451,Paperback
"High Tea & Flip-Flops (A High Tea & Flip-Flops Novel Book 1)",by Linda Cassidy Lewis,4,1,https://www.amazon.in/High-Tea-Flip-Flops-Novel-Book-ebook/dp/B00YNKHFII,B00YNKHFII,₹135.45,Kindle Edition
"Legacy: 15 Lessons in Leadership",by James Kerr,4.5,5,https://www.amazon.in/Legacy-Lessons-Leadership-James-Kerr/dp/147210353X,147210353X,₹365,Paperback
"The Queen Elizabeth Family (The Family Series) (Enid Blyton Family Series)",by Enid Blyton,5,1,https://www.amazon.in/Queen-Elizabeth-Family-Enid-Blyton/dp/140528952X,140528952X,₹185,Paperback
"Brukner & Khan's Clinical Sports Medicine",by Brukner & Khan's,5,1,https://www.amazon.in/Brukner-Khans-Clinical-Sports-Medicine/dp/9353160790,9353160790,₹3,295,Hardcover
"Reach-to-Grasp Behavior: Brain, Behavior, and Modelling Across the Life Span...",by Daniela Corbetta - Import,,,https://www.amazon.in/Reach-Grasp-Behavior-Modelling-Developmental/dp/1138683221,1138683221,₹3,832,Paperback
"Pigeon Racing- Deep into Sport - Diseases and Treatment (Pigeon Racing - Deep...",by Dacian Busecan,4.2,13,https://www.amazon.in/Pigeon-Racing-Deep-into-Sport-ebook/dp/B00MCIP5G2,B00MCIP5G2,₹449,Kindle Edition
"The Mixer: The Story of Premier League Tactics, from Route One to False Nines",by Michael Cox,4.6,5,https://www.amazon.in/Mixer-Story-Premier-League-Tactics/dp/0008215553,0008215553,₹1,927.23,Paperback
"Nine Man Eaters and One Rogue",by Kenneth Anderson,4.6,32,https://www.amazon.in/Nine-Man-Eaters-One-Rogue/dp/8129116421,8129116421,₹295,Paperback
"Muscle Myths: 50 Health & Fitness Mistakes You Don't Know You're Making (The...",by Michael Matthews,4.3,9,https://www.amazon.in/Muscle-Myths-Fitness-Mistakes-Healthy-ebook/dp/B007GC5KNW,B007GC5KNW,₹0,Kindle Edition
"HBR's 10 Must Reads for New Managers (with Bonus Article 'How Managers Become...",by Harvard Business Review,4,3,https://www.amazon.in/Managers-Become-Leaders-Michael-Watkins/dp/1633693023,1633693023,₹471,Paperback
"Taking The Reins (The Rosewoods Book 1)",by Katrina Abbott,5,6,https://www.amazon.in/Taking-Reins-Rosewoods-Book-1-ebook/dp/B00I2OXIT6,B00I2OXIT6,₹0,Kindle Edition
"HBR's 10 Must Reads: On Communication (Harvard Business Review Must Reads)",by HBR,4.5,10,https://www.amazon.in/HBRs-10-Must-Reads-Communication/dp/1422189864,1422189864,₹503,Paperback
"The Jim Corbett Omnibus",by Corbett Jim,4.6,100,https://www.amazon.in/Jim-Corbett-Omnibus/dp/0195627628,0195627628,,Hardcover
"Rupa Book of Literature Quiz",by Sujata Ray,5,1,https://www.amazon.in/Rupa-Book-Literature-Quiz-Sujata/dp/8171670164,8171670164,,Paperback
"Jog On: How Running Saved My Life",by Bella Mackie - Import,5,1,https://www.amazon.in/Jog-How-Running-Saved-Life/dp/0008241759,0008241759,₹437,Hardcover
"architecture on sports facilities",by Carles Broto,,,https://www.amazon.in/architecture-sports-facilities-Carles-Broto/dp/9812451811,9812451811,₹2,294,Paperback
"Sneaker Wars: The Enemy Brothers Who Founded Adidas and Puma and the Family Feud...",by Barbara Smit,3.5,3,https://www.amazon.in/Sneaker-Wars-Brothers-Founded-Business/dp/0061246581,0061246581,₹574,Paperback
"Sunny Days: Sunil Gavaskar's Own Story",by Sunil Gavaskar,4.2,25,https://www.amazon.in/Sunny-Days-Sunil-Gavaskars-Story/dp/8129118017,8129118017,₹150,Paperback
"ChiRunning: A Revolutionary Approach to Effortless, Injury-Free Running",by Danny Dreyer,4.5,7,https://www.amazon.in/ChiRunning-Revolutionary-Approach-Effortless-Injury-Free/dp/1416549447,1416549447,₹949,Paperback
"Sports Book: Predictions For September 18 – September 24th 2014 NCAA Football...",by Football Genius,,,https://www.amazon.in/Sports-Book-Predictions-September-Football-ebook/dp/B00NP0HV4U,B00NP0HV4U,₹213.58,Kindle Edition
"The Captain Class",by Sam Walker,4.6,9,https://www.amazon.in/Captain-Class-Sam-Walker/dp/1785030280,1785030280,₹445,Paperback
"Driven: The Virat Kohli Story",by Vijay Lokapally,4.4,81,https://www.amazon.in/Driven-Virat-Kohli-Vijay-Lokapally/dp/9385936263,9385936263,₹299,Paperback
"The Boys In The Boat",by Daniel James Brown,4.4,27,https://www.amazon.in/Boys-Boat-Daniel-James-Brown/dp/1447210980,1447210980,₹376,Paperback
"Yoga for Kids (Dk)",by Susannah Hoffman,,,https://www.amazon.in/Yoga-Kids-Dk-Susannah-Hoffman/dp/0241341272,0241341272,₹300,Hardcover
"Textbook Of Sports Medicine",by Das,,,https://www.amazon.in/Textbook-Sports-Medicine-Das/dp/8180618617,8180618617,₹403,Paperback
"The Lonely Planet Kids Travel Book: Mind-Blowing Stuff on Every Country in the...",by Lonely Planet Kids,4.2,7,https://www.amazon.in/Lonely-Planet-Kids-Travel-Book-ebook/dp/B016PJQPUI,B016PJQPUI,₹486.12,Kindle Edition
"Schmidek and Sweet: Operative Neurosurgical Techniques 2-Volume Set: Indications...",by Alfredo Quinones-Hinojosa MD  FAANS  FACS,4.5,2,https://www.amazon.in/Schmidek-Sweet-Neurosurgical-Indications-Neurological/dp/1416068392,1416068392,₹25,945,Hardcover
"Lonely Planet New Zealand (Travel Guide)",by Lonely Planet - Import,3.8,6,https://www.amazon.in/Lonely-Planet-Zealand-Travel-Guide/dp/1786570793,1786570793,₹1,082,Paperback
"Gonefishing India",by Suprio Mukherjee - Import,4.3,8,https://www.amazon.in/Gonefishing-India-Suprio-Mukherjee/dp/194814770X,194814770X,₹150,Paperback
"Illustrated History of Indian Cricket",by Boria Majumdar,5,1,https://www.amazon.in/Illustrated-History-Indian-Cricket-Majumdar/dp/8174364498,8174364498,₹1,281,Hardcover
"The Second Jim Corbett Omnibus: My India Jungle Lore Tree Tops",by Corbett Jim - Illustrated,4.8,27,https://www.amazon.in/Second-Jim-Corbett-Omnibus-Jungle/dp/019562968X,019562968X,₹405,Hardcover
"Out of the BOx",by Harsha Bhogle,4.4,10,https://www.amazon.in/Out-BOx-Harsha-Bhogle/dp/0143417509,0143417509,₹260,Paperback
"Beneath the Surface",by Michael Phelps,4.6,3,https://www.amazon.in/Beneath-Surface-Michael-Phelps/dp/1683580877,1683580877,₹699,Paperback
"The Play (Brit Boys Sports Romance Book 1)",by J.H. Croix,4,2,https://www.amazon.in/Play-Brit-Boys-Sports-Romance-ebook/dp/B01MR0BLWG,B01MR0BLWG,₹0,Kindle Edition
"Mbappe (Luca Caioli)",by Luca Caioli - Import,1,1,https://www.amazon.in/Mbappe-Luca-Caioli/dp/1785784188,1785784188,₹291,Paperback
"What's Good About Falling",by Prajwal Hegde,4.7,10,https://www.amazon.in/Whats-About-Falling-Prajwal-Hegde/dp/9353024641,9353024641,₹268,Paperback
"The Running Revolution: How to Run Faster, Farther, and Injury-Free--for Life",by Nicholas Romanov,5,2,https://www.amazon.in/Running-Revolution-Faster-Farther-Injury-Free/dp/014312319X,014312319X,₹612,Paperback
"Indestructibles: Beach Baby (Indestructibles - The Million Copy Series)",by Kate Merritt,4.5,2,https://www.amazon.in/Indestructibles-Beach-Baby-Million-Copy/dp/0761187324,0761187324,₹218,Paperback
"Running Wild: A Shifter Sports Romance (The Real Werewives of Alaska Book 1)",by Kristen Strassel,4.5,32,https://www.amazon.in/Running-Wild-Shifter-Romance-Werewives-ebook/dp/B076G32HLL,B076G32HLL,₹193,Kindle Edition
"Klopp: Bring the Noise",by Raphael Honigstein,5,4,https://www.amazon.in/Klopp-Bring-Noise-Raphael-Honigstein/dp/0224100742,0224100742,₹628,Paperback
"World Beauty's Football Wall Stickers Vinyl Stickers Wall Stickers Art Books...",,,,https://www.amazon.in/Beautys-Football-Stickers-Sports-Bathrooms/dp/B07H41TJWZ,B07H41TJWZ,₹1,111,
"Yoga for Pregnancy, Birth and Beyond",by Francoise Barbira Freedman,4,1,https://www.amazon.in/Pregnancy-Beyond-Francoise-Barbira-Freedman/dp/1405300566,1405300566,,Paperback
"Peppa Pig: Peppa Plays Cricket",by Peppa Pig - Import,,,https://www.amazon.in/Peppa-Pig-Plays-Cricket/dp/0241354005,0241354005,₹155,Board book
"Switch: How to change things when change is hard",by Chip Heath,4.5,43,https://www.amazon.in/Switch-change-things-when-hard/dp/1847940323,1847940323,₹375,Paperback
"I Am Football",by Zlatan Ibrahimovic,5,4,https://www.amazon.in/I-Am-Football-Zlatan-Ibrahimovic/dp/024129715X,024129715X,₹1,147,Hardcover
"HBR's 10 Must Reads: On Making Smart Decisions (Harvard Business Review Must...",by HBR,4.6,8,https://www.amazon.in/HBRs-10-Must-Reads-Decisions/dp/1422189899,1422189899,₹570,Paperback
"The Berenstain Bears Get Their Kicks (First Time Books(R))",by Stan Berenstain,4.6,24,https://www.amazon.in/Berenstain-Bears-Their-Kicks-First/dp/0679889558,0679889558,₹129,Paperback
"The BMA Guide to Sport Injuries",by DK,5,3,https://www.amazon.in/BMA-Guide-Sport-Injuries/dp/1405354283,1405354283,,Paperback
"The Meltdown (Diary of a Wimpy Kid)",by Jeff Kinney - Import,4.7,298,https://www.amazon.in/Meltdown-Diary-Wimpy-Kid/dp/0606415343,0606415343,₹499,Library Binding
"The Wildest Sport of All",by Prakash Singh,3.5,4,https://www.amazon.in/Wildest-Sport-All-Prakash-Singh/dp/9351770540,9351770540,₹314,Paperback
"Fake Out (Fake Boyfriend Book 1)",by Eden Finley,4.6,285,https://www.amazon.in/Fake-Out-Boyfriend-Book-ebook/dp/B07BHP2LZ9,B07BHP2LZ9,₹259,Kindle Edition
"The Women's Health Big Book of Exercises: Four Weeks to a Leaner, Sexier, Healthier...",by Adam Campbell MS  CSCS,5,4,https://www.amazon.in/Womens-Health-Big-Book-Exercises/dp/162336843X,162336843X,₹600,Paperback
"Yoga Question Bank For Certification of Yoga Professionals (Level-1 & Level-2...",by Satpal Khichar,,,https://www.amazon.in/Question-Certification-Professionals-Level-1-Level-2/dp/B07LGFHQ8F,B07LGFHQ8F,₹350,Paperback
"Games Indians Play",by V. Raghunathan,4.2,23,https://www.amazon.in/Games-Indians-Play-V-Raghunathan/dp/0143063111,0143063111,₹215,Paperback
"Mid-Wicket Tales: From Trumper to Tendulkar",by S Giridhar,4.6,18,https://www.amazon.in/Mid-Wicket-Tales-Trumper-Tendulkar-Giridhar/dp/8132117387,8132117387,₹440,Paperback
"Love & College: New Adult & College Romance Anthology",by Lexy Timms,3.4,6,https://www.amazon.in/Love-College-Adult-Romance-Anthology-ebook/dp/B00Q0DGC8U,B00Q0DGC8U,₹0,Kindle Edition
"Cricket Ke Unsune Kisse",by Shivendra Kumar,4,1,https://www.amazon.in/Cricket-Unsune-Kisse-Shivendra-Kumar/dp/0143446118,0143446118,₹179,Paperback
"The India A-Z Quiz Book",by Derek O’Brien - Import,3.9,5,https://www.amazon.in/India-Z-Quiz-Book/dp/8129148277,8129148277,₹185,Paperback
"A Champion's Mind: Lessons from a Life in Tennis",by Pete Sampras,4.6,6,https://www.amazon.in/Champions-Mind-Lessons-Life-Tennis/dp/030738330X,030738330X,₹430,Paperback
"Yoga Education (Yog Shiksha) (B.P.Ed. New Syllabus) (Hindi)",by Dr. Tarak Nath Pramanik,,,https://www.amazon.in/Education-Shiksha-B-P-Ed-Syllabus-Hindi/dp/B07FSL47B6,B07FSL47B6,₹250,Paperback
"All My Cricket Heroes Autograph Book: For the Fans of Famous and Undiscovered...",by Eventful Books - Import,,,https://www.amazon.in/All-Cricket-Heroes-Autograph-Book/dp/172938918X,172938918X,₹1,071,Paperback
"Wildcat (Mavericks Tackle Love Book 1)",by Max Monroe,4.6,191,https://www.amazon.in/Wildcat-Mavericks-Tackle-Love-Book-ebook/dp/B079FFHV67,B079FFHV67,₹0,Kindle Edition
"The Anatomy of Manchester United: A History in Ten Matches",by Jonathan Wilson,,,https://www.amazon.in/Anatomy-Manchester-United-History-Matches/dp/1409126951,1409126951,₹437,Paperback
"Undisputed Truth: My Autobiography",by Mike Tyson,4.3,17,https://www.amazon.in/Undisputed-Truth-Autobiography-Mike-Tyson/dp/0007502532,0007502532,₹599,Paperback
"Organization and Administration in Physical Education (Sharirik Shiksha me Sangathan...",by Dr. Khailash Kotikrao Pawar,,,https://www.amazon.in/Organization-Administration-Education-Sangathan-Prashasan/dp/B07FSKTWNF,B07FSKTWNF,₹200,Paperback
"50 Football Skills (Activity Books)",by Various - Import,,,https://www.amazon.in/50-Football-Skills-Activity-Books/dp/1409583090,1409583090,₹345,Paperback
"Developing Endurance (Sport Performance Series)",by NSCA,4.5,2,https://www.amazon.in/Developing-Endurance-Sport-Performance-NSCA/dp/0736083278,0736083278,₹1,029,Paperback
"Developing Endurance (Sport Performance Series)",by NSCA,4.5,2,https://www.amazon.in/Developing-Endurance-Sport-Performance-NSCA/dp/0736083278,0736083278,₹1,029,Paperback
"Peak",by Anders Ericsson,4.6,17,https://www.amazon.in/Peak-Anders-Ericsson/dp/0099598477,0099598477,₹433.59,Paperback
"Ali: A Life: Shortlisted for the William Hill Sports Book of the Year 2017",by Jonathan Eig,4.6,127,https://www.amazon.in/Ali-Life-Shortlisted-William-Sports-ebook/dp/B01MS5ORK8,B01MS5ORK8,₹275.06,Kindle Edition
"Numbers Do Lie: 61 Hidden Cricket Stories",by Impact Index,4.2,25,https://www.amazon.in/Numbers-Do-Lie-Cricket-Stories/dp/9352643852,9352643852,₹270,Paperback
"Inside India: Amazing Historical Places",by FunOKPlease,5,1,https://www.amazon.in/Inside-India-Amazing-Historical-Places/dp/9352777468,9352777468,₹230,Paperback
"Bruce Lee Striking Thoughts: Bruce Lee's Wisdom for Daily Living (Bruce Lee Library)",by Bruce Lee,4.4,15,https://www.amazon.in/Bruce-Lee-Striking-Thoughts-Library/dp/0804834717,0804834717,₹870,Paperback
"Let's Play: Puffin Book of Sports Storie",by Harsha Bhogle,,,https://www.amazon.in/Lets-Play-Puffin-Sports-Storie/dp/0143331590,0143331590,₹120,Paperback
"THE LAST WHITE HUNTER: Reminiscences of a colonial shikari",by Joshua Mathew,4.7,23,https://www.amazon.in/LAST-WHITE-HUNTER-Reminiscences-colonial/dp/9385509128,9385509128,₹488,Hardcover
"Mental Training for Peak Performance: Top Athletes Reveal the Mind Exercises...",by Steven Ungerleider Ph.D.,4.3,15,https://www.amazon.in/Mental-Training-Peak-Performance-Exercises/dp/1594860289,1594860289,₹745,Paperback
"Bodyweight Training Guide: 40 Effective Bodyweight Strength Training (Home Workout...",by Patrick Sylvester,4.7,6,https://www.amazon.in/Bodyweight-Training-Guide-Effective-Calisthenics-ebook/dp/B01MSBR1KX,B01MSBR1KX,₹68,Kindle Edition
"Goals of Glory: The Amazing Story of Aizawl Football Club and its Coach",by Neel Sinha,5,3,https://www.amazon.in/Goals-Glory-Amazing-Aizawl-Football/dp/9386215365,9386215365,₹322,Paperback
"I am an Athlete – Read It Yourself with Ladybird Level 2",by LADYBIRD - Import,5,2,https://www.amazon.in/Athlete-Read-Yourself-Ladybird-Level/dp/0241275199,0241275199,₹74,Hardcover
